"","Page Title","Description","Reference","Extent","Content Type","Level","Languages","Scripts","Creation date","Legal","ImgSrc"
"78","Guan di jue shi zhen jing juan xia [19th century]","        Digital images of a mimeograph copy of Guan di jue shi zhen jing juan xia, a sutra for worship of the God of Martial Arts. The original manuscript dates from the 19th century, author and scribe unknown. The copying quality is quite poor in places, and the ink is fading. This is the third part (xia) of this sutra.                                                          View images from this file (53)                                    ","EAP012/8/1/10","53 TIFF images","Manuscript","File","Chinese","Han (Traditional)","19th century","Access is for research purposes only","https://images.eap.bl.uk/EAP012/EAP012_8_1_10/1.jp2/full/!600,300/0/default.jpg"
"79","Wenchang da dong tan jing juan shang [19th century]","        Digital images of a mimeograph copy of Wenchang da dong tan jing juan shang, a sutra for worship of the God of Literature. The original manuscript dates from the 19th century, author and scribe unknown. The copying quality is quite poor in places, and the ink is fading. This is the first (shang) part of this sutra.                                                          View images from this file (66)                                    ","EAP012/8/1/11","66 TIFF images","Manuscript","File","Chinese","Han (Traditional)","19th century","Access is for research purposes only","https://images.eap.bl.uk/EAP012/EAP012_8_1_11/1.jp2/full/!600,300/0/default.jpg"
"80","Wenchang da dong tan jing juan zhong [19th century]","        Digital images of a mimeograph copy of Wenchang da dong tan jing juan zhong, a sutra for worship of the God of Literature. The original manuscript dates from the 19th century, author and scribe unknown. The copying quality is quite poor in places, and the ink is fading. This is the second (zhong) part of this sutra.                                                          View images from this file (84)                                    ","EAP012/8/1/12","84 TIFF images","Manuscript","File","Chinese","Han (Traditional)","19th century","Access is for research purposes only","https://images.eap.bl.uk/EAP012/EAP012_8_1_12/1.jp2/full/!600,300/0/default.jpg"
"81","Wenchang da dong tan jing juan xia [19th century]","        Digital images of a mimeograph copy of Wenchang da dong tan jing juan xia, a sutra for worship of the God of Literature. The original manuscript dates from the 19th century, author and scribe unknown. The copying quality is quite poor in places, and the ink is fading. This is the third (xia) part of this sutra.                                                          View images from this file (105)                                    ","EAP012/8/1/13","105 TIFF images","Manuscript","File","Chinese","Han (Traditional)","19th century","Access is for research purposes only","https://images.eap.bl.uk/EAP012/EAP012_8_1_13/1.jp2/full/!600,300/0/default.jpg"
"82","Dong jing yin yue","        Digital images of Dong jing yin yue, a manuscript book of transcribed Dongjing music scores in jianpu notation. The book dates from the 1980s; however it is unknown when the music was first composed, who the original composer was, or who wrote this transcript.                                                          View images from this file (47)                                    ","EAP012/8/1/14","47 TIFF images","Manuscript","File","Chinese","Han (Traditional)","20th century","Access is for research purposes only","https://images.eap.bl.uk/EAP012/EAP012_8_1_14/1.jp2/full/!600,300/0/default.jpg"
"83","Xiangshan sheng dian yi [19th century]","        Digital images of a mimeograph copy of Xianshan sheng dian yi, a sutra for worship of the Goddess Guanyin. The original woodblock print manuscript dates from the 19th century, and was created by the Chuxiong Dongjing Society. The copying quality is poor in places, and the ink is faded.                                                          View images from this file (111)                                    ","EAP012/8/1/15","111 TIFF images","Manuscript","File","Chinese","Han (Traditional)","19th century","Access is for research purposes only","https://images.eap.bl.uk/EAP012/EAP012_8_1_15/1.jp2/full/!600,300/0/default.jpg"
"84","Xiangshan sheng dian er [19th century]","        Digital images of a mimeograph copy of Xianshan sheng dian er, a sutra for worship of the Goddess Guanyin. The original woodblock print manuscript dates from the 19th century, and was created by the Chuxiong Dongjing Society. The copying quality is poor in places, and the ink is faded.                                                          View images from this file (69)                                    ","EAP012/8/1/16","69 TIFF images","Manuscript","File","Chinese","Han (Traditional)","19th century","Access is for research purposes only","https://images.eap.bl.uk/EAP012/EAP012_8_1_16/1.jp2/full/!600,300/0/default.jpg"
"85","Xiangshan sheng dian san [19th century]","        Digital images of a mimeograph copy of Xianshan sheng dian san, a sutra for worship of the Goddess Guanyin. The original woodblock print manuscript dates from the 19th century, and was created by the Chuxiong Dongjing Society. The copying quality is poor in places, and the ink is faded.                                                          View images from this file (86)                                    ","EAP012/8/1/17","86 TIFF images","Manuscript","File","Chinese","Han (Traditional)","19th century","Access is for research purposes only","https://images.eap.bl.uk/EAP012/EAP012_8_1_17/1.jp2/full/!600,300/0/default.jpg"
"86","Tai shang yu qing wu ji zong zhen Wenchang da dong tan yan xian jing quan bu juan shang [19th century]","        Digital images of Tai shang yu qing wu ji zong zhen Wenchang da dong tan yan xian jing quan bu juan shang, a sutra for worship of the God of Literature. The original manuscript dates from the early 19th century; this copy was created by Rufeng Su in the 1980s. The original author and scribe are unknown. Recitation marks have been annotated in red ink and pencil. This is the first part (shang) of the sutra.                                                          View images from this file (101)                                    ","EAP012/8/1/18","101 TIFF images","Manuscript","File","Chinese","Han (Traditional)","19th century","Access is for research purposes only","https://images.eap.bl.uk/EAP012/EAP012_8_1_18/1.jp2/full/!600,300/0/default.jpg"
"87","Tai shang yu qing wu ji zong zhen Wenchang da dong tan yan xian jing quan bu juan zhong","        Digital images of Tai shang yu qing wu ji zong zhen Wenchang da dong tan yan xian jing quan bu juan zhong, a sutra for worship of the God of Literature. The original manuscript dates from the early 19th century; this copy was created by Rufeng Su in the 1980s. The original author and scribe are unknown. Recitation marks have been annotated in red ink and pencil. This is the second part (zhong) of the sutra.                                                          View images from this file (88)                                    ","EAP012/8/1/19","88 TIFF images","Manuscript","File","Chinese","Han (Traditional)","20th century","Access is for research purposes only","https://images.eap.bl.uk/EAP012/EAP012_8_1_19/1.jp2/full/!600,300/0/default.jpg"
"88","Tai shang yu qing wu ji zong zhen Wenchang da dong tan yan xian jing quan bu juan xia","        Digital images of Tai shang yu qing wu ji zong zhen Wenchang da dong tan yan xian jing quan bu juan xia, a sutra for worship of the God of Literature. The original manuscript dates from the early 19th century; this copy was created by Rufeng Su in the 1980s. The original author and scribe are unknown. Recitation marks have been annotated in red ink and pencil. This is the third part (xia) of this sutra.                                                          View images from this file (90)                                    ","EAP012/8/1/20","90 TIFF images","Manuscript","File","Chinese","Han (Traditional)","20th century","Access is for research purposes only","https://images.eap.bl.uk/EAP012/EAP012_8_1_20/1.jp2/full/!600,300/0/default.jpg"
"89","""""""Dong jing yin yue"""" zi liao zhi yi. 1960-1983.""","        Digital images of transcripts of Dongjing material and research fieldnotes, collected and created by Dongjing scholar/enthusiast Daohong Yi between 1960 and 1983. The file contains correspondence between Dongjing societies, government agencies and Dongjing researchers; research notes about Dongjing practices; and music scores written in jianpu notation.                                                          View images from this file (47)                                    ","EAP012/8/1/21","47 TIFF images","Correspondence","File","Chinese","Han (Traditional)","1960-1983","Access is for research purposes only","https://images.eap.bl.uk/EAP012/EAP012_8_1_21/1.jp2/full/!600,300/0/default.jpg"
"90","""""""Dong jing yin yue"""" zi liao zhi er. 1981-1982.""","        Digital images of transcripts of Dongjing material and research fieldnotes, collected and created by Dongjing scholars/enthusiasts Jiaotong Sheng and Lin Huang between 1981 and 1982. The file contains correspondence, research notes about Dongjing practices, and music scores written in Jianpu notation.                                                          View images from this file (55)                                    ","EAP012/8/1/22","55 TIFF images","Correspondence","File","Chinese","Han (Traditional)","1981-1982","Access is for research purposes only","https://images.eap.bl.uk/EAP012/EAP012_8_1_22/1.jp2/full/!600,300/0/default.jpg"
"91","""""""Dong jing yin yue"""" zi liao zhi san. 1982.""","        Digital images of transcripts of Dongjing material, research fieldnotes and newspaper clippings, created and collected in 1982. The creator wishes to remain anonymous. The file contains correspondence, research notes about Dongjing practices, and music scores written in Jianpu notation.                                                          View images from this file (44)                                    ","EAP012/8/1/23","44 TIFF images","Correspondence","File","Chinese","Han (Traditional)","1982","Access is for research purposes only","https://images.eap.bl.uk/EAP012/EAP012_8_1_23/1.jp2/full/!600,300/0/default.jpg"
"92","Zhao Peizhi xian sheng zi liao. 1984-1991","        Digital images of mimeograph copies of research fieldnotes from the collection of Zhao Peizi, created by Jiafu Zhao between 1984 and 1991. There are 2 documents in this file.                                                          View images from this file (15)                                    ","EAP012/8/1/24","15 TIFF images","Manuscript","File","Chinese","Han (Traditional)","1984-1991","Access is for research purposes only","https://images.eap.bl.uk/EAP012/EAP012_8_1_24/1.jp2/full/!600,300/0/default.jpg"
"93","Qiaojia suona qu pai. 1962","        Digital images of Dongjing musical scores from Qiaojia, with annotation and an explanatory introduction. The transcripts were created by Kaixiang Zhu, Kaiyi Zhu and Yongshou Zhu in 1962, and written in jianpu notation.                                                          View images from this file (34)                                    ","EAP012/8/1/25","34 TIFF images","Score","File","Chinese","Han (Traditional)","1962","Access is for research purposes only","https://images.eap.bl.uk/EAP012/EAP012_8_1_25/1.jp2/full/!600,300/0/default.jpg"
"94","Mengzi xian dong jing gu yue fu Kunming xue xi hui bao yan zou xin bian ci. 1989","        Digital images of a mimeograph copy of a manuscript showing lyrics for a Dongjing performance in Kunming. The mimeograph and original were created by the Mengzi Dongjing Society in 1989. The copy is of quite high quality, although the ink is slightly faded.                                                          View images from this file (17)                                    ","EAP012/8/1/26","17 TIFF images","Manuscript","File","Chinese","Han (Traditional)","1989","Access is for research purposes only","https://images.eap.bl.uk/EAP012/EAP012_8_1_26/1.jp2/full/!600,300/0/default.jpg"
"95","Dong jing yinyue. 1981","        Digital images of [Dong jing yinyue], a printed Dongjing music score in jianpu notation, with an explanatory introduction. Created by Wenqin Jiang, Liang Luo, Xuwu You, Chuhong Zhao and Fengxi Yu, 1981.                                                          View images from this file (42)                                    ","EAP012/8/1/27","42 TIFF images","Score","File","Chinese","Han (Traditional)","1981","Access is for research purposes only","https://images.eap.bl.uk/EAP012/EAP012_8_1_27/1.jp2/full/!600,300/0/default.jpg"
"96","Dali shi Xiaguan dong jing yue pu. 1984","        Digital images of a selection of Dongjing music scores in jianpu notation, from Xiaguan, Dali. The documents were created by the Nanya Dongjing Society in Xiaguan, in 1984. There are 8 documents in this file.                                                          View images from this file (59)                                    ","EAP012/8/1/28","59 TIFF images","Score","File","Chinese","Han (Traditional)","1984","Access is for research purposes only","https://images.eap.bl.uk/EAP012/EAP012_8_1_28/1.jp2/full/!600,300/0/default.jpg"
"97","Bazhai min jian dong jing yin yue. 1983","        Digital images of a Dongjing music score in jianpu notation with explanatory introduction, created by an anonymous Dongjing enthusiast in Bazhai in 1983. Original date and author of composition unknown.The file contains research notes and the score itself.                                                          View images from this file (9)                                    ","EAP012/8/1/29","9 TIFF images","Score","File","Chinese","Han (Traditional)","1983","Access is for research purposes only","https://images.eap.bl.uk/EAP012/EAP012_8_1_29/1.jp2/full/!600,300/0/default.jpg"
"98","Heqing dong jing yin yue. 1981","        Digital images of a Dongjing music score in jianpu notation with explanatory introduction, from Heqing county. The transcript is dated 1981; the transcript scribe, and the composer of the score, are unknown.                                                          View images from this file (29)                                    ","EAP012/8/1/30","29 TIFF images","Score","File","Chinese","Han (Traditional)","1981","Access is for research purposes only","https://images.eap.bl.uk/EAP012/EAP012_8_1_30/1.jp2/full/!600,300/0/default.jpg"
"99","Baoshan dong jing gu dian yin yue xuan. 1980-1981","        Digital images of music scores in jianpu notation for classical Dongjing music from Baoshan. The file consists of scores, and newspaper cuttings featuring music scores. The documents were produced between 1980 and 1981 in Baoshan County; creator(s) unknown.                                                          View images from this file (66)                                    ","EAP012/8/1/31","66 TIFF images","Score","File","Chinese","Han (Traditional)","1980-1981","Access is for research purposes only","https://images.eap.bl.uk/EAP012/EAP012_8_1_31/1.jp2/full/!600,300/0/default.jpg"
"100","Dali shi Xiaguan dong jing yin yue qu pu shang. 1985","        Digital images of a music score in jianpu notation and lyrics for Dongjing music from Dali. The transcripts were created by the Xiaguan Dongjing Society in 1985. This document is paginated numbers 1 to 21, and is the first part (shang) of the score.                                                          View images from this file (52)                                    ","EAP012/8/1/32","52 TIFF images","Score","File","Chinese","Han (Traditional)","1985","Access is for research purposes only","https://images.eap.bl.uk/EAP012/EAP012_8_1_32/1.jp2/full/!600,300/0/default.jpg"
"101","Dali shi Xiaguan dong jing yin yue qu pu zhong. 1985","        Digital images of a music score in jianpu notation and lyrics for Dongjing music from Dali. The transcripts were created by the Xiaguan Dongjing Society in 1985. This document is paginated numbers 22 to 36, and is the second part (zhong) of the score.                                                          View images from this file (35)                                    ","EAP012/8/1/33","35 TIFF images","Score","File","Chinese","Han (Traditional)","1985","Access is for research purposes only","https://images.eap.bl.uk/EAP012/EAP012_8_1_33/1.jp2/full/!600,300/0/default.jpg"
"102","Dali shi Xiaguan dong jing yin yue qu pu xia. 1985","        Digital images of a music score in jianpu notation and lyrics for Dongjing music from Dali. The transcripts were created by the Xiaguan Dongjing Society in 1985. This document is paginated numbers 37 to 54, and is the third part (xia) of the score.                                                          View images from this file (31)                                    ","EAP012/8/1/34","31 TIFF images","Score","File","Chinese","Han (Traditional)","1985","Access is for research purposes only","https://images.eap.bl.uk/EAP012/EAP012_8_1_34/1.jp2/full/!600,300/0/default.jpg"
"103","Wenshan dong jing yin yue qu pu [1981]","        Digital images of Wenshan dong jing yin yue qu pu, a book of Dongjing music scores in jianpu notation, which also contains introductory notes and photographs of Dongjing performance. The transcripts are attributed to Yuming Liang, Guande Xiao, Shiyong Zhang and Jinshang Sun in 1981; the composers and original dates of composition are unknown.                                                          View images from this file (120)                                    ","EAP012/8/1/35","120 TIFF images","Book","File","Chinese","Han (Traditional)","1981","Access is for research purposes only","https://images.eap.bl.uk/EAP012/EAP012_8_1_35/1.jp2/full/!600,300/0/default.jpg"
"104","Yongsheng han zu yin yue [1984-1985]","        Digital images of Yongsheng han zu yin yue, a collection of Dongjing music scores in jianpu notation from Yongsheng. The collected work is attributed to Jinyun Zhang; the document bears three date marks: August 1984, and Febraury 1985, which appears twice. There appear to be three different scores contained within the document. Each score has a written introduction.                                                          View images from this file (175)                                    ","EAP012/8/1/36","175 TIFF images","Score","File","Chinese","Han (Traditional)","1984-1985","Access is for research purposes only","https://images.eap.bl.uk/EAP012/EAP012_8_1_36/1.jp2/full/!600,300/0/default.jpg"
"105","Xiangshan sheng dian si","        Digital images of a mimeograph copy of Xiangshan sheng dian si, a sutra for worship of the Goddess Guanyin. The sutra is thought to date from the early 19th century; the author is unknown. The date and creator of the mimeograph copy, and the original woodblock print, are unknown. The copying quality is quite poor in places, and the ink is faded.                                                          View images from this file (90)                                    ","EAP012/8/1/37","90 TIFF images","Manuscript","File","Chinese","Han (Traditional)","20th century","Access is for research purposes only","https://images.eap.bl.uk/EAP012/EAP012_8_1_37/1.jp2/full/!600,300/0/default.jpg"
"106","Xiangshan sheng dian wu","        Digital images of a mimeograph copy of Xiangshan sheng dian wu, a sutra for worship of the Goddess Guanyin. The sutra is thought to date from the early 19th century; the author is unknown. The date and creator of the mimeograph copy, and the original woodblock print, are unknown. The copying quality is quite poor in places, and the ink is faded.                                                          View images from this file (106)                                    ","EAP012/8/1/38","106 TIFF images","Manuscript","File","Chinese","Han (Traditional)","20th century","Access is for research purposes only","https://images.eap.bl.uk/EAP012/EAP012_8_1_38/1.jp2/full/!600,300/0/default.jpg"
"107","Xiangshan sheng dian liu","        Digital images of a mimeograph copy of Xiangshan sheng dian liu, a sutra for worship of the Goddess Guanyin. The sutra is thought to date from the early 19th century; the author is unknown. The date and creator of the mimeograph copy, and the original woodblock print, are unknown. The copying quality is quite poor in places, and the ink is faded.                                                          View images from this file (98)                                    ","EAP012/8/1/39","98 TIFF images","Manuscript","File","Chinese","Han (Traditional)","20th century","Access is for research purposes only","https://images.eap.bl.uk/EAP012/EAP012_8_1_39/1.jp2/full/!600,300/0/default.jpg"
"108","Jingdong min jian qi yue qu [1986]","        Digital images of Jingdong min jian qi yue qu, a booklet of Dongjing music scores in jianpu and gongche notation, originating from Jingdong County. The booklet dates from 1986; the creator(s) are unknown. The booklet contains written sections, diagrams of musical instruments and orchestral seating plans, and musical scores.                                                          View images from this file (97)                                    ","EAP012/8/1/40","55 TIFF images","Score","File","Chinese","Han (Traditional)","1986","Access is for research purposes only","https://images.eap.bl.uk/EAP012/EAP012_8_1_40/1.jp2/full/!600,300/0/default.jpg"
"109","Lijiang naxi gu yue [November 1978]","        Digital images of a mimeograph copy of Lijiang naxi gu yue, a booklet containing music scores in jianpu notation for ancient Dongjing music originating from Lijiang County. The booklet dates from 1978; the creator(s) are unknown. The booklet consists of a written introduction, a key to the score, the score itself, and a written conclusion.                                                          View images from this file (74)                                    ","EAP012/8/1/41","72 TIFF images","Score","File","Chinese","Han (Traditional)","01 Nov 1978","Access is for research purposes only","https://images.eap.bl.uk/EAP012/EAP012_8_1_41/1.jp2/full/!600,300/0/default.jpg"
"110","Tianji jing deng dong jing yin yue yi [early 20th century]","        Digital images of Tianji jing deng dong jing yin yue yi, a collection of Dongjing music scores in guqin notation. The scores are collected in a blue folder, and date from the early 20th century. Creator(s) unknown.                                                          View images from this file (60)                                    ","EAP012/8/1/42","60 TIFF images","Score","File","Chinese","Han (Traditional)","early 20th century","Access is for research purposes only","https://images.eap.bl.uk/EAP012/EAP012_8_1_42/1.jp2/full/!600,300/0/default.jpg"
"111","Tianji jing deng dong jing yin yue er [early 20th century]","        Digital images of Tianji jing deng dong jing yin yue er, a collection of Dongjing music scores in guqin notation, and research notes. The scores are mimeograph copies, and are accompanied by a key to the score written on note paper. These sheets are collected in a blue folder, and date from the early 20th century. Creator(s) unknown.                                                          View images from this file (62)                                    ","EAP012/8/1/43","59 TIFF images","Score","File","Chinese","Han (Traditional)","early 20th century","Access is for research purposes only","https://images.eap.bl.uk/EAP012/EAP012_8_1_43/1.jp2/full/!600,300/0/default.jpg"
"112","Xinping yi zu dai zu zi zhi xian dong jing yin yue xuan [1981]","        Digital images of Xinping yi zu dai zu zi zhi xian dong jing yin yue xuan, a booklet of selected Dongjing music scores in jianpu notation from Xinping County. The booklet is attributed to Wenqin Jiang, Liang Luo, Xuwu You, Chuhong Zhao and Fengxi Yu, and dates from 1981.The booklet consists of a written introduction, a key to the score, the score itself, and a written conclusion.                                                          View images from this file (43)                                    ","EAP012/8/1/44","43 TIFF images","Score","File","Chinese","Han (Traditional)","1981","Access is for research purposes only","https://images.eap.bl.uk/EAP012/EAP012_8_1_44/1.jp2/full/!600,300/0/default.jpg"
"113","Pu'er min zu min jian yin yue zi liao. 1982","        Digital images of [Pu'er min zu min jian yin yue zi liao], a booklet of resources about rural Dongjing music from Pu'er. The booklet contains an introduction and Dongjing scores in jianpu notation. It originates from Pu'er County (exact author unknown), and is dated 1982.                                                          View images from this file (52)                                    ","EAP012/8/1/45","52 TIFF images","Score","File","Chinese","Han (Traditional)","1982","Access is for research purposes only","https://images.eap.bl.uk/EAP012/EAP012_8_1_45/1.jp2/full/!600,300/0/default.jpg"
"114","Chuxiong dong jing yin yue. 1984","        Digital images of [Chuxiong dong jing yin yue], a booklet of Dongjing music scores in jianpu notation, from Chuxiong County. The booklet is dated 1984, and attributed to Daohong Yi and Su Yan.                                                          View images from this file (35)                                    ","EAP012/8/1/46","35 TIFF images","Score","File","Chinese","Han (Traditional)","1984","Access is for research purposes only","https://images.eap.bl.uk/EAP012/EAP012_8_1_46/1.jp2/full/!600,300/0/default.jpg"
