"","Page Title","Description","Reference","Extent","Content Type","Level","Languages","Scripts","Creation date","Legal","ImgSrc"
"1","Yuanmou dong jing yin yue. 1990s","        Digital images of Dongjing music scores from Yuanmou County. The transcript was made by the Chuxiong Museum in the 1990s. The scores are written in jianpu notation.                                                          View images from this file (59)                                    ","EAP012/1/1/1","59 TIFF images","Score","File","Chinese","Han (Traditional)","1990s","Access is for research purposes only","https://images.eap.bl.uk/EAP012/EAP012_1_1_1/1.jp2/full/!600,300/0/default.jpg"
"2","Heijing dong jing yin yue. 1991","        Digital images of Dongjing music scores from the Heijing Dongjing Society. The transcripts were written in 1991. There is a written introduction and contents list attached with the scores; scores are written in jianpu notation.                                                          View images from this file (231)                                    ","EAP012/1/1/2","231 TIFF images","Score","File","Chinese","Han (Traditional)","1991","Access is for research purposes only","https://images.eap.bl.uk/EAP012/EAP012_1_1_2/1.jp2/full/!600,300/0/default.jpg"
"3","Lufeng xian Jinshan zhen Dabeichang dong jing yin yue. 1993-2004","        Digital images of Dongjing music scores from Dabeichang village, Jinshan town of Lufeng county. Created between 1993 and 2004 by the Dabeichang Dongjing Society and Lufeng County Council. The scores are written in jianpu notation.                                                          View images from this file (61)                                    ","EAP012/1/1/3","61 TIFF images","Score","File","Chinese","Han (Traditional)","1993-2004","Access is for research purposes only","https://images.eap.bl.uk/EAP012/EAP012_1_1_3/1.jp2/full/!600,300/0/default.jpg"
"4","Nanhua longchuan zhen li yue dui. 1990s","        Digital images of Dongjing music scores used by the Dongjing band of Longchuan, Nanhua County. They were created by the Chuxiong Museum in the 1990s. There is a written introduction attached to the scores, which are written in jianpu notation.                                                          View images from this file (95)                                    ","EAP012/1/1/4","95 TIFF images","Score","File","Chinese","Han (Traditional)","1990s","Access is for research purposes only","https://images.eap.bl.uk/EAP012/EAP012_1_1_4/1.jp2/full/!600,300/0/default.jpg"
"5","Wuding Maojie dong jing. 1990s","        Digital images of Dongjing music scores from Maojie, Wuding County. Created by the Chuxiong Museum in the 1990s. There is a handwritten introduction to the music, and the scores themselves are mimeograph copies, in jianpu notation.                                                          View images from this file (14)                                    ","EAP012/1/1/5","14 TIFF images","Score","File","Chinese","Han (Traditional)","1990s","Access is for research purposes only","https://images.eap.bl.uk/EAP012/EAP012_1_1_5/1.jp2/full/!600,300/0/default.jpg"
"6","Dayao min jian yin yue. 1979-2004","        Digital images of mimeograph copies of folk music scores from Dayao County, created by Yirong Xi, Kaichao Wang and other Dongjing enthusiasts between 1979 and 2004. The scores are written in jianpu notation.                                                          View images from this file (206)                                    ","EAP012/1/1/6","206 TIFF images","Score","File","Chinese","Han (Traditional)","1979-2004","Access is for research purposes only","https://images.eap.bl.uk/EAP012/EAP012_1_1_6/1.jp2/full/!600,300/0/default.jpg"
"7","Chuxiong Luhe shi Baitu zhen ban shi chu ji pu. 1990s","        Digital images of Dongjing music scores from Luhe, Chuxiong County. Created by the Chuxiong Museum in the 1990s, written in jianpu notation.                                                          View images from this file (10)                                    ","EAP012/1/1/7","10 TIFF images","Score","File","Chinese","Han (Traditional)","1990s","Access is for research purposes only","https://images.eap.bl.uk/EAP012/EAP012_1_1_7/1.jp2/full/!600,300/0/default.jpg"
"8","Chuxiong dong jing yin yue","        Digital reproduction of a recording of a Dongjing society in Chuxiong in ? 2002, created by the Chuxiong Museum. The original recording was made on cassette, tracklist to follow: A1 Dazan - 04:20; A2 Shanpoyang - 03:52; A3 Shuangfeiyan - 04:42; A4 Daotuochaun - 03:22; A5 Xuanwenzhou - 03:13; A6 Jingshantian - 02:38; A7 Xiaotachong - 02:23; A8 Hai - 03:55; A9 Haiqiang - 03:48; A10 Nafengge - 03:29; A11 Lanhuamei - 05:05; A12 Dazhegu - 03:00; B1 Sandielang - 04:59; B2 Dasanhua -03:54; B3 Xianjiayue - 06:12; B4 Yijiangfeng - 04:00; B5 Jingua - 05:24; B6 Xaingzan - 08:25; B7 Ganzhouge - 03:31; B8 Nanqinggong - 02:31; B9 Qinghesong - 05:39. The language is Yunnan dialect Chinese.              ","EAP012/1/2/1","21 MP3 files, 88 minutes 22 seconds in length","NA","File","Chinese","NA","2005-2007","Access is for research purposes only","NA"
"9","Heijing dong jing yin yue [1990-2000]","        Digital reproduction of a recording of Dongjing music during fieldwork in 1990-2000; 97 chapters in total. Recorded by Daohong Yi, Su Yan and Chaozhen Li. The original recordings were made on cassette, tracklist to follow: Performance 1: Track 1 - 05:08; Track 2 - 02:47; Track 3 - 01:45; Track 4 - 01:26; Track 5 - 02:10; Track 6 - 01:10; Track 7 - 00:09; track 8 - 01:06; Track 9 - 01:06; Track 10 - 01:15; Track 11 -01:07; Track 12 - 01:59; Track 13 - 02:57; Track 14 - 01:11; Track 15 - 02:16; Track 16 - 02:07; Track 17 - 03:43; Track 18 - 02:22; Track 19 -04:00; Track 20 - 04:46; Track 21 - 03:16; Track 22 -02:53. Performance 2: Track 1 - 01:47; Track 2 - 01:34; Track 3 - 01:31; Track 4 - 01:01; Track 5 - 01:30; Track 6 - 01:50; Track 7 - 01:34; Track 8 - 04:24; Track 9 - 01:55; Track 10 - 01:52; track 11 -03:54; Track 12 - 02:58; Track 13 - 03:19; Track 14 - 04:19; Track 15 - 05:13 (warped?); Track 16 - 04:46 (warped?); Track 17 - 01:44; track 18 - 02:48; Track 19 - 03:19; track 20 - 01:49; track 21 -01:34; track 22 - 01:30; track 23 - 01:00; track 24 - 01:27; track 25 - 01:42; track 26 - 01:37; track 27 - 04:27; track 28 - 03:43; track 29 - 03:55; track 30 - 02:56. Performance 3: Track 1 - 02:06; Track 2 - 03:09; Track 3 - 02:05; Track 4 - 04:18; Track 5 - 03:51; Track 6 - 03:36; Track 7 - 01:58; Track 8 - 02:36; track 9 - 03:12; Track 10 - 01:57; Track 11 - 02:09; Track 12 - 01:22; Track 13 - 00:38. Performance 4: Track 1 - 02:49; track 2 - 02:40; track 3 - 02:51; track 4 - 02:53; track 5 - 03:07; track 6 - 02:19; track 7 - 02:13; track 8 - 03:07; track 9 - 07:17; track 10 - 04:34; track 11 - 01:46; track 12 - 14:51; track 13 - 03:38; track 14 - 05:25; track 15 - 04:43; track 16 - 01:18. Performance 5: track 1 - 01:05; track 2 - 02:11; track 3 - 01:13; track 4 - 00:51; track 5 - 02:43; track 6 - 01:43; track 7 - 01:25; track 8 - 02:09; track 9 - 01:15; track 10 - 01:07; track 11 - 01:07; track 12 - 01:16; track 13 - 01:07; track 14 - 02:00; track 15 - 02:56; track 16 - 03:43; track 17 - 03:31. Performances are conducted in Yunnan dialect Chinese.              ","EAP012/1/2/2","97 MP3 files, 250 minutes in length","NA","File","Chinese","NA","2005-2007","Access is for research purposes only","NA"
"10","Wang Yingke dong jing chang duan [1998-2000]","        Digital reproduction of a series of recordings of the famous Dongjing master Wang Yingke. Recorded by Daohong Yi, Su Yan and Chaozhen Li during fieldwork conducted 1998-2000; 103 tracks in total. Performance 1: track 1 - 00:06; track 2 - 06:49; track 3 - 05:03; track 4 - 03:04; track 5 - 01:03; track 6 - 01:03; track 7 - 03:08; track 8 - 01:35; track 9 - 00:51; track 10 - 01:42; track 11 - 01:47; track 12 - 03:13; track 13 - 02:50; track 14 - 00:22. Performance 2: track 1 - 03:14; track 2 - 01:49; track 3 - 04:55; track 4 - 03:20; track 5 - 03:33; track 6 - 01:23; track 7 - 01:36; track 8 - 06:01; track 9 - 03:19; track 10 - 02:20; track 11 - 00:06; track 12 - 02:08; track 13 - 01:55; track 14 - 01:04; track 15 - 02:58; track 16 - 01:35; track 17 - 00:51; track 18 - 01:41; track 19 - 01:51; track 20 - 03:19; track 21 - 02:53 (warped?); track 22 - 02:05; track 23 - 03:40; track 24 - 02:28; track 25 - 02:30; track 26 - 01:32. Performance 3: track 1 - 02:44; track 2 - 02:36; track 3 - 02:38; track 4 - 01:35; track 5 - 03:29; track 6 - 01:53; track 7 - 05:08; track 8 - 03:38; track 9 - 05:27; track 10 - 03:26; track 11 - 00:22; track 12 - 02:23; track 13 - 03:29; track 14 - 02:33; track 15 - 03:14; track 16 - 02:59; track 17 - 02:26; track 18 - 01:37; track 19 - 01:20; track 20 - 07:26; track 21 - 02:58; track 22 - 02:20; track 23 - 00:18. Performance 4: track 1 - 05:12; track 2 - 01:47; track 3 - 00:53; track 4 - 01:57; track 5 - 01:52; track 6 - 02:12; track 7 - 01:52; track 8 - 01:35; track 9 - 01:25; track 10 - 02:43; track 11 - 04:35; track 12 - 01:51; track 13 - 04:31; track 15 - 02:01; track 16 -05:14; track 17 - 02:18; track 18 - 02:06; track 19 - 01:15; track 20 - 03:11; track 21 - 01:40; track 22 - 00:52; track 23 - 01:43; track 24 - 01:54; track 25 - 03:25; track 26 - 02:53 (warped?); track 27 - 05:18; track 28 - 01:50; track 29 - 00:56; track 30 - 01:56; track 31 - 01:54; track 32 - 02:12; track 33 - 01:54; track 34 - 01:36; track 35 - 01:28; track 36 -02:41; track 37 - 01:44; track 38 - 02:05; track 39 - 01:00; track 40 - 01:53. Performances are conducted in Chinese Yunnan dialect.              ","EAP012/1/2/3","103 MP3 files, 271 minutes in total","NA","File","Chinese","NA","2005-2007","Access is for research purposes only","NA"
"11","Wang Yingke dong jing chang duan [2002]","        Digital reproduction of a recording of a performance by the famous Dongjing master Wang Yinke. Recorded by Daohong Yi, Su Yan and Chaozhen Li during fieldwork conducted in 2002. The performance is conducted in Yunnan Chinese dialect.              ","EAP012/1/2/4","1 MP3 file, 7 minutes in total","NA","File","Chinese","NA","2005-2007","Access is for research purposes only","NA"
"12","Luhe Baitucheng dong jing yin yue [1990s]","        Digital reproduction of Dongjing performances in Luhe Baitucheng in Chuxiong city, recorded by the Chuxiong Museum during fieldwork in the 1990s. Originally recorded onto cassette, track list follows: Track 1 - 02:32; track 2 - 02:09; track 3 - 01:57; track 4 - 04:56; track 5 - 08:10; track 6 - 01:39; track 7 - 01:31; track 8 - 04:15; track 9 - 01:39; track 10 - 02:19; track 11 - 04:03; track 12 - 04:15; track 13 - 03:17. Performances are conducted in Yunnan Chinese dialect.              ","EAP012/1/2/5","13 MP3 files, 40 minutes 42 seconds in total","NA","File","Chinese","NA","2005-2007","Access is for research purposes only","NA"
"13","Nanhua dong jing yin yue [1990s]","        Digital reproduction of Dongjing performances in Nanhua County, recorded by the Chuxiong Museum during fieldwork in the 1990s. 22 chapters in total. Originally recorded onto cassette, tracklist follows: A1 Yunhuanle - 01:38; A2 Liuqingniang 01:15; A3 Nanqinggong 01:47; A4 Jiuyangbagua 05:16; A5 Jahuaxin 02:24; A6 Suonanzhi 03:20; A7 Yuanheling 03:29; A8 Interview 02:21; A9 Beidao 02:58; A10 Haiqiang 02:53; A11 Xiangshui 02:38; B1 Qinghesong 03:07; B2 Chaoyangge 00:54; B3 Jinshanghua 02:19 and 03:34; B4 Ziyanggongyang 01:04; B5 Yichuanzhu 00:30; B6 Sizi 00:38; B7 Yichuanzhu 00:47; B8 Wuyanghai 05:06; B9 Quanshizi 01:09; B10 Yijiangfeng 03:21; B11 Xianjiayou 01:11. Performances are conducted in Yunnan Chinese dialect.              ","EAP012/1/2/6","23 MP3 files, 49 minutes 5 seconds in length","NA","File","Chinese","NA","2005-2007","Access is for research purposes only","NA"
"14","Miheimen dong jing yin yue [1990s]","        Digital reproduction of a Dongjing performance in Miheimen village, Nanhua County, recorded by the Chuxiong Museum during fieldwork in the 1990s. Originally recorded on cassette, tracklist follows: Xiaokaimen - 01:17; Xiashanhu - 01:35; Xinniangqu - 00:42; Laoniangqu - 00:57; Mjingzan -00:52; Songzhang - 00:28; Laojunzan - 01:09; Youqiang - 00:32; Anzhendiao -00:42; Chengniandiao - 00:49; Chengzidiao - 01:06; Yingjiadao - 00:26; Songjiadao - 00:26. Performances are conducted in Yunnan Chinese Dialect.              ","EAP012/1/2/7","13 MP3 files, 11 minutes in length","NA","File","Chinese","NA","2005-2007","Access is for research purposes only","NA"
"15","Miheimen dong jing fang wen [2001]","        Digital reproduction of an interview recorded in Miheimen in 2001 by the Chuxiong Museum. Originally recorded onto cassette: -track 1 04:25; track 2 - 03:12. The interview is conducted in Yunnan Chinese dialect.              ","EAP012/1/2/8","2 MP3 files, 7 minutes 37 seconds in length","NA","File","Chinese","NA","2005-2007","Access is for research purposes only","NA"
"16","Wujie dong jing yin yue [c 2000]","        Digital reproduction of a Dongjing performance in Wujie town, Nanhua County, recorded by the Chuxiong Museum during fieldwork in ? 2000. Originally recorded on cassette: Dieluoji - 02:29; Nanqinggong - 01:04; Kaijingdiao - 00:49. The performances are conducted in Yunnan Chinese dialect.              ","EAP012/1/2/9","3 MP3 files, 4 minutes 22 seconds","NA","File","Chinese","NA","2005-2007","Access is for research purposes only","NA"
"17","Wujie dong jing fang wen [c 2000]","        Digital reproduction of an interview recorded in Wujie town, Nanhua County in ? 2000 by the Chuxiong Museum. Originally redcorded on cassette: track 1 - 03:37; track 2 - 26:44. The interview is conducted in Yunnan Chinese dialect.              ","EAP012/1/2/10","2 MP3 files, 30 minutes 21 seconds in length","NA","File","Chinese","NA","2005-2007","Access is for research purposes only","NA"
"18","Wuding Maojie dong jing yin yue [2004]","        Digital reproduction of a Dongjing performance in Maojie town, Wuding County, recorded by Chuxiong Museum during fieldwork in 2004. Originally recorded onto cassette: track 1 - 17:05; track 2 - 08:39; track 3 - 03:31; track 4 - 02:42. The sound quality is poor. Performances are conducted in Yunnan Chinese dialect.              ","EAP012/1/2/11","4 MP3 files, 32 minutes 35 seconds in length","NA","File","Chinese","NA","2005-2007","Access is for research purposes only","NA"
"19","Wuding dong jing yin yue [1990-2006]","        Digital reproductions of Dongjing performances in Wuding County, recorded by the Chuxiong Museum during fieldwork from 1990-2006. Originally recorded onto cassette: track 1 - 05:10; track 2 - 02:55; track 3 - 02:24; track 4 - 02:18; track 5 - 03:03. Performances are conducted in Yunnan Chinese dialect.              ","EAP012/1/2/12","5 MP3 files, 15 minutes 50 seconds in total","NA","File","Chinese","NA","2005-2007","Access is for research purposes only","NA"
"20","Yao'an dong jing yin yue [1990-2006]","        Digital reproductions of Dongjing performances in Yao'an County, recorded by the Chuxiong Museum during fieldwork between 1990-2006. Originally recorded onto cassette: track 1 - 02:19; track 2 - 04:13; track 3 - 01:07; track 4 - 01:47; track 5 - 01:06; track 6 - 01:52; track 7 - 02:23; track 8 - 00:47; track 9 - 00:45; track 10 - 03:17. Performances are conducted in Yunnan Chinese dialect.              ","EAP012/1/2/13","10 MP3 files, 17 minutes 30 seconds in total","NA","File","Chinese","NA","2005-2007","Access is for research purposes only","NA"
"21","Yongren dong jing yin yue [1990-2006]","        Digital reproductions of Dongjing performances in Yongren County, recorded by the Chuxiong Museum during fieldwork between 1990-2006. Originally recorded onto cassette: track A1 - 04:30; track A2 - 02:01; track A3 - 01:53; track A4 - 03:42; track A5 - 01:44; track A6 -01:48; track A7 -00:59; track A8 - 03:21; track A9 - 02:17; track B1 -03:49; track B2 - 03:28; track B3 -02:44; track B4 - 02:24; track B5 - 05:53; track B6 - 01:48. Performances are conducted in Yunnan Chinese dialect.              ","EAP012/1/2/14","15 MP3 files, 42 minutes twelve seconds in length","NA","File","Chinese","NA","2005-2007","Access is for research purposes only","NA"
"22","Yuanmou dong jing yin yue [1990-2006]","        Digital reproductions of Dongjing performances in Yuanmou County, recorded by the Chuxiong Museum during fieldwork between 1990-2006. Originally recorded onto cassette: Performance 1: track 1 - 00:09; track 2 - 01:41; track 3 - 01:51; track 4 - 00:02; track 5 - 00:50; track 6 - 00:06; track 7 - 05:27; track 8 - 01:06; track 9 - 03:59; track 10 - 02:29; track 11 - 00:06; track 12 - 02:13; track 13 - 05:08; track 14 - 01:42; track 15 - 02:12; track 16 - 03:02; track 17 - 01:47; track 18 - 00:03; track 19 - 03:55; track 20 -00:02; track 21 - 01:57; track 22 - 00:02; track 23 - 03:18; track 24 - 03:23; track 25 - 03:35; track 26 - 01:54; track 27 - 02:16; track 28 - 02:03; track 29 - 02:10; track 30 - 00:09. Performance 2: track 1 - 00:02; track 2 - 02:12; track 3 - 02:29; track 4 - 02:20; track 5 - 01:38; track 6 - 01:26; track 7 - 02:02; track 8 - 01:47; track 9 - 01:52; track 10 - 02:54; track 11 - 02:02; track 12 - 02:29; track 13 - 00:44; track 14 - 01:02; track 15 - 01:18; track 19 - 00:44; track 20 - 01:01; track 22 - 03:58; track 23 - 03:30; track 24 - 00:56; track 25 - 02:20; track 26 - 02:48; track 27 - 02:08. Performance 3: track 1 - 06:17; track 2 - 02:23; track 3 - 00:04; track 4 - 03:00; track 5 - 03:58; track 6 - 00:05; track 7 - 01:57; track 8 - 00:05; track 9 - 01:20; track 10 - 03:34; track 11 - 01:00; track 12 - 02:05; track 13 - 00:05; track 14 - 00:59. Performances are conducted in Yunnan Chinese dialect.              ","EAP012/1/2/15","71 MP3 files, 134 minutes in length","NA","File","Chinese","NA","2005-2007","Access is for research purposes only","NA"
"23","Dong jing pu. 20th century","        Digital images of a Dongjing music score from Qilin District, Qujing City. The author of this score remains anonymous; this manuscript was transcribed in the early 20th century. Black and red ink on paper, written in guqin notation.                                                          View images from this file (11)                                    ","EAP012/2/1","11 TIFF images","Manuscript","File","Chinese","Han (Traditional)","20th century","Access is for research purposes only","https://images.eap.bl.uk/EAP012/EAP012_2_1/1.jp2/full/!600,300/0/default.jpg"
"24","Dong jing qiang pu [1982]","        Digital images of a manuscript of lyrics for Dongjing music performances. This manuscript was created by Shizhen Wang in 1982, who copied it from another, thought to date from the early 19th century. The author of the lyrics remains anonymous. The manuscript appears to have been annotated at a later date. Black ink on bound paper.                                                          View images from this file (32)                                    ","EAP012/3/1","32 TIFF images","Manuscript","File","Chinese","Han (Traditional)","1982","Access is for research purposes only","https://images.eap.bl.uk/EAP012/EAP012_3_1/1.jp2/full/!600,300/0/default.jpg"
"25","Dong jing gong che pu. 1946","        Digital images of a manscript containing scores of archaic Dongjing music. This manuscript is thought to have been copied in 1946, by an anonymous source. The origin of the music is uncertain. Black and red ink on bound paper.                                                          View images from this file (29)                                    ","EAP012/4/1","29 TIFF images","Manuscript","File","Chinese","Han (Traditional)","1946","Access is for research purposes only","https://images.eap.bl.uk/EAP012/EAP012_4_1/1.jp2/full/!600,300/0/default.jpg"
"26","Luliang dong jing yin yue zheng li chu gao [1990]","        Digital images of a booklet of Dongjing music scores from Luliang County. The scores were transcribed by Guang Zhu in 1990, in jianpu notation.                                                          View images from this file (24)                                    ","EAP012/5/1","24 TIFF images","Score","File","Chinese","Han (Traditional)","1990","Access is for research purposes only","https://images.eap.bl.uk/EAP012/EAP012_5_1/1.jp2/full/!600,300/0/default.jpg"
"27","Heijing dong jing yin yue [? 1978-1991]","        Digital images of Heijing dong jing yin yue, Dongjing music scores from Heijing. The scores were written in jianpu notation, and created by Jing Yang and Yue Liu at some point between 1978 and 1991.                                                          View images from this file (58)                                    ","EAP012/6/1/1","58 TIFF images","Score","File","Chinese","Han (Traditional)","1978-1991","Access is for research purposes only","https://images.eap.bl.uk/EAP012/EAP012_6_1_1/1.jp2/full/!600,300/0/default.jpg"
"28","Yaozhan dong jing yin yue [1980-1990]","        Digital images of Yaozhan dong jing yin yue, handwritten and mimeograph copies of Dongjing music scores from Yaozhan. The scores were created by Peifu Dai, Yingke Wang and Ye Yang at some point in the 1980s and 1990s. Primarily written in jianpu notation, a couple of scores are written as guqin and gunche. The creators have included research notes with the scores.                                                          View images from this file (88)                                    ","EAP012/6/1/2","88 TIFF images","Score","File","Chinese","Han (Traditional)","1980-1990","Access is for research purposes only","https://images.eap.bl.uk/EAP012/EAP012_6_1_2/1.jp2/full/!600,300/0/default.jpg"
"29","Yunnan sheng qi yue qu ji cheng Qujing diqu Huize xian dong jing qi yue qu bu fen. 1996","        Digital images of Yunnan sheng qi yue qu ji cheng Qujing diqu Huize xian dong jing qi yue qu bu fen, Dongjing music scores from Huize County. The scores were created by Niansheng Tang and Zhengxian Shen in 1996, and are written in jianpu notation.                                                          View images from this file (30)                                    ","EAP012/6/1/3","30 TIFF images","Score","File","Chinese","Han (Traditional)","1996","Access is for research purposes only","https://images.eap.bl.uk/EAP012/EAP012_6_1_3/1.jp2/full/!600,300/0/default.jpg"
"30","Kunmin dong jing hui Peng Youshan hui yi lu [1990s]","        Digital images of Kunmin dong jing hui Peng Youshan hui yi lu, the memoir of a Dongjing master called Peng Youshan. It was written by Peng Youshan in the 1990s.                                                          View images from this file (19)                                    ","EAP012/6/1/4","19 TIFF images","Manuscript","File","Chinese","Han (Traditional)","1990s","Access is for research purposes only","https://images.eap.bl.uk/EAP012/EAP012_6_1_4/1.jp2/full/!600,300/0/default.jpg"
"31","Yunnan Luliang Cuandi gu yue kunju qu pu di yi zu xue xi yan zou zi liao [2002]","        Digital images of Yunnan Luliang Cuandi gu yue kunju qu pu di yi zu xue xi yan zou zi liao, Dongjing music scores from Luliang County. They were transcribed by Guan Zhu in 2002, and are written in jianpu notation.                                                          View images from this file (35)                                    ","EAP012/6/1/5","35 TIFF images","Score","File","Chinese","Han (Traditional)","2002","Access is for research purposes only","https://images.eap.bl.uk/EAP012/EAP012_6_1_5/1.jp2/full/!600,300/0/default.jpg"
"32","Sheng Qunzhong yi shu guan lai xin [1981]","        Digital images of Sheng Qunzhong yi shu guan lai xin, correspondence regarding Dongjing, between anonymous persons. The bundle includes diagrams showing seating arrangements for Dongjing performances. The correspondence was sent in 1981.                                                          View images from this file (7)                                    ","EAP012/6/1/6","7 TIFF images","Correspondence","File","Chinese","Han (Traditional)","1981","Access is for research purposes only","https://images.eap.bl.uk/EAP012/EAP012_6_1_6/1.jp2/full/!600,300/0/default.jpg"
"33","Dong jing gu dian yin yue [1996]","        Digital images of Dong jing gu dian yin yue, scores of archaic Dongjing music. These transcripts were made by the Society of Classical Music in Qujing, in 1996, and are written in jianpu notation.                                                          View images from this file (21)                                    ","EAP012/6/1/7","21 TIFF images","Score","File","Chinese","Han (Traditional)","1996","Access is for research purposes only","https://images.eap.bl.uk/EAP012/EAP012_6_1_7/1.jp2/full/!600,300/0/default.jpg"
"34","Huize dong jing yin yue [1990s]","        Digital images of Huize dong jing yin yue, transcripts of Dongjing music scores from Huize County. These scores were transcribed by Hongkui Zhao in the 1990s, and are written in jianpu notation.                                                          View images from this file (35)                                    ","EAP012/6/1/8","35 TIFF images","Score","File","Chinese","Han (Traditional)","1990s","Access is for research purposes only","https://images.eap.bl.uk/EAP012/EAP012_6_1_8/1.jp2/full/!600,300/0/default.jpg"
"35","Heijing dong jing lu yin [1989]","        Digital reproduction of an on-site recording of a Dongjing performance by the Dongjing Society in Heijing town, 20 February 1989. The recording was originally made on cassette. 2 chapters in total.              ","EAP012/6/2/1","2 MP3 files, 42 minutes 25 seconds in total","NA","File","Chinese","NA","2005-2007","Access is for research purposes only","NA"
