"","Page Title","Description","Reference","Extent","Content Type","Level","Languages","Scripts","Creation date","Legal","ImgSrc"
"36","Luliang dong jing yin yue [2006]","        Digital reproduction of an on-site recording of performances by the Dongjing Society in Luliang in 2006. The original recordings were made directly onto digital as part of the EAP012 project, by Lin Huang, Xianyao He and Jian Xu. 12 tracks in total: Xiaozhegu - 03:39; Xaiotaohong - 03:33; Banzhuangtai - 02:43; Chaotianzi - 06:56; Wufengqiuye - 07:08; Nanlouhuagu - 06:20; Yuanxiaoyue - 04:00; Dadong - 04:32; Jiuchengyanliu - 04:35; Dajuexiaozhong - 09:10; Cuanshiyingbingqu - 07:29; Cuanlongyan - 04:44.              ","EAP012/6/2/2","12 WAV files, 64 minutes 50 seconds in total","NA","File","Chinese","NA","16 May 2007","Access is for research purposes only","NA"
"37","Huoguanhui [1993]","        Digital reproduction of a recording of a Dongjing performance during the Fire Festival in Chuxiong in 1993. Originally recorded by Tinghua Lu onto cassette. Participants in the ceremony are speaking Chinese in the Yunnan dialect.              ","EAP012/6/2/3","1 DAT file, 1 hour 15 minutes 24 seconds in length","NA","File","Chinese","NA","2006","Access is for research purposes only","NA"
"38","Huoguanhui [2004]","        Digital reproduction of a recording of a Dongjing performance during the Fire Festival in Chuxiong in 2004. Originally recorded by Tinghua Lu onto cassette. Participants in the ceremony are speaking Chinese in the Yunnan dialect.              ","EAP012/6/2/4","1 DAT file, 57 minutes 16 seconds in length","NA","File","Chinese","NA","2004","Access is for research purposes only","NA"
"39","Ba yue shi wu zuo hui [2006]","        Digital recording of a Dongjing performance during the Moon festival in Chuxiong in 2006. Recorded to digital by Fei Huang and Yanhong Liu. Participants in the ceremony are speaking Chinese in the Yunnan dialect.              ","EAP012/6/2/5","1 DAT file, 1 hour 11 minutes 58 seconds in length","NA","File","Chinese","NA","20 Nov 2006","Access is for research purposes only","NA"
"40","Guanyinhui [2006]","        Digital recording of Dongjing music and ritual performed on the birthday of the Goddess Guanyin. The performance took place in Chuxiong in 2006, and was recorded by Fei Huang and Yanhong Liu. The ceremony was filmed over 4 tracks: track 1 - 01:09:48; track 2 - 01:11:56; track 3 - 01:10:31; track 4 - 00:05:59.Participants in the ceremony are speaking Chinese in the Yunnan dialect.              ","EAP012/6/2/6","4 DAT files, 3 hours, 38 minutes 14 seconds in length","NA","File","Chinese","NA","2006","Access is for research purposes only","NA"
"41","Zuozai [1993]","        Digital reproduction of a recording of a Dongjing performance in Chuxiong in 1993. Recorded by Tinghua Lu onto video cassette. The recording has been split over three tracks : track 1 - 01:10:57; track 2 - 01:14:18; track 3 - 01:14:24.              ","EAP012/6/2/7","3 DAT files, 3 hours 39 minutes 39 seconds in length","NA","File","Chinese","NA","2004","Access is for research purposes only","NA"
"42","Cuandi gu yue [2004]","        Digital reproduction of a recording of a Dongjing performance by the society in Luliang, in 2004. Originally recorded onto cassette by Zongjin Zhao. One track, 00:48:44 in length.              ","EAP012/6/2/8","1 DAT file, 48 mintues and 44 seconds in length","NA","File","Chinese","NA","2004","Access is for research purposes only","NA"
"43","Cuanxiang gu yue [2001]","        Digital reproduction of a recording of a Dongjing performance by the society in Quijing in 2001. Originally recorded onto cassette by Zongjin Zhao.              ","EAP012/6/2/9","1 DAT file, 45 mintues 38 seconds in length","NA","File","Chinese","NA","2005-2007","Access is for research purposes only","NA"
"44","Bata gu yue [2006]","        Digital reproduction of a recording of a Dongjing performance in Zhujie Town of Qujing City on 21 June 2006. Originally recorded onto cassette by Yinghe Jiang, Yanhong Liu, Xueyuan Wu, Zongjin Zhao and Hongkui Zhao. 6 tracks in total: Track 1 displays the video title; track 2 shows an introduction; track 3 shows interviews with participants and villagers; tracks 4 to 6 show the performance itself.              ","EAP012/6/2/10","6 DAT files, 78 minutes in length","NA","File","Chinese","NA","2006","Access is for research purposes only","NA"
"45","Qujing shi cuanxiang gu dian yin yue [2006]","        Digital reproduction of a recording of a Dongjing performance in Quijing City on 26 August 2006. Originally recorded onto cassette by Yinghe Jiang, Yanhong Liu, Xueyuan Wu, Zongjing Zhao and Hongkui Zhao. 5 tracks in total: track 1 displays a title sequence; tracks 2-5 show the performance.              ","EAP012/6/2/11","5 DAT files, 12 minutes in length","NA","File","Chinese","NA","2006","Access is for research purposes only","NA"
"46","Tai shang wu ji da cheng yi sheng gai tian gu fo tao yuan ming sheng zhen jing he kan [1878]","        Digital images of Tai shang wu ji da cheng yi sheng gai tian gu fo tao yuan ming sheng zhen jing he kan, a sutra used in Dongjing activities. This copy is dated 1878; the creator remains anonymous.                                                          View images from this file (61)                                    ","EAP012/7/1","61 TIFF images","Manuscript","File","Chinese","Han (Traditional)","1878","Access is for research purposes only","https://images.eap.bl.uk/EAP012/EAP012_7_1/1.jp2/full/!600,300/0/default.jpg"
"47","Da cheng miao fa lian hua tan jing li qing [1865]","        Digital images of a mimeograph copy of Da cheng miao fa lian hua tan jing li qing, a sutra used in Dongjing activities. This copy is dated 1865; the creator remains anonymous.                                                          View images from this file (65)                                    ","EAP012/7/2","65 TIFF images","Manuscript","File","Chinese","Han (Traditional)","1865","Access is for research purposes only","https://images.eap.bl.uk/EAP012/EAP012_7_2/1.jp2/full/!600,300/0/default.jpg"
"48","Da cheng miao fa lian hua tan jing juan shang [? 1865]","        Digital images of a mimeograph copy of Da cheng miao fa lian hua tan jing juan shang, a sutra used in Dongjing activities. This copy is tentatively dated to 1865; the creator remains anonymous.                                                          View images from this file (63)                                    ","EAP012/7/3","63 TIFF images","Manuscript","File","Chinese","Han (Traditional)","1865?","Access is for research purposes only","https://images.eap.bl.uk/EAP012/EAP012_7_3/1.jp2/full/!600,300/0/default.jpg"
"49","Da cheng miao fa lian hua tan jing juan zhong [? 1865]","        Digital images of a mimeograph copy of Da cheng miao fa lian hua tan jing juan zhong, a sutra used in Dongjing activities. This copy is tentatively dated to 1865; the creator remains anonymous. Recitation marks have been added to the text.                                                          View images from this file (77)                                    ","EAP012/7/4","77 TIFF images","Manuscript","File","Chinese","Han (Traditional)","1865?","Access is for research purposes only","https://images.eap.bl.uk/EAP012/EAP012_7_4/1.jp2/full/!600,300/0/default.jpg"
"50","Da cheng miao fa lian hua tan jing juan xia [? 1865]","        Digital images of a mimeograph copy of Da cheng miao fa lian hua tan jing juan xia, a sutra used in Dongjing activities. This copy is tentatively dated to 1865; the creator remains anonymous. Recitation marks have been added to the text.                                                          View images from this file (64)                                    ","EAP012/7/5","64 TIFF images","Manuscript","File","Chinese","Han (Traditional)","1865?","Access is for research purposes only","https://images.eap.bl.uk/EAP012/EAP012_7_5/1.jp2/full/!600,300/0/default.jpg"
"51","Da dong xian jing juan shang [1987]","        Digital images of a mimeograph copy of Da dong xian jing juan shang, a sutra used in Dongjing activities. The creator of the sutra is anonymous, and the original manuscript was dated back to the mid-19th century; the copy that these images show was created by Xuelin Che in 1987. Recitation marks have been added to the text.                                                          View images from this file (70)                                    ","EAP012/7/6","70 TIFF images","Manuscript","File","Chinese","Han (Traditional)","1987","Access is for research purposes only","https://images.eap.bl.uk/EAP012/EAP012_7_6/1.jp2/full/!600,300/0/default.jpg"
"52","Da dong xian jing juan zhong [1987]","        Digital images of a mimeograph copy of Da dong xian jing juan zhong, a sutra used in Dongjing activities. The creator of the sutra is anonymous, and the original manuscript was dated back to the mid-19th century; the copy that these images show was created by Xuelin Che in 1987. Recitation marks have been added to the text.                                                          View images from this file (49)                                    ","EAP012/7/7","49 TIFF images","Manuscript","File","Chinese","Han (Traditional)","1987","Access is for research purposes only","https://images.eap.bl.uk/EAP012/EAP012_7_7/1.jp2/full/!600,300/0/default.jpg"
"53","Da dong xian jing juan xia [1987]","        Digital images of a mimeograph copy of Da dong xian jing juan xia, a sutra used in Dongjing activities. The creator of the sutra is anonymous, and the original manuscript was dated back to the mid-19th century; the copy that these images show was created by Xuelin Che in 1987. Rectitation marks have been added to the text.                                                          View images from this file (88)                                    ","EAP012/7/8","88 TIFF images","Manuscript","File","Chinese","Han (Traditional)","1987","Access is for research purposes only","https://images.eap.bl.uk/EAP012/EAP012_7_8/1.jp2/full/!600,300/0/default.jpg"
"54","Da dong xian jing juan li qing [1987]","        Digital images of a mimeograph copy of Da dong xian jing juan li qing, a sutra used in Dongjing activities. The creator of the sutra is anonymous, and the original manuscript was dated back to 1874; the copy that these images show was created by Xuelin Che in 1987.                                                          View images from this file (108)                                    ","EAP012/7/9","109 TIFF images","Manuscript","File","Chinese","Han (Traditional)","1987","Access is for research purposes only","https://images.eap.bl.uk/EAP012/EAP012_7_9/1.jp2/full/!600,300/0/default.jpg"
"55","Gao shang Yuhuang ben xing ji jing yan yi kai tan li qing [1865]","        Digital images of Gao shang Yuhuang ben xing ji jing yan yi kai tan li qing, a sutra used in Dongjing activities. This copy is dated 1865; the creator remains anonymous.                                                          View images from this file (50)                                    ","EAP012/7/10","50 TIFF images","Manuscript","File","Chinese","Han (Traditional)","1865","Access is for research purposes only","https://images.eap.bl.uk/EAP012/EAP012_7_10/1.jp2/full/!600,300/0/default.jpg"
"56","Gao shang Yuhuang ben xing ji jing yan yi juan shang [1864]","        Digital images of Gao shang Yuhuang ben xing ji jing yan yi juan shang, a sutra used in Dongjing activities. This copy is dated 1864; the creator remains anonymous.                                                          View images from this file (105)                                    ","EAP012/7/11","105 TIFF images","Manuscript","File","Chinese","Han (Traditional)","1864","Access is for research purposes only","https://images.eap.bl.uk/EAP012/EAP012_7_11/1.jp2/full/!600,300/0/default.jpg"
"57","Gao shang Yuhuang ben xing ji jing yan yi juan zhong [1864]","        Digital images of Gao shang Yuhuang ben xing ji jing yan yi juan zhong, a sutra used for Dongjing activities. This copy is dated 1864; the creator remains anonymous.                                                          View images from this file (54)                                    ","EAP012/7/12","54 TIFF images","Manuscript","File","Chinese","Han (Traditional)","1864","Access is for research purposes only","https://images.eap.bl.uk/EAP012/EAP012_7_12/1.jp2/full/!600,300/0/default.jpg"
"58","Gao shang Yuhuang ben xing ji jing yan yi juan xia [1864]","        Digital images of Gao shang Yuhuang ben xing ji jing yan yi juan xia, a sutra used for Dongjing activities. This copy is dated 1864; the creator remains anonymous.                                                          View images from this file (94)                                    ","EAP012/7/13","94 TIFF images","Manuscript","File","Chinese","Han (Traditional)","1864","Access is for research purposes only","https://images.eap.bl.uk/EAP012/EAP012_7_13/1.jp2/full/!600,300/0/default.jpg"
"59","Yin yue qiang diao pu zi ke ben [late 19th century]","        Digital images of Yin yue qiang diao pu zi ke ben, a sutra used for Dongjing activities. This copy dates from the late 19th century; the creator remains anonymous.                                                          View images from this file (70)                                    ","EAP012/7/14","70 TIFF images","Manuscript","File","Chinese","Han (Traditional)","Late 19th century","Access is for research purposes only","https://images.eap.bl.uk/EAP012/EAP012_7_14/1.jp2/full/!600,300/0/default.jpg"
"60","Chuxiong Yi zhou dong jing gu yue [2005]","        Digital images of Chuxiong Yi zhou dong jing gu yue, a score of archaic Dongjing music from Chuxiong. The transcript displayed in these images was copied by Wentong Zhang and Kaichao Wang in 2005; the document they copied from was transcribed in the 1980s. The file contains a written introduction and a contents page, followed by the score in jianpu notation.                                                          View images from this file (21)                                    ","EAP012/7/15","21 TIFF images","Score","File","Chinese","Han (Traditional)","2005","Access is for research purposes only","https://images.eap.bl.uk/EAP012/EAP012_7_15/1.jp2/full/!600,300/0/default.jpg"
"61","Min zu min jian gu yue-gong chi pu yi jian pu ben [2006]","        Digital images of a mimeograph copy of Min zu min jian gu yue-gong chi pu yi jian pu ben, a transcript of an archaic Dongjing music score. The transcript displayed in these images was copied by Gong Li and Kaicho Wang in 2006; the document they copied from was transcribed in the 1980s. The score is written in gongche notation, and is accompanied by a handwritten introduction.                                                          View images from this file (33)                                    ","EAP012/7/16","33 TIFF images","Score","File","Chinese","Han (Traditional)","2006","Access is for research purposes only","https://images.eap.bl.uk/EAP012/EAP012_7_16/1.jp2/full/!600,300/0/default.jpg"
"62","Sanguan dong jing juan xia [1911]","        Digital images of Sanguan dong jing juan xia, a sutra used in Dongjing activities. This copy is dated 1911; the creater remains anonymous.                                                          View images from this file (68)                                    ","EAP012/7/17","68 TIFF images","Manuscript","File","Chinese","Han (Traditional)","1911","Access is for research purposes only","https://images.eap.bl.uk/EAP012/EAP012_7_17/1.jp2/full/!600,300/0/default.jpg"
"63","Xuan men an tan li zhuan ke [1986]","        Digital images of Xuan men an tan li zhuan ke, a sutra used in Dongjing activities. The copy shown in these images dates from 1986, and the creator remains anonymous; the original document dated from the late 19th century. Recitation marks have been added to the text.                                                          View images from this file (21)                                    ","EAP012/7/18","21 TIFF images","Manuscript","File","Chinese","Han (Traditional)","1986","Access is for research purposes only","https://images.eap.bl.uk/EAP012/EAP012_7_18/1.jp2/full/!600,300/0/default.jpg"
"64","San yuan bao chan quan han [1911]","        Digital images of San yuan bao chan quan han, a sutra used in Dongjing activities. This copy is dated 1911; the creator remains anonymous.                                                          View images from this file (41)                                    ","EAP012/7/19","41 TIFF images","Manuscript","File","Chinese","Han (Traditional)","1911","Access is for research purposes only","https://images.eap.bl.uk/EAP012/EAP012_7_19/1.jp2/full/!600,300/0/default.jpg"
"65","Xuan men gong ke kai tan ke yi quan han [1986]","        Digital images of Xuan men gong ke kai tan ke yi quan han, a sutra used in Dongjing activities. The copy shown in these images dates from 1986, and the creator remains anonymous; the original document dated from the late 19th century.                                                          View images from this file (58)                                    ","EAP012/7/20","58 TIFF images","Manuscript","File","Chinese","Han (Traditional)","1986","Access is for research purposes only","https://images.eap.bl.uk/EAP012/EAP012_7_20/1.jp2/full/!600,300/0/default.jpg"
"66","Sanguan dong jing li qing [1911]","        Digital images of Sanguan dong jing li qing, a sutra used in Dongjing activities. This copy is dated 1911; the creator remains anonymous.                                                          View images from this file (92)                                    ","EAP012/7/21","92 TIFF images","Manuscript","File","Chinese","Han (Traditional)","1911","Access is for research purposes only","https://images.eap.bl.uk/EAP012/EAP012_7_21/1.jp2/full/!600,300/0/default.jpg"
"67","Sanguan dong jing juan shang [1911]","        Digital images of Sanguan dong jing juan shang, a sutra used in Dongjing activities. This copy is dated 1911; the creator remains anonymous.                                                          View images from this file (72)                                    ","EAP012/7/22","72 TIFF images","Manuscript","File","Chinese","Han (Traditional)","1911","Access is for research purposes only","https://images.eap.bl.uk/EAP012/EAP012_7_22/1.jp2/full/!600,300/0/default.jpg"
"68","Sanguan dong jing juan zhong [1911]","        Digital images of Sanguan dong jing juan zhong, a sutra used in Dongjing activities. This copy is dated 1911; the creator remains anonymous.                                                          View images from this file (76)                                    ","EAP012/7/23","76 TIFF images","Manuscript","File","Chinese","Han (Traditional)","1911","Access is for research purposes only","https://images.eap.bl.uk/EAP012/EAP012_7_23/1.jp2/full/!600,300/0/default.jpg"
"69","Bao'en jing qian bu shang juan [19th century]","        Digital images of a mimeograph copy of Bao'en jing qian bu shang juan, a sutra on filial piety. The manuscript dates from the 19th century; the author and scribe are unknown. The copying quality is quite poor in places, and the ink is fading. This is the first part (shang) of the sutra.                                                          View images from this file (94)                                    ","EAP012/8/1/1","94 TIFF images","Manuscript","File","Chinese","Han (Traditional)","19th century","Access is for research purposes only","https://images.eap.bl.uk/EAP012/EAP012_8_1_1/1.jp2/full/!600,300/0/default.jpg"
"70","Bao'en jing qian bu zhong juan [19th century]","        Digital images of a mimeograph copy of Bao'en jing qian bu zhong juan, a sutra on filial piety. The original manuscript dates from the 19th century; the author and the scribe are unknown. The copying quality is quite poor in places, and the ink is fading. This is the second part (zhong) of the sutra.                                                          View images from this file (102)                                    ","EAP012/8/1/2","90 TIFF images","Manuscript","File","Chinese","Han (Traditional)","19th century","Access is for research purposes only","https://images.eap.bl.uk/EAP012/EAP012_8_1_2/1.jp2/full/!600,300/0/default.jpg"
"71","Bao'en jing qian bu xia juan [19th century]","        Digital images of a mimeograph copy of Bao'en jing qian bu xia juan, a sutra on filial piety. The original manuscript dates from the 19th century; the author and the scribe are unknown. The copying quality is quite poor in places, and the ink is fading. This is the third part (xia) of the sutra.                                                          View images from this file (60)                                    ","EAP012/8/1/3","60 TIFF images","Manuscript","File","Chinese","Han (Traditional)","19th century","Access is for research purposes only","https://images.eap.bl.uk/EAP012/EAP012_8_1_3/1.jp2/full/!600,300/0/default.jpg"
"72","Bao'en jing kan bu li qing [19th century]","        Digital images of a mimeograph copy of Bao'en jing kan bu li qing, a manuscript detailing the ceremony for inviting spirits to join the ritual for filial piety. The original manuscript dates from the 19th century; the author and the scribe are unknown. The copying quality is quite poor in places, and the ink is fading.                                                          View images from this file (68)                                    ","EAP012/8/1/4","68 TIFF images","Manuscript","File","Chinese","Han (Traditional)","19th century","Access is for research purposes only","https://images.eap.bl.uk/EAP012/EAP012_8_1_4/1.jp2/full/!600,300/0/default.jpg"
"73","Bao'en jing kan bu li chan [19th century]","        Digital images of a mimeograph copy of Bao'en jing kan bu li chan, a manuscript detailing the ceremony for relieving one's guilt, performed during the ritual for filial piety. The original manuscript dates from the 19th century; the author and the scribe are unknown. The copying quality is quite poor in places, and the ink is fading.                                                          View images from this file (90)                                    ","EAP012/8/1/5","90 TIFF images","Manuscript","File","Chinese","Han (Traditional)","19th century","Access is for research purposes only","https://images.eap.bl.uk/EAP012/EAP012_8_1_5/1.jp2/full/!600,300/0/default.jpg"
"74","Guan di jue shi zhen jing li wen [19th century]","        Digital images of a mimeograph copy of Guan di jue shi zhen jing li wen, a sutra for worship of the God of Martial Arts. The original manuscript dates from the 19th century, author and scribe unknown. The copying quality is quite poor in places, and the ink is fading.                                                          View images from this file (76)                                    ","EAP012/8/1/6","76 TIFF images","Manuscript","File","Chinese","Han (Traditional)","19th century","Access is for research purposes only","https://images.eap.bl.uk/EAP012/EAP012_8_1_6/1.jp2/full/!600,300/0/default.jpg"
"75","Shenggao [19th century]","        Digital images of a mimeograph copy of Shenggao, a sutra used in the opening ceremony of Dongjing performances. The original manuscript dates from the early 19th century, and was created by the Chuxiong Dongjing Society. The copying quality is quite poor in places, and the ink is fading.                                                          View images from this file (31)                                    ","EAP012/8/1/7","31 TIFF images","Manuscript","File","Chinese","Han (Traditional)","19th century","Access is for research purposes only","https://images.eap.bl.uk/EAP012/EAP012_8_1_7/1.jp2/full/!600,300/0/default.jpg"
"76","Guan di jue shi zhen jing juan shang [19th century]","        Digital images of a mimeograph copy of Guan di jue shi zhen jing juan shang, a sutra for worship of the God of Martial Arts. The original manuscript dates from the 19th century, author and scribe unknown. The copying quality is quite poor in places, and the ink is fading. This is the first part (shang) of the sutra.                                                          View images from this file (94)                                    ","EAP012/8/1/8","94 TIFF images","Manuscript","File","Chinese","Han (Traditional)","19th century","Access is for research purposes only","https://images.eap.bl.uk/EAP012/EAP012_8_1_8/1.jp2/full/!600,300/0/default.jpg"
"77","Guan di jue shi zhen jing juan zhong [19th century]","        Digital images of a mimeograph copy of Guan di jue shi zhen jing juan zhong, a sutra for worship of the God of Martial Arts. The original manuscript dates from the 19th century, author and scribe unknown. The copying quality is quite poor in places, and the ink is fading. This is the second part (zhong) of this sutra.                                                          View images from this file (64)                                    ","EAP012/8/1/9","64 TIFF images","Manuscript","File","Chinese","Han (Traditional)","19th century","Access is for research purposes only","https://images.eap.bl.uk/EAP012/EAP012_8_1_9/1.jp2/full/!600,300/0/default.jpg"
