"","Page Title","Description","Reference","Extent","Content Type","Level","Languages","Scripts","Creation date","Legal","ImgSrc"
"77","Oneness of God (Tawhid)","        About the four elements in the change of intention, namely jirim, body, johar etc. Extent and format of original material: Daluwang paper. Length and width of manuscript:20.2 x 14 cm. Length and width of text:17.3 x 10.5 cm.                                                          View images from this file (67)                                    ","EAP211/1/2/30","67 Tiff images","Manuscript","File","Javanese","Javanese","16th century","For research purposes only.","https://images.eap.bl.uk/EAP211/EAP211_1_2_30/1.jp2/full/!600,300/0/default.jpg"
"78","Oneness of God (Tawhid)","        Explanation about the supreme knowledge and the knowledge of watching, and the genealogy of Kanjeng susuhunan etc. Extent and format of original material: European paper. Length and width of manuscript:19.3 x 12.2 cm. Length and width of text:17.5 x 10 cm.                                                          View images from this file (19)                                    ","EAP211/1/2/31","19 Tiff images","Manuscript","File","Javanese","Javanese","16th century","For research purposes only.","https://images.eap.bl.uk/EAP211/EAP211_1_2_31/1.jp2/full/!600,300/0/default.jpg"
"79","Jaran Sari and Jaran Purnama","        About sufism and focuses on the problem of unity being between God and Mankind (Manunggaling Kawula Gusti). Extent and format of original material: European paper. Length and width of manuscript:21 x 14.6 cm. Length and width of text:18.3 x 13.5 cm.                                                          View images from this file (85)                                    ","EAP211/1/2/32","85 Tiff images","Manuscript","File","Javanese","Javanese","16th century","For research purposes only.","https://images.eap.bl.uk/EAP211/EAP211_1_2_32/1.jp2/full/!600,300/0/default.jpg"
"80","Seseratan (genealogy)","        Punika seseratan tiyang ngasale (this is a story about genealogical records). Extent and format of original material: European paper. Length and width of manuscript:21.5 x 14 cm. Length and width of text:17 x 13 cm.                                                          View images from this file (17)                                    ","EAP211/1/2/33","17 Tiff images","Manuscript","File","Javanese","Javanese","16th century","For research purposes only.","https://images.eap.bl.uk/EAP211/EAP211_1_2_33/1.jp2/full/!600,300/0/default.jpg"
"81","Almanac","        The calculation to determine the time for the wedding; The calculation of time before doing the farming, building a house, building the rice granary, etc. Extent and format of original material: Stripped paper. Length and width of manuscript:21.5 x 16.3 cm. Length and width of text:17.3 x 13.5 cm.                                                          View images from this file (104)                                    ","EAP211/1/2/34","104 Tiff images","Manuscript","File","Javanese","Javanese","16th century","For research purposes only.","https://images.eap.bl.uk/EAP211/EAP211_1_2_34/1.jp2/full/!600,300/0/default.jpg"
"82","The match of luck (Katuranga) of the birds and the prestige of Keris (traditional javanese blade)","        The types of birds, the classification of the keris and sultan princesses notes / Prince King Ragawa; Various kinds of turtle dove birds; Prestige and the characteristics of months and suitable for doing the job. Extent and format of original material: Daluwang paper. Length and width of manuscript:13.3 x 13 cm. Length and width of text:11 x 11 cm.                                                          View images from this file (61)                                    ","EAP211/1/2/35","61 Tiff images","Manuscript","File","Javanese","Javanese","16th century","For research purposes only.","https://images.eap.bl.uk/EAP211/EAP211_1_2_35/1.jp2/full/!600,300/0/default.jpg"
"83","Qur'an","        There are lots of writing errors, which according to the rules are considered to be fatal errors. Extent and format of original material: European paper. Length and width of manuscript:32.7 x 20.5 cm. Length and width of text:27 x 16.5 cm.                                                          View images from this file (20)                                    ","EAP211/1/2/36","20 Tiff images","Manuscript","File","Arabic","Arabic","16th century","For research purposes only.","https://images.eap.bl.uk/EAP211/EAP211_1_2_36/1.jp2/full/!600,300/0/default.jpg"
"84","Qur'an","        There are lots of writing mistakes, about the birth records of girls named Tohiroh in the year called Ba, Jumadil Awal, Monday, 1247 H; a boy named Munadi in the year called alif, Rabiul Awwal, Friday 1251 H. Extent and format of original material: Daluwang paper. Length and width of manuscript:31 x 19.5 cm. Length and width of text:20 x 13 cm.                                                          View images from this file (30)                                    ","EAP211/1/2/37","30 Tiff images","Manuscript","File","Arabic","Arabic","16th century","For research purposes only.","https://images.eap.bl.uk/EAP211/EAP211_1_2_37/1.jp2/full/!600,300/0/default.jpg"
"85","The way of happiness (Sabilussa'adah) Volume I. The translation of the summary of the book entitled Ghoyatul Ikhtishar (The goal of the summary)","        The Book is a translation of Tarjamatul Ghoyatul Mukhtasar (Fathul Qarib). Contains the start to the end of the procedure of purification (thaharah), about the sitting in the prayer known as tahiyat / tasyahud (sitting and reading and praying for the prophet). Extent and format of original material: European paper. Length and width of manuscript:27.5 x 21.3 cm. Length and width of text:20.3 x 13 cm.                                                          View images from this file (246)                                    ","EAP211/1/3/1","246 Tiff images","Manuscript","File","Arabic, Sundanese","Arabic, Javanese","14th century-16th century","For research purposes only.","https://images.eap.bl.uk/EAP211/EAP211_1_3_1/1.jp2/full/!600,300/0/default.jpg"
"86","Sabilussa'adah Volume I (Tarjamatul Mukhtasar Sajarah Ghoyatul Ikhtishar)","        Chapter starts with the knowledge of Islamic jurisprudence (Fiqh) and ends with prayers. Extent and format of original material: European paper. Length and width of manuscript:27.5 x 21.5 cm. Length and width of text:21 x 13.3 cm.                                                          View images from this file (204)                                    ","EAP211/1/3/2","204 Tiff images","Manuscript","File","Arabic, Sundanese","Arabic, Javanese","14th century-16th century","For research purposes only.","https://images.eap.bl.uk/EAP211/EAP211_1_3_2/1.jp2/full/!600,300/0/default.jpg"
"87","Amulet of Guguritan Layang Purwakanti","        Guguritan religious advice. Extent and format of original material: Daluwang paper. Length and width of manuscript:27.5 x 22 cm. Length and width of text:22 x 18 cm.                                                          View images from this file (21)                                    ","EAP211/1/3/3","21 Tiff images","Manuscript","File","Javanese","Javanese","14th century-16th century","For research purposes only.","https://images.eap.bl.uk/EAP211/EAP211_1_3_3/1.jp2/full/!600,300/0/default.jpg"
"88","History of Cirebon","        Notes regarding the arrival of the Dutch to Batavia in 1580; Suluk (the way to approach God), about the meaning of oneness of God; Ehsan (goodness); that there are three pillars of the religion: Islam, faith, and charity. Ihsan including discussion of behavior in seclusion. Extent and format of original material: Length and width of manuscript:30 x 20.5 cm. Length and width of text:23.5 x 14.5 cm.                                                          View images from this file (129)                                    ","EAP211/1/3/4","129 Tiff images","Manuscript","File","Javanese","Javanese","14th century-16th century","For research purposes only.","https://images.eap.bl.uk/EAP211/EAP211_1_3_4/1.jp2/full/!600,300/0/default.jpg"
"89","Chapter on magical Javanese accounts","        Note almanac, magical chantings. Extent and format of original material: Daluwang paper. Length and width of manuscript:27 x 20.5 cm. Length and width of text:21 x 14.5 cm.                                                          View images from this file (100)                                    ","EAP211/1/3/5","100 Tiff images","Manuscript","File","Arabic, Javanese","Arabic, Javanese","14th century-16th century","For research purposes only.","https://images.eap.bl.uk/EAP211/EAP211_1_3_5/1.jp2/full/!600,300/0/default.jpg"
"90","The readings at the time of serenity","        The story of Jayengrana, Amir Hamzah, Umarmaya; The meaning of life. Extent and format of original material: Daluwang paper. Length and width of manuscript:29.5 x 19.5 cm. Length and width of text:24.5 x 17.5 cm.                                                          View images from this file (178)                                    ","EAP211/1/3/6","178 Tiff images","Manuscript","File","Javanese","Javanese","14th century-16th century","For research purposes only.","https://images.eap.bl.uk/EAP211/EAP211_1_3_6/1.jp2/full/!600,300/0/default.jpg"
"91","Magical Javanese account andsuluk (The way to approach God)","        Amulets; A collection of prayer; Prayer in certain traditions like Rebo wekasan Prayer, Prayer in the month of Shafar; Notes about the essence of the spirit and remembrance, remembrance of God; Suluk about how to be closed to God. Extent and format of original material: Daluwang paper. Length and width of manuscript:29 x 19.5 cm. Length and width of text:24.5 x 15 cm.                                                          View images from this file (206)                                    ","EAP211/1/3/7","206 Tiff images","NA","File","Arabic, Javanese","Arabic, Javanese","2009-2010","For research purposes only.","https://images.eap.bl.uk/EAP211/EAP211_1_3_7/1.jp2/full/!600,300/0/default.jpg"
"92","Knowledge on Islamic religion about the part of faith (Syu'batul Iman)","        Distribution / branches of the faith; including patience, trust, etc; Suluk, about the meaning of oneness of God; History and genealogy of Cirebon to the Messenger of Allah through Fatimah ra, Hussein, Zainal Abidin, the Queen of the Children of Israel. Extent and format of original material: Daluwang paper. Length and width of manuscript:27.8 x 9 cm. Length and width of text:19.5 x 13.5 cm.                                                          View images from this file (163)                                    ","EAP211/1/3/8","163 Tiff images","Manuscript","File","Arabic, Javanese","Arabic, Javanese","14th century-16th century","For research purposes only.","https://images.eap.bl.uk/EAP211/EAP211_1_3_8/1.jp2/full/!600,300/0/default.jpg"
"93","Spiritual guidance or inspiration of the prince Bonang about sufism","        Spiritual inspiration (wangsit) of the prince of Bonang about the character of God such as tashbih (imitation) and tanzih (purification). Extent and format of original material: European paper. Length and width of manuscript:27 x 20.5 cm. Length and width of text:19.5 x 14 cm.                                                          View images from this file (89)                                    ","EAP211/1/3/9","90 Tiff images","Manuscript","File","Arabic, Javanese","Javanese","14th century-16th century","For research purposes only.","https://images.eap.bl.uk/EAP211/EAP211_1_3_9/1.jp2/full/!600,300/0/default.jpg"
"94","The story of Tsamud manuscript","        It is told there is a problem in the story in 1000 about Samud Abdullah bin Salam. Original story was written in the language of Persian. It was translated into the Jawi language by the copyist. Beginning with the story of Abbas after visiting the Prophet in Medina, came the angel Gabriel to tell the command to bring / send a letter to a pious Jew in the place named Khaibar and the jew pastor was Abdullah ibnu Salam who was very well learned man about the Torah, the Gospel, and Psalms. The letter was delivered by a qadi named. The letter is as follow: ""Bismillahirrahmanirrahim, (In the name of God the most Merciful) I'm the last prophet, ... fainnal Ardha yarisuha man yasya'min man 'ibadih wal' aqibatu lilmuttaqiin ..."" (the earth will be inherited to those being selected by God from his servants and the end of the events are for the pious people). Extent and format of original material: European paper. Length and width of manuscript:31 x 21.5 cm. Length and width of text:22 x 13 cm.                                                          View images from this file (154)                                    ","EAP211/1/3/10","154 Tiff images","Manuscript","File","Malay","Javanese","14th century-16th century","For research purposes only.","https://images.eap.bl.uk/EAP211/EAP211_1_3_10/1.jp2/full/!600,300/0/default.jpg"
"95","Layang Soeloek ilm bab kebatinan (It is about the way to gain inner knowledge)","        Suluk and about the oneness of God (tawhid). Extent and format of original material: Daluwang paper. Length and width of manuscript:27 x 19 cm. Length and width of text:20.5 x 13.5 cm.                                                          View images from this file (100)                                    ","EAP211/1/3/11","100 Tiff images","Manuscript","File","Javanese","Javanese","14th century-16th century","For research purposes only.","https://images.eap.bl.uk/EAP211/EAP211_1_3_11/1.jp2/full/!600,300/0/default.jpg"
"96","""The letter about grammar, and the manner of speaking""","        Arabic prayers of remembering God and prayer after the obligatory everyday prayer; The way to use the language and manners in using language. Extent and format of original material: European paper. Length and width of manuscript:27.5 x 18.5 cm. Length and width of text:20.5 x 14.5 cm.                                                          View images from this file (54)                                    ","EAP211/1/3/12","54 Tiff images","Manuscript","File","Javanese","Javanese","14th century-16th century","For research purposes only.","https://images.eap.bl.uk/EAP211/EAP211_1_3_12/1.jp2/full/!600,300/0/default.jpg"
"97","The moral of Sufism","        Obeying the parents (Birrul walidain); we were born from the womb of the mother and our parents reciting the call before prayer known as adzan 3x in our ears and they will be loved ones. When mothers become old ones we have to give them the best treatment, we are advised to read the dzikr (remembering God) in abundance so that we will be loved. When we do the exile for some times, we can be the loved one and our heart will glitter. Suluk, (doing the continual remembring of God in order to form good behaviour) and about the meaning of oneness of God ihsan; that there are three pillars of the religion: Islam, faith and charity. Ihsan (doing the good deeds), this subject is included in the discussion of behavior (suluk). Extent and format of original material: Daluwang paper. Length and width of manuscript:27 x 17.5 cm. Length and width of text:19.5 x 12 cm.                                                          View images from this file (21)                                    ","EAP211/1/3/13","21 Tiff images","Manuscript","File","Javanese","Javanese","14th century-16th century","For research purposes only.","https://images.eap.bl.uk/EAP211/EAP211_1_3_13/1.jp2/full/!600,300/0/default.jpg"
"98","Knowledge about the innerside","        (exegetion of the sura of al Fatiha) Tafseer al-Fatihah, advice and warnings to continually remember God; Chapter on promising something for God (nazar); it is implemented if it is suitable and appropriate with the condition of the person, if the person is a sinner he is not allowed to do that (according to Abu Hanifa), according to the Shafi'i, he cannot pay the expiation (kaffarat), according to Ahmad he has to pay the charity if he feels pain in the implementation; Fragments of the verses, like a donkey carrying books; The account number of Arabic letters (hijaiyah) Qur'an 6232. Extent and format of original material: Daluwang paper. Length and width of manuscript:30,5x 20.5 cm. Length and width of text:22.3 x 13 cm.                                                          View images from this file (54)                                    ","EAP211/1/3/14","54 Tiff images","Manuscript","File","Arabic, Javanese","Arabic, Javanese","14th century-16th century","For research purposes only.","https://images.eap.bl.uk/EAP211/EAP211_1_3_14/1.jp2/full/!600,300/0/default.jpg"
"99","The readings of the king Iskandar","        Jayengrana story that explores a variety of countries, such as Rome, Babylon, and Midian, and met with the king of Midian. Extent and format of original material: Daluwang paper. Length and width of manuscript:26.5 x 17.3 cm. Length and width of text:20.5 x 15.5 cm.                                                          View images from this file (181)                                    ","EAP211/1/3/15","181 Tiff images","Manuscript","File","Javanese","Javanese","14th century-16th century","For research purposes only.","https://images.eap.bl.uk/EAP211/EAP211_1_3_15/1.jp2/full/!600,300/0/default.jpg"
"100","The Book of Options (Nawafil)","        About infidelity to God and return based on the story of Ali ra; Nature 20; Jurisprudence; ablution / thaharah etc.; The affair of the disobedient wife (based on the book entitled Taqrib); The explanation of the book of Imam Shafi'i (Sharh / muhadzab (Islamic jurisprudence based on Shafi'i school)); Chapter on circumcision. Extent and format of original material: European paper. Length and width of manuscript:32 x 21 cm. Length and width of text:24 x 13 cm.                                                          View images from this file (229)                                    ","EAP211/1/3/16","229 Tiff images","Manuscript","File","Arabic, Javanese","Arabic, Javanese","14th century-16th century","For research purposes only.","https://images.eap.bl.uk/EAP211/EAP211_1_3_16/1.jp2/full/!600,300/0/default.jpg"
"101","The understanding letter for knowing the Javanese year","        Benchmark of doomsday time and list / calendar. Extent and format of original material: European paper. Length and width of manuscript:22 x 16.5 cm. Length and width of text:27.5 x 22 cm.                                                          View images from this file (34)                                    ","EAP211/1/3/17","34 Tiff images","Manuscript","File","Arabic, Javanese","Arabic, Javanese","14th century-16th century","For research purposes only.","https://images.eap.bl.uk/EAP211/EAP211_1_3_17/1.jp2/full/!600,300/0/default.jpg"
"102","""The story of the king Dharmawangsa, Dharmasunu and the king of Sakadomas""","        Stories of the kings Darmawangsa, Darmasunu and Sakadomas. Extent and format of original material: Daluwang paper. Length and width of manuscript:28.5 x 19.3 cm. Length and width of text:24.5 x 16.5 cm.                                                          View images from this file (242)                                    ","EAP211/1/3/18","242 Tiff images","Manuscript","File","Javanese","Javanese","14th century-16th century","For research purposes only.","https://images.eap.bl.uk/EAP211/EAP211_1_3_18/1.jp2/full/!600,300/0/default.jpg"
"103","Hillul Rumuz wa Mafatihul Kunuz (Fly kawruh kabatinan No.2)","        Front: Prayer from the fragment of the Qur'anic verses, sura: Al-Baqarah and al Maidah; The Prayer of basmalah Kafi, Wafi, ma'afi etc.; Remembrance of Allah, Muhammad ibn Abdullah and ""So and so Allahummaj'al muhammad kama u'iltu muhibbat bin Yusuf, Muhammad bin fulan fi qalbi Zulaikha, etc. (Prayer for the couples which is different from the hadith); Poem of seclusion: He is the One who begins without the beginning. (huwaawinalul mubdi bighairil bidayah), etc. Rear: Achievement of noblest grade and the meaning of there is no God but Allah. Everything will perish but Him; Science and charities. There are two kinds of knowledge: the first oral knowledge that is the argument of God for mankind, and the second is the knowledge of heart, the knowledge of no fearing but God; Knowledge about the way to approach God to achieve the positions of kings. The first is Islam as the early stage of religion, for common believers, that is to perform religious duty, and the second is Iman or the the stage of heart for the special Muslim, to perform religious duty based on outer and inner aspect (heart), Ihsan or being good the stage of spirit for those who try to approach God that is to perform all the obligation by outer and inner aspect in order to show the greatness of God; Repentance is the nature of the common believers, Inabah is the nature of the selected ones and aubah is the nature of the prophets; Haudhal of Life (the Book of Indies) in the council by Muh. Assamarkandi: about the question of who is worthy of being worshiped? God. About the spirit? The Prophet said: Allah affairs; The way of worlds, man, great world and part of the world; Knowing the soul: in the small world from harroh Azizah; 25 blank pages from the end of the day. This is the end of the book entitled Hillul Rumuz by Imam al Arabi, the pole of the saint man Abdillah Muhammad al Maghribi Muhyiddin Arabi. Extent and format of original material: Daluwang paper. Length and width of manuscript:30.5 x 21 cm. Length and width of text:20.5 x 13 cm.                                                          View images from this file (237)                                    ","EAP211/1/3/19","237 Tiff images","Manuscript","File","Javanese","Arabic, Javanese","14th century-16th century","For research purposes only.","https://images.eap.bl.uk/EAP211/EAP211_1_3_19/1.jp2/full/!600,300/0/default.jpg"
"104","The story of war between the King Madian and the King Pharough (Firaun)","        The battle between the King of Midian with King Pharaoh. Extent and format of original material: European paper. Length and width of manuscript:27 x 21 cm. Length and width of text:23 x 17 cm.                                                          View images from this file (98)                                    ","EAP211/1/3/20","98 Tiff images","Manuscript","File","Javanese","Javanese","14th century-16th century","For research purposes only.","https://images.eap.bl.uk/EAP211/EAP211_1_3_20/1.jp2/full/!600,300/0/default.jpg"
"105","A collection of traditions and prayers","        (10) prayer mujarod (has a great advantages), the advice of king Hamzah and other prayers; Hadith which was read on Friday night; Fragments verses for recitation, creed, section on verses named Kursi (ayat al Kursi), all sorts praising the prophet (shalawat). Extent and format of original material: European paper. Length and width of manuscript:20 x 16 cm. Length and width of text:15.5 x 11.5 cm.                                                          View images from this file (263)                                    ","EAP211/1/3/21","263 Tiff images","Manuscript","File","Arabic","Arabic","14th century-16th century","For research purposes only.","https://images.eap.bl.uk/EAP211/EAP211_1_3_21/1.jp2/full/!600,300/0/default.jpg"
"106","It is about Sufism","        About the behavior of seclusion / Sufism, about the true knowledge. Extent and format of original material: Thin Daluwang paper. Length and width of manuscript:23.5 x 16.5 cm. Length and width of text:20 x 18 cm.                                                          View images from this file (63)                                    ","EAP211/1/3/22","63 Tiff images","Manuscript","File","Javanese","Javanese","14th century-16th century","For research purposes only.","https://images.eap.bl.uk/EAP211/EAP211_1_3_22/1.jp2/full/!600,300/0/default.jpg"
"107","Prayer and Almanac of javanese magical account (Primbon)","        The prayers, the verses of Qur'an which is considered efficacious for a particular purpose, character year, month and day. Extent and format of original material: European paper. Length and width of manuscript:20 x 15.5 cm. Length and width of text:4 x 10 cm.                                                          View images from this file (196)                                    ","EAP211/1/3/23","196 Tiff images","Manuscript","File","Javanese","Javanese","14th century-16th century","For research purposes only.","https://images.eap.bl.uk/EAP211/EAP211_1_3_23/1.jp2/full/!600,300/0/default.jpg"
"108","Prayers and remembering the names of God","        The prayers and verses having some advantages. Extent and format of original material: European paper. Length and width of manuscript:20.5 x 16.5 cm. Length and width of text:16 x 13 cm.                                                          View images from this file (103)                                    ","EAP211/1/3/24","103 Tiff images","Manuscript","File","Arabic, Javanese","Arabic, Javanese","14th century-16th century","For research purposes only.","https://images.eap.bl.uk/EAP211/EAP211_1_3_24/1.jp2/full/!600,300/0/default.jpg"
