"","Page Title","Description","Reference","Extent","Content Type","Level","Languages","Scripts","Creation date","Legal","ImgSrc"
"1","""Tawhid, Ascension of The Prophet [c.16th century]""","        This manuscript contains information on all of the requirements of the Islamic faith (Jami'ul arkan) and deals with mysticism. It is divided into different texts: The creed of faith concerning the 20 characteristics of God, written by Ahmad Marzuki bin alm; Sajid Sharif's explanation of the book entitled an-Niqayah (about the pillars of religion and Sufism); the treatise of Ruslan of Damascus, a commentary of Abu Yahya Zakariya Al-Anshary under the title: Fathurahman about monotheism; Treatise of Sheikh Abdul Karim ibn Ibrahim al Jili about the perfect man (al Insan al Kamil); the treatise of the creed of Ahlus Sunnah wal Jamaah; and the News of the ascendancy of the Prophet. Extent and format of original material: 1 manuscript written on European paper. 335mm x 195mm. Length and width of text: 215mm x 130mm.                                                          View images from this file (245)                                    ","EAP211/1/1/1","245 Tiff images","Manuscript","File","Arabic, Javanese","Arabic, Javanese","16th century","For research purposes only.","https://images.eap.bl.uk/EAP211/EAP211_1_1_1/1.jp2/full/!600,300/0/default.jpg"
"2","Fiqh (Islamic Jurisprudence) [c.16th century]","        The way to do ablution and its explanations, the way to perform prayers, etc. Extent and format of original material: Daluwang paper. Length and width of manuscript:24 x 17.5 cm. Length and width of text:15 x 10.5 cm.                                                          View images from this file (146)                                    ","EAP211/1/1/2","146 Tiff images","Manuscript","File","Arabic, Javanese","Arabic, Javanese","16th century","For research purposes only.","https://images.eap.bl.uk/EAP211/EAP211_1_1_2/1.jp2/full/!600,300/0/default.jpg"
"3","Religious Books [c.16th century]","        Advice / guidance and stories. Extent and format of original material: Daluwang paper. Length and width of manuscript:30 x 21.5 cm. Length and width of text:22 x 16.5 cm.                                                          View images from this file (151)                                    ","EAP211/1/1/3","151 Tiff images","Manuscript","File","Javanese","Javanese","16th century","For research purposes only.","https://images.eap.bl.uk/EAP211/EAP211_1_1_3/1.jp2/full/!600,300/0/default.jpg"
"4","History of Banyumas [c.16th century]","        History. Extent and format of original material: folio folded stripped paper. Length and width of manuscript:20.5 x 17 cm. Length and width of text:16.5 x 13.5 cm.                                                          View images from this file (229)                                    ","EAP211/1/1/4","229 Tiff images","Manuscript","File","Javanese","Javanese","16th century","For research purposes only.","https://images.eap.bl.uk/EAP211/EAP211_1_1_4/1.jp2/full/!600,300/0/default.jpg"
"5","Book concerning the part of Faith (Syu'batul Iman is the title; The copyist) [c.16th century]","        Book about Sufism and seven levels (Martabat tujuh); Kitab thaharoh (book of purification); the factors that destroy the deeds: feeling the great for the self, not sincere, arrogance, has a bad intention to others and other bad characters. The pillars of Islam and their explanations. The secret of man and its elements (the existence of God, the prophet and the light of the Prophet Muhammad). Extent and format of original material: European paper. Length and width of manuscript:17.5 x 12 cm. Length and width of text:16 x 11 cm.                                                          View images from this file (249)                                    ","EAP211/1/1/5","249 Tiff images","Manuscript","File","Javanese","Javanese","16th century","For research purposes only.","https://images.eap.bl.uk/EAP211/EAP211_1_1_5/1.jp2/full/!600,300/0/default.jpg"
"6","The manuscript of The Prince Hidayat. Pulasaren Kacirebonan","         The trace of the dead well of the water called Zamzam. The story of Hagar and Sarah, the wives of the prophet Abraham. Extent and format of original material: European paper. Length and width of manuscript: 20.5 x 16.5 cm. Length and width of text:16 x 12.5 cm. Arabic, Javanese, Cirebon, Pegon alphabet.                                                          View images from this file (389)                                    ","EAP211/1/1/6","390 Tiff images","Manuscript","File","Arabic, Javanese","Arabic, Javanese","16th century","For research purposes only.","https://images.eap.bl.uk/EAP211/EAP211_1_1_6/1.jp2/full/!600,300/0/default.jpg"
"7","Primbon (traditional magical accounts of) Wikantadirja","        Decision of the prayers of faith, praising God, remembrance of God, horoscope / the spell, and praying to avoid a hazard. Extent and format of original material: European paper. Length and width of manuscript:21 x 17.5 cm. Length and width of text:17 x 15 cm.                                                          View images from this file (187)                                    ","EAP211/1/1/7","187 Tiff images","Manuscript","File","Javanese","Arabic, Javanese","16th century","For research purposes only.","https://images.eap.bl.uk/EAP211/EAP211_1_1_7/1.jp2/full/!600,300/0/default.jpg"
"8","Manuscript on religion including a chapter on cosmology (Falakiyah)","        The command of Sultan Abul Mafakhir Abdul Qadir in his country to Qodi (judge) Musirudin. The articles about the immoral sanctions (from the book entitled muwahid Ar-Rubaniyyah of the one who believes in one God); the Book of cosmological writing (copyist); writing the years based on lunar calender (Qomariyah) and its comparison with the solar calender (Syamsiyah), and its comparison with pharisee, rumi and Qibti People; Recitation on Friday as the noblest day. Extent and format of original material: European paper. Length and width of manuscript:21 x 13.5 cm. Length and width of text:18 x 11.5 cm.                                                          View images from this file (49)                                    ","EAP211/1/1/8","49 Tiff images","Manuscript","File","Arabic, Javanese","Arabic, Javanese","16th century","For research purposes only.","https://images.eap.bl.uk/EAP211/EAP211_1_1_8/1.jp2/full/!600,300/0/default.jpg"
"9","Manuscript of Prince Hidayat (Primbon)","        Prayer, remembrance, horoscope, the traditions, the heritage and the influence of Imam Nawawi, al-Qubaisyi manuscript concerning the question: Is it permitted to pray without taking ablution and without closing the genitalia?; about shaving and cleansing the belly. Extent and format of original material: European paper. Length and width of manuscript:19.5 x 16 cm. Length and width of text:16 x 12 cm.                                                          View images from this file (29)                                    ","EAP211/1/1/9","29 Tiff images","Manuscript","File","Arabic, Javanese","Arabic, Javanese","16th century","For research purposes only.","https://images.eap.bl.uk/EAP211/EAP211_1_1_9/1.jp2/full/!600,300/0/default.jpg"
"10","Asnawi PA","        Extent and format of original material: Stripped paper. Maatschapij voor Uitvoer & Commissienandel Cheribon. Length and width of manuscript:20.7 x 16.3 cm. Length and width of text:17 x 14.5 cm.                                                          View images from this file (21)                                    ","EAP211/1/1/10","21 Tiff images","NA","File","Javanese","Javanese","2009-2010","For research purposes only.","https://images.eap.bl.uk/EAP211/EAP211_1_1_10/1.jp2/full/!600,300/0/default.jpg"
"11","Notes on religion and daily notes","         The prayers, notes of faith, teachings for the students (ta'lim muta'alim). Extent and format of original material: Paper striped. Internationale credieten. Length and width of manuscript:21.5 x 16.3 cm. Length and width of text:16 x 15.5 cm. Arabic, Javanese, Cirebon, Pegon alphabet.                                                          View images from this file (19)                                    ","EAP211/1/1/11","19 Tiff images","Manuscript","File","Javanese","Arabic, Javanese","16th century","For research purposes only.","https://images.eap.bl.uk/EAP211/EAP211_1_1_11/1.jp2/full/!600,300/0/default.jpg"
"12","Arabic grammar book - Jurumiyah","        Arabic grammar (Nahwu) in the form of descriptions and poems. Extent and format of original material: European paper. Length and width of manuscript: 20.5 x 16.5 cm. Length and width of text: 15 x 12 cm.                                                          View images from this file (95)                                    ","EAP211/1/1/12","95 Tiff images","Manuscript","File","Arabic, Javanese","Arabic, Javanese","16th century","For research purposes only.","https://images.eap.bl.uk/EAP211/EAP211_1_1_12/1.jp2/full/!600,300/0/default.jpg"
"13","Miscellaneous","                                                                  View images from this file (38)                                    ","EAP211/1/1/13","38 Tiffs images","Manuscript","File","Arabic, Javanese","Arabic, Javanese","16th century","For research purposes only.","https://images.eap.bl.uk/EAP211/EAP211_1_1_13/1.jp2/full/!600,300/0/default.jpg"
"14","Primbon (traditional magical accounts) of Kacirebonan palace","        Extent and format of original material: Daluwang paper. Length and width of manuscript: 20.7 x 16.3 cm. Length and width of text: 17 x 14.5 cm.                                                          View images from this file (300)                                    ","EAP211/1/1/14","300 Tiff images","Manuscript","File","Javanese","Javanese","16th century","For research purposes only.","https://images.eap.bl.uk/EAP211/EAP211_1_1_14/1.jp2/full/!600,300/0/default.jpg"
"15","The manuscript of Religion (a collection of religious issues)","        The Oneness of God or Tawheed and the faith. Extent and format of original material: Daluwang paper. Length and width of manuscript: 24.5 x 17 cm. Length and width of text: 14.5 x 9.5 cm.                                                          View images from this file (181)                                    ","EAP211/1/1/15","181 Tiff images","Manuscript","File","Arabic, Javanese","Arabic, Javanese","16th century","For research purposes only.","https://images.eap.bl.uk/EAP211/EAP211_1_1_15/1.jp2/full/!600,300/0/default.jpg"
"16","Wahosan Bujang Genjong","        Stanza song about the youth period (stanza in love, the period of waiting for the couple (Kinanti), the period of death (megatruh) etc.): local literature. Extent and format of original material: Stripped paper. uitvoer en Maatschappij voor Semarang commissiehandel. Length and width of manuscript:20.5 x 16 cm. Length and width of text:17 x 14 cm.                                                          View images from this file (37)                                    ","EAP211/1/1/16","37 Tiff images","Manuscript","File","Javanese, Malay","Javanese, Latin","16th century","For research purposes only.","https://images.eap.bl.uk/EAP211/EAP211_1_1_16/1.jp2/full/!600,300/0/default.jpg"
"17","The Book of Religion (The title of the collector)","        Prayer ablution and its way, qunut prayer, praying when performing the prayer, etc. Extent and format of original material: Stripped paper. Internationale en handelsvereeniging. Length and width of manuscript:21 x 17 cm. Length and width of text:16.5 x 14.5 cm.                                                          View images from this file (6)                                    ","EAP211/1/1/17","6 Tiff images","Manuscript","File","Arabic","Arabic","16th century","For research purposes only.","https://images.eap.bl.uk/EAP211/EAP211_1_1_17/1.jp2/full/!600,300/0/default.jpg"
"18","The manuscript of Pagusten Wetan Kacirebonan","        The prayers and the praises to God that should be chanted before the congregational prayers, stanza / song. Extent and format of original material: Underline Paper. Djoe Long Tjirebon. Length and width of manuscript:20.5 x 16.3 cm. Length and width of text:16.5 x 11.5 cm.                                                          View images from this file (39)                                    ","EAP211/1/1/18","39 Tiff images","Manuscript","File","Javanese","Javanese","16th century","For research purposes only.","https://images.eap.bl.uk/EAP211/EAP211_1_1_18/1.jp2/full/!600,300/0/default.jpg"
"19","""Islam, The prayers (The title of the collector)""","        Prayer intentions remains, prayer, remembrance and reciting the certain verses of the Qur'an called the verses of kursy; reciting the names of God called Asmaul Names and their meanings; reciting a fragment of the verses of the Qur'an (sura al-Qodr), advice, and cosmological book. Extent and format of original material: European paper. Length and width of manuscript: 21 x 13.5 cm. Length and width of text: 17.5 x 10 cm.                                                          View images from this file (34)                                    ","EAP211/1/1/19","34 Tiff images","Manuscript","File","Arabic, Javanese","Arabic, Javanese","16th century","For research purposes only.","https://images.eap.bl.uk/EAP211/EAP211_1_1_19/1.jp2/full/!600,300/0/default.jpg"
"20","Book of The Prophet shaving","        The story of the birth of the prophet and the prophet's shaving. Extent and format of original material: European paper. Length and width of manuscript: 21.5 x 17.5 cm. Length and width of text: 16 x 13 cm.                                                          View images from this file (30)                                    ","EAP211/1/1/20","30 Tiff images","Manuscript","File","Sundanese","Arabic, Javanese","16th century","For research purposes only.","https://images.eap.bl.uk/EAP211/EAP211_1_1_20/1.jp2/full/!600,300/0/default.jpg"
"21","The Book of The Prophet Muhammad's Tale","        The story of the prophet, son of Abdullah shaving, and reciting or chanting the names of God (Asmaul Husna). Extent and format of original material: European paper. Length and width of manuscript: 21.2 x 17.5 cm. Length and width of text: 17 x 13.7 cm.                                                          View images from this file (12)                                    ","EAP211/1/1/21","12 Tiff images","Manuscript","File","Arabic, Javanese","Arabic, Javanese","16th century","For research purposes only.","https://images.eap.bl.uk/EAP211/EAP211_1_1_21/1.jp2/full/!600,300/0/default.jpg"
"22","Book of The Prophet shaving","        The meaning of each verse in the Sura of Al-Fatihah from the Qur'an. Extent and format of original material: European paper. Length and width of manuscript: 21 x 16.5 cm. Length and width of text: 15 x 11 cm.                                                          View images from this file (29)                                    ","EAP211/1/1/22","29 Tiff images","Manuscript","File","Arabic, Javanese","Arabic, Javanese","16th century","For research purposes only.","https://images.eap.bl.uk/EAP211/EAP211_1_1_22/1.jp2/full/!600,300/0/default.jpg"
"23","Javanese magical account or javanese astrology (Primbon) of Prince Wijaya","        Prayers. Extent and format of original material: European paper. Length and width of manuscript: 21.5 x 16 cm. Length and width of text: 15.5 x 10 cm.                                                          View images from this file (27)                                    ","EAP211/1/1/23","27 Tiff images","Manuscript","File","Arabic, Javanese","Arabic, Javanese","16th century","For research purposes only.","https://images.eap.bl.uk/EAP211/EAP211_1_1_23/1.jp2/full/!600,300/0/default.jpg"
"24","Politics of the prince Kanoman","        Concerning regulations of the organization / association in Cirebon promoting the works written about the Chronicle of Cirebon. Extent and format of original material: Paper Underline. Geo Wehry & co. Java. Length and width of manuscript:21 x 16.5 cm. Length and width of text:17.5 x 15 cm.                                                          View images from this file (39)                                    ","EAP211/1/1/24","39 Tiff images","NA","File","Javanese, Indonesian","Javanese, Latin","2009-2010","For research purposes only.","https://images.eap.bl.uk/EAP211/EAP211_1_1_24/1.jp2/full/!600,300/0/default.jpg"
"25","Book of medication (Tetamba)-PA-Primbon","        The problem of treatment, arranged marriage, and recipes / secret, marriage, predict the nature of people, advice, amulets. [In some pale there glossa with Java letter]. Extent and format of original material: European paper. Length and width of manuscript: 25.5 x 19.5 cm. Length and width of text: 18 x 14 cm.                                                          View images from this file (176)                                    ","EAP211/1/1/25","176 Tiff images","Manuscript","File","Javanese","Javanese","16th century","For research purposes only.","https://images.eap.bl.uk/EAP211/EAP211_1_1_25/1.jp2/full/!600,300/0/default.jpg"
"26","The sufi order of (Petarekan) Muhammadiyah and seven levels","        The meaning of God's characters such as great, beautiful, perfect the great Allah and the nature of God and human beings as well as the nature of the light called an Nur al Muhammadiyah. Extent and format of original material: European paper. Length and width of manuscript: 35.5 x 22 cm. Length and width of text: 25 x 17 cm.                                                          View images from this file (83)                                    ","EAP211/1/1/26","83 Tiff images","Manuscript","File","Arabic, Javanese","Arabic, Javanese","16th century","For research purposes only.","https://images.eap.bl.uk/EAP211/EAP211_1_1_26/1.jp2/full/!600,300/0/default.jpg"
"27","The sufi order of (Petarekan) Muhammadiyah Kacirebonan","        The meaning of God's characters such as great, beautiful, perfect the great Allah and the nature of God and nature of the light called an nur al Muhammadi. Extent and format of original material: European paper. Length and width of manuscript: 36 x 22 cm. Length and width of text: 25 x 16.5 cm.                                                          View images from this file (56)                                    ","EAP211/1/1/27","56 Tiff images","Manuscript","File","Arabic, Javanese","Arabic, Javanese","16th century","For research purposes only.","https://images.eap.bl.uk/EAP211/EAP211_1_1_27/1.jp2/full/!600,300/0/default.jpg"
"28","Order of Shatariyah of Muhammadiyah","        About the order of shatariyyah, the way of performing prayers and its recitations, the obligation to do circumcision. Utawi anapon ing the nature of the body iku iku iya kang Arupa daing Muhammad Nurullah arane Muhammadiyah. (The nature of God himself Muhammad in the form of light called Muhammadiyah). Extent and format of original material: Stripped paper. Length and width of manuscript:17 x 10 cm. Length and width of text:14 x 7 cm.                                                          View images from this file (61)                                    ","EAP211/1/1/28","61 Tiff images","Manuscript","File","Javanese","Javanese","16th century","For research purposes only.","https://images.eap.bl.uk/EAP211/EAP211_1_1_28/1.jp2/full/!600,300/0/default.jpg"
"29","The Order of Queen Fatima","        Book of the origin of Shatariyah order in the sultanate / genealogy, the prayers of the prophets and monotheism. Extent and format of original material: European paper. Length and width of manuscript: 21 x 16.5 cm. Length and width of text: 16 x 11.5 cm.                                                          View images from this file (93)                                    ","EAP211/1/1/29","93 Tiff images","Manuscript","File","Arabic, Javanese","Arabic, Javanese","16th century","For research purposes only.","https://images.eap.bl.uk/EAP211/EAP211_1_1_29/1.jp2/full/!600,300/0/default.jpg"
"30","The Keris I of The Prince Yusuf Dendabrata Palace of Kacirebonan","        A description of the parts of the kris, the manufacture, its use and benefit. Extent and format of original material: Stripped paper. Length and width of manuscript:21.5 x 17 cm. Length and width of text:19 x 15 cm.                                                          View images from this file (40)                                    ","EAP211/1/1/30","40 Tiff images","Manuscript","File","Javanese, Sundanese","Latin","16th century","For research purposes only.","https://images.eap.bl.uk/EAP211/EAP211_1_1_30/1.jp2/full/!600,300/0/default.jpg"
"31","The Keris II of The Prince Yusuf Dendabrata Palace of Kacirebonan","        A description of the parts of the kris, the manufacture and its use and benefit. Extent and format of original material: Stripped paper. Length and width of manuscript: 21.5 x 17 cm. Length and width of text: 19 x 15 cm.                                                          View images from this file (40)                                    ","EAP211/1/1/31","40 Tiff images","Manuscript","File","Sundanese, Javanese","Latin","16th century","For research purposes only.","https://images.eap.bl.uk/EAP211/EAP211_1_1_31/1.jp2/full/!600,300/0/default.jpg"
"32","History of Cirebon H. Mahmud Rais","        The creed and prayers Cirebon. Extent and format of original material: Stripped paper. Length and width of manuscript:21 x 16 cm. Length and width of text:17.5 x 15 cm.                                                          View images from this file (538)                                    ","EAP211/1/1/32","538 Tiff images","Manuscript","File","Javanese, Indonesian","Latin","16th century","For research purposes only.","https://images.eap.bl.uk/EAP211/EAP211_1_1_32/1.jp2/full/!600,300/0/default.jpg"
"33","Stories Prose (Mataram)","        Traditional poetical songs (Tembang) stanza (17 stanza) of wawacan Ratnawati and King Anyakrawati who was sick in her bed and further about Prameswari dialogue concerning the departure of King Mangkurat to hunt in sparkling golden yellow clothes. Extent and format of original material: European paper. Length and width of manuscript:21.5 x 18 cm. Length and width of text:18 x 14 cm.                                                          View images from this file (116)                                    ","EAP211/1/1/33","116 Tiff images","Manuscript","File","Javanese","Javanese","16th century","For research purposes only.","https://images.eap.bl.uk/EAP211/EAP211_1_1_33/1.jp2/full/!600,300/0/default.jpg"
"34","Chronicle Dermayu","        Stanza song (17 stanza) of Wiralodra. Extent and format of original material: Stripped paper. Length and width of manuscript:22.5 x 17.5 cm. Length and width of text:18 x 14.5 cm.                                                          View images from this file (178)                                    ","EAP211/1/1/34","178 Tiff images","Manuscript","File","Javanese","Javanese","16th century","For research purposes only.","https://images.eap.bl.uk/EAP211/EAP211_1_1_34/1.jp2/full/!600,300/0/default.jpg"
"35","The manuscript of bird (Manuk)","        The story of Tunggul Wulung and Pager Gunung. Extent and format of original material: European paper. Length and width of manuscript:20 x 16 cm. Length and width of text:15 x 11.5 cm.                                                          View images from this file (24)                                    ","EAP211/1/1/35","24 Tiff images","Manuscript","File","Javanese","Javanese","16th century","For research purposes only.","https://images.eap.bl.uk/EAP211/EAP211_1_1_35/1.jp2/full/!600,300/0/default.jpg"
"36","Javanese script","        Seven levels (Martabat Tujuh) and the fourth phase of watching the greatness of God (tajalli). Extent and format of original material: Strimin paper. Length and width of manuscript: 27 x 21.5 cm. Length and width of text: 24 x 16.5 cm.                                                          View images from this file (60)                                    ","EAP211/1/1/36","60 Tiff images","Manuscript","File","Javanese","Javanese","16th century","For research purposes only.","https://images.eap.bl.uk/EAP211/EAP211_1_1_36/1.jp2/full/!600,300/0/default.jpg"
"37","Puppet Scripts","        Extent and format of original material: European paper. Length and width of manuscript:21.5 x 17.5 cm. Length and width of text:17 x 13 cm.                                                          View images from this file (70)                                    ","EAP211/1/1/37","70 Tiff images","Manuscript","File","Javanese","Javanese","16th century","For research purposes only.","https://images.eap.bl.uk/EAP211/EAP211_1_1_37/1.jp2/full/!600,300/0/default.jpg"
"38","Javanese script","        Extent and format of original material: European paper. Length and width of manuscript:27 x 21.5 cm. Length and width of text:22 x 16.5 cm.                                                          View images from this file (52)                                    ","EAP211/1/1/38","52 Tiff images","Manuscript","File","Javanese","Javanese","16th century","For research purposes only.","https://images.eap.bl.uk/EAP211/EAP211_1_1_38/1.jp2/full/!600,300/0/default.jpg"
