"","Page Title","Description","Reference","Extent","Content Type","Level","Languages","Scripts","Creation date","Legal","ImgSrc"
"39","Javanese puppet (Wayang) and the prayers for the prophet Muhammad","        Puppets and blessings prayers for the prophet Muhammad. Extent and format of original material: European paper. Length and width of manuscript:27 x 21 cm. Length and width of text:21 x 16 cm.                                                          View images from this file (93)                                    ","EAP211/1/1/39","93 Tiff images","Manuscript","File","Arabic, Javanese","Arabic, Javanese","16th century","For research purposes only.","https://images.eap.bl.uk/EAP211/EAP211_1_1_39/1.jp2/full/!600,300/0/default.jpg"
"40","Asmaragama (book concerning religious cosmology)","        Prayers and cosmology. Extent and format of original material: European paper. Length and width of manuscript: 27.5 x 22 cm. Length and width of text: 21.5 x 17 cm.                                                          View images from this file (38)                                    ","EAP211/1/1/40","38 Tiff images","Manuscript","File","Arabic, Javanese","Arabic, Javanese","16th century","For research purposes only.","https://images.eap.bl.uk/EAP211/EAP211_1_1_40/1.jp2/full/!600,300/0/default.jpg"
"41","The manuscript of Petarekan","        The Order of Shatariyah, the nature of the heart and how to manage the heart and the way to live for the couples. Extent and format of original material: Daluwang paper. Length and width of manuscript: 19 x 14 cm. Length and width of text: 15 x 11 cm.                                                          View images from this file (38)                                    ","EAP211/1/1/41","38 Tiff images","Manuscript","File","Arabic, Javanese","Arabic, Javanese","16th century","For research purposes only.","https://images.eap.bl.uk/EAP211/EAP211_1_1_41/1.jp2/full/!600,300/0/default.jpg"
"42","The manuscript of Prince Padmaningrat Kacirebonan","        The calculation of time / calendar. Extent and format of original material: European paper. Length and width of manuscript: 22 x 17 cm. Length and width of text: 18 x 13 cm.                                                          View images from this file (16)                                    ","EAP211/1/1/42","16 Tiff images","Manuscript","File","Arabic, Javanese","Arabic, Javanese","16th century","For research purposes only.","https://images.eap.bl.uk/EAP211/EAP211_1_1_42/1.jp2/full/!600,300/0/default.jpg"
"43","Mihir / Pujine Tiger of Ali","        Sufism, the prophethood, prayers and stories of Umar. Extent and format of original material: European paper. Length and width of manuscript: 21 x 16 cm. Length and width of text: 17 x 13.5 cm.                                                          View images from this file (45)                                    ","EAP211/1/1/43","45 Tiff images","Manuscript","File","Arabic, Javanese","Arabic, Javanese","16th century","For research purposes only.","https://images.eap.bl.uk/EAP211/EAP211_1_1_43/1.jp2/full/!600,300/0/default.jpg"
"44","Miscellaneous","                                                                  View images from this file (14)                                    ","EAP211/1/1/44","14 Tiff images","Manuscript","File","Arabic, Javanese","Arabic, Javanese","16th century","For research purposes only.","https://images.eap.bl.uk/EAP211/EAP211_1_1_44/1.jp2/full/!600,300/0/default.jpg"
"45","Miscellaneous","                                                                  View images from this file (7)                                    ","EAP211/1/1/45","7 Tiff images","Manuscript","File","Arabic, Javanese","Arabic, Javanese","16th century","For research purposes only.","https://images.eap.bl.uk/EAP211/EAP211_1_1_45/1.jp2/full/!600,300/0/default.jpg"
"46","Miscellaneous","                                                                  View images from this file (3)                                    ","EAP211/1/1/46","3 Tiff images","Manuscript","File","Arabic, Javanese","Arabic, Javanese","16th century","For research purposes only.","https://images.eap.bl.uk/EAP211/EAP211_1_1_46/1.jp2/full/!600,300/0/default.jpg"
"47","""The meaning of sura Al-Fatihah, faith and Islam""","        The beginning: the purification, then the obligatory prayers and the Sunnah and ended with carakan (sundanese script) about the meaning of sura Al-Fatihah, faith and Islam. Extent and format of original material: European paper. Length and width of manuscript: 19.5 x 15.5 cm. Length and width of text: 16.5 x 11 cm.                                                          View images from this file (89)                                    ","EAP211/1/1/47","89 Tiff images","Manuscript","File","Javanese","Javanese","16th century","For research purposes only.","https://images.eap.bl.uk/EAP211/EAP211_1_1_47/1.jp2/full/!600,300/0/default.jpg"
"48","Islamic creed/Divinity and debated sciences","        Study of the creed on deny and confirmation of the testimony itsbat lailaha illallah (There is no God but Allah); breakdown of the 20 characters of God; Division and its category; explanation about the evil deeds and the possibility. Extent and format of original material: School script stripped folio paper. Length and width of manuscript: 21 x 16,5 cm. Length and width of text: 17,5 x 13cm.                                                          View images from this file (54)                                    ","EAP211/1/2/1","54 Tiff images","Manuscript","File","Javanese","Javanese","16th century","For research purposes only.","https://images.eap.bl.uk/EAP211/EAP211_1_2_1/1.jp2/full/!600,300/0/default.jpg"
"49","Story of The Prophet Shaving","        The meeting of the prophet with the archangel, telling that God speak to the nymph, after being born, the prophet is shaved; explanation about Seven Grades and the Prophet Muhammad is created from the light. Extent and format of original material: European Paper. Length and width of manuscript:16,3 x 10,5 cm. Length and width of text:12,7 x 7,5 cm.                                                          View images from this file (39)                                    ","EAP211/1/2/2","39 Tiff images","Manuscript","File","Javanese","Arabic, Javanese","16th century","For research purposes only.","https://images.eap.bl.uk/EAP211/EAP211_1_2_2/1.jp2/full/!600,300/0/default.jpg"
"50","Shattariyah Order - Muhammadiyah","        Explanations about the way of the order of the Muhammad and the way to perform it; the area of enchanting the names of God along with the illustration of areas of its enchanting the names of God with the illustration of Muhammad and Shattariyah order, explaining 20 characteristics of God, and the explanation about the stratum of the heart. Extent and format of original material: European Paper. Length and width of manuscript:21 x 17 cm. Length and width of text:17 x 13 cm.                                                          View images from this file (28)                                    ","EAP211/1/2/3","28 Tiff images","Manuscript","File","Javanese","Arabic, Javanese","16th century","For research purposes only.","https://images.eap.bl.uk/EAP211/EAP211_1_2_3/1.jp2/full/!600,300/0/default.jpg"
"51","Shattariya and Naqshabandiyya Orders","        Origin of enchanting the names of God according to Shattariya order, taking the oath and its instruction to the dead. It is explained with illustration of the area of remembering God and the essence of la ilaha illallah, letter of lam alif and the area of heart two strata. To be a good disciple of the order, it is important to know about its ethics and manner and should know about the characters of God, its substance, character or act. It also explains about the concept of Seven Grades and prayer in the face of enemy/Dutch colonialism. Extent and format of original material: Striped paper. Length and width of manuscript:21 x 16,5 cm. Length and width of text:17,5 x 16,5 cm.                                                          View images from this file (190)                                    ","EAP211/1/2/4","190 Tiff images","Manuscript","File","Javanese","Arabic, Javanese","16th century","For research purposes only.","https://images.eap.bl.uk/EAP211/EAP211_1_2_4/1.jp2/full/!600,300/0/default.jpg"
"52","The history of Cirebon Rante/The history of saint man","        The story of the saints and their genealogies to the prophet through Fatimah from the line of RajaNgumda, the Queen of Egypt who bear the Sultan of Hut, the Queen of the Jewish. Extent and format of original material: European Paper. Length and width of manuscript:34,5 x 21 cm. Length and width of text:25 x 14 cm.                                                          View images from this file (56)                                    ","EAP211/1/2/5","56 Tiff images","Manuscript","File","Javanese","Arabic, Javanese","16th century","For research purposes only.","https://images.eap.bl.uk/EAP211/EAP211_1_2_5/1.jp2/full/!600,300/0/default.jpg"
"53","Book of Islamic Jurisprudence","        The book about purification such as how to purify oneself from the toilet; to purify by using the stone; some kinds of holy water and could be used for purification; some causes of taking a bath because of impurity after coitus; some things abrogating purification with sand in absence of water and the meaning of good words. It is given the explanation in Arabic Pegon. Extent and format of original material: European Paper. Length and width of manuscript:21 x 7 cm. Length and width of text:16 x 12 cm.                                                          View images from this file (208)                                    ","EAP211/1/2/6","208 Tiff images","Manuscript","File","Arabic, Javanese","Arabic, Javanese","16th century","For research purposes only.","https://images.eap.bl.uk/EAP211/EAP211_1_2_6/1.jp2/full/!600,300/0/default.jpg"
"54","History of Cirebon","        Story about the history of Gedheng Babadan Nyai Syarifah Mudaim, son of Molonjati, Datuk Abdul Kafi and panembahan Losari. Extent and format of original material: Folio paper. Length and width of manuscript:33,5 x 20,5 cm. Length and width of text:28,5 x 15,2 cm.                                                          View images from this file (13)                                    ","EAP211/1/2/7","13 Tiff images","Manuscript","File","Javanese","Javanese","16th century","For research purposes only.","https://images.eap.bl.uk/EAP211/EAP211_1_2_7/1.jp2/full/!600,300/0/default.jpg"
"55","The book of purification and prayer","        It is advised to know by all the readers about the obligation of taking baths, the intention and the ways. It is also important to know precisely about the obligation of performing prayer and in the right ways. Extent and format of original material: Daluwang paper. Length and width of manuscript:20 x 13 cm. Length and width of text:15.5 x 9.5 cm.                                                          View images from this file (110)                                    ","EAP211/1/2/8","110 Tiff images","Manuscript","File","Javanese","Javanese","16th century","For research purposes only.","https://images.eap.bl.uk/EAP211/EAP211_1_2_8/1.jp2/full/!600,300/0/default.jpg"
"56","Compilation of prayers and Javanese Almanac","        Prayer for the opening of livelihood; prayer for the pregnant women; explanation of the core of the chapter from the Qur’an called al-An'am; prayer after getting up from the bad. All are written from the right and the story of the prophet Abraham in the left. Extent and format of original material: School script stripped folio paper. Length and width of manuscript:21 x 16,5 cm. Length and width of text:17.5 x 15.5 cm.                                                          View images from this file (15)                                    ","EAP211/1/2/9","15 Tiff images","Manuscript","File","Javanese","Javanese","16th century","For research purposes only.","https://images.eap.bl.uk/EAP211/EAP211_1_2_9/1.jp2/full/!600,300/0/default.jpg"
"57","The Will of Sunan Gunung Jati (The saint man named Sunan Gunung Jati and his advice as well as prayers)","        The advices of Sunan Gunung Jati to the Prince of Panjunan: explanation of paragraph 15 of Hadrat Ali ra, opening prayer for getting much earning, prayer of the prophet Salomon, enchanting the names of God (tahlil) and prayer for the spirit. His will or advises to Prince Panjunan: to respect the parents, to be thankful to God, to control the anger, to be humble, to get ride of the character of cowardice, to take a sympathy to the people, not to be a rude person, to bear the needs of the widow, to be firm by commendable attitude, to avoid playing off the people, to keep the promise, to be tolerant, to honor the heritage of the the Islamic society/ al-Qur 'an, to be true believers, to honor the guests, to fear God, to do justice and forgiveness, not to do inappropriate act, not to subject to lust, to look for the good luck/ earning legitimately and many other 40 kinds. Extent and format of original material: School script stripped folio paper. Length and width of manuscript:21 x 16.5 cm. Length and width of text:17.5 x 12.5 cm.                                                          View images from this file (18)                                    ","EAP211/1/2/10","18 Tiff images","Manuscript","File","Javanese","Javanese","16th century","For research purposes only.","https://images.eap.bl.uk/EAP211/EAP211_1_2_10/1.jp2/full/!600,300/0/default.jpg"
"58","Suluk or mysticism of Cirebon","        Prayer for taking a bath in Javanese language, mystical remarks of born science, the area for enchanting the names of God based on Muhammad's teachings, expecting the blessing from Sheikh Akbar (one of the great Sufis). Extent and format of original material: Stripped paper. Length and width of manuscript:14,5 x 9 cm. Length and width of text:12 x 8.5 cm.                                                          View images from this file (96)                                    ","EAP211/1/2/11","96 Tiff images","Manuscript","File","Javanese","Javanese","16th century","For research purposes only.","https://images.eap.bl.uk/EAP211/EAP211_1_2_11/1.jp2/full/!600,300/0/default.jpg"
"59","Chronicles of the warriors","        Manuscript of the seven hundred times of the warriors eating caku. Extent and format of original material: Length and width of manuscript:28 x 22 cm. Length and width of text:24 x 19 cm.                                                          View images from this file (63)                                    ","EAP211/1/2/12","63 Tiff images","Manuscript","File","Javanese","Javanese","16th century","For research purposes only.","https://images.eap.bl.uk/EAP211/EAP211_1_2_12/1.jp2/full/!600,300/0/default.jpg"
"60","The story of Lemandawarsa","        The Prayer of the opening prayer for the prophet (solawat) Allahumma shalli ala Sayyidina Muhammad wa ala alihi ajma'in. Extent and format of original material: Length and width of manuscript:28 x 22 cm. Length and width of text:24 x 19 cm.                                                          View images from this file (21)                                    ","EAP211/1/2/13","21 Tiff images","Manuscript","File","Javanese","Javanese","16th century","For research purposes only.","https://images.eap.bl.uk/EAP211/EAP211_1_2_13/1.jp2/full/!600,300/0/default.jpg"
"61","The story of Doomsday according to the word of God","        It is the story of the Day of Judgement, about God's instruction. Extent and format of original material: Daluwang paper. Length and width of manuscript:23 x 16.5 cm. Length and width of text:17 x 11.5 cm.                                                          View images from this file (94)                                    ","EAP211/1/2/14","94 Tiff images","Manuscript","File","Javanese","Javanese","16th century","For research purposes only.","https://images.eap.bl.uk/EAP211/EAP211_1_2_14/1.jp2/full/!600,300/0/default.jpg"
"62","The Book of the oneness of God (tawhid)","        The Prayer basmalah at the beginning, the exlanation about the manifestation of faith; God is the source of faith. Extent and format of original material: Daluwang paper. Length and width of manuscript:23.5 x 15.5 cm. Length and width of text:19 x 12 cm.                                                          View images from this file (37)                                    ","EAP211/1/2/15","37 Tiff images","Manuscript","File","Javanese","Javanese","16th century","For research purposes only.","https://images.eap.bl.uk/EAP211/EAP211_1_2_15/1.jp2/full/!600,300/0/default.jpg"
"63","Chronicle of Patih Sulareja Martasinga","        The manuscript of Prince Patih Sulareja Martasinga (h.1) with the signature; Explanation about the completeness of life is the completeness of death (sampurnaning sampurnaning urip Iku sampurnaning pati). Extent and format of original material: European paper. Length and width of manuscript:21.5 x 16 cm. Length and width of text:17 x 12 cm.                                                          View images from this file (51)                                    ","EAP211/1/2/16","51 Tiff images","Manuscript","File","Javanese","Javanese","16th century","For research purposes only.","https://images.eap.bl.uk/EAP211/EAP211_1_2_16/1.jp2/full/!600,300/0/default.jpg"
"64","Traditional history (Babad) of Demak and treatment","        (h.1-13) Chronicle of Demak, Demak mosque that was completed, then reportation from Ki Mas Pati Surakarti; Medications and tools for fever, swelling etc. (h.14-23). Extent and format of original material: European paper. Length and width of manuscript:21 x 17 cm. Length and width of text:19.5 x 15 cm.                                                          View images from this file (25)                                    ","EAP211/1/2/17","25 Tiff images","Manuscript","File","Javanese","Javanese","16th century","For research purposes only.","https://images.eap.bl.uk/EAP211/EAP211_1_2_17/1.jp2/full/!600,300/0/default.jpg"
"65","Spiritual guidance (wangsit) of The King Satmata","        King Wangsit Satmata; started with the sentence of basmalah. Extent and format of original material: Daluwang paper. Length and width of manuscript:22.5 x 14.5 cm. Length and width of text:18.5 x 10.5 cm.                                                          View images from this file (32)                                    ","EAP211/1/2/18","32 Tiff images","Manuscript","File","Javanese","Arabic, Javanese","16th century","For research purposes only.","https://images.eap.bl.uk/EAP211/EAP211_1_2_18/1.jp2/full/!600,300/0/default.jpg"
"66","The guidance of The 7th Attorney","        It is the law book of Cirebon state, containing the guidelines for prosecutors; (rules if there are foreigners like those of parayu (?), killed the thieves or being killed by the thieves). Extent and format of original material: European paper. Length and width of manuscript:15.8 x 10.3 cm. Length and width of text:13 x 7 cm.                                                          View images from this file (101)                                    ","EAP211/1/2/19","101 Tiff images","Manuscript","File","Javanese","Javanese","16th century","For research purposes only.","https://images.eap.bl.uk/EAP211/EAP211_1_2_19/1.jp2/full/!600,300/0/default.jpg"
"67","The Book of Jurisprudence","        The way of taking bath after sexual intercourse for women (h.1 talking about); Definition of ritual impurity and how to purify it(pegon h.1). Extent and format of original material: Daluwang paper. Length and width of manuscript:28 x 19.5 cm. Length and width of text:23.5 x 17.5 cm.                                                          View images from this file (35)                                    ","EAP211/1/2/20","35 Tiff images","Manuscript","File","Javanese","Javanese","16th century","For research purposes only.","https://images.eap.bl.uk/EAP211/EAP211_1_2_20/1.jp2/full/!600,300/0/default.jpg"
"68","Order of sufism (Tarekat)","        Life is the breathing that down and climb from the bottom to the top. Remembering God (Dzikr) is actually following the ups and downs of breath. Prayers; sailing (h.2), and the testimonial creed of the choosen Pious people. Extent and format of original material: Daluwang paper. Length and width of manuscript:17 x 15 cm. Length and width of text:14 x 12.5 cm.                                                          View images from this file (33)                                    ","EAP211/1/2/21","33 Tiff images","Manuscript","File","Javanese","Javanese","16th century","For research purposes only.","https://images.eap.bl.uk/EAP211/EAP211_1_2_21/1.jp2/full/!600,300/0/default.jpg"
"69","Kinds of Islamic testimony and the words of Bismillahirrahmanirrahim","        The types of testimonial creed and basmalah. Extent and format of original material: Length and width of manuscript:21 x 17 cm. Length and width of text:17 x 14.5 cm.                                                          View images from this file (108)                                    ","EAP211/1/2/22","108 Tiff images","Manuscript","File","Javanese","Javanese","16th century","For research purposes only.","https://images.eap.bl.uk/EAP211/EAP211_1_2_22/1.jp2/full/!600,300/0/default.jpg"
"70","Medication","        About treatments / tetamba (13), anti-cough, abdominal pain etc. Extent and format of original material: European paper. Length and width of manuscript:10.3 x 8.5 cm. Length and width of text:7.3 x 5.8 cm.                                                          View images from this file (12)                                    ","EAP211/1/2/23","12 Tiff images","Manuscript","File","Javanese","Javanese","16th century","For research purposes only.","https://images.eap.bl.uk/EAP211/EAP211_1_2_23/1.jp2/full/!600,300/0/default.jpg"
"71","(Asmaragama) all about women's reproductive organs and their reproductive health","        About the ins and outs of women, and reproductive organs. Extent and format of original material: Daluwang paper. Length and width of manuscript:21 x 16 cm. Length and width of text:16.5 x 12.5 cm.                                                          View images from this file (29)                                    ","EAP211/1/2/24","29 Tiff images","Manuscript","File","Javanese","Arabic","16th century","For research purposes only.","https://images.eap.bl.uk/EAP211/EAP211_1_2_24/1.jp2/full/!600,300/0/default.jpg"
"72","King Madyan","        Balad Wadya Madyan hing, sampun madep sira kabeh nedya sabilulla... (Madyan troop reinforcements are ready to face combat in war in the path of God). Extent and format of original material: European paper. Length and width of manuscript:21 x 17 cm. Length and width of text:17.5 x 13.5 cm.                                                          View images from this file (101)                                    ","EAP211/1/2/25","101 Tiff images","Manuscript","File","Javanese","Javanese","16th century","For research purposes only.","https://images.eap.bl.uk/EAP211/EAP211_1_2_25/1.jp2/full/!600,300/0/default.jpg"
"73","Table of time according to Javanese calender (Paldina /waktu)","        Prayer for gaining property; about adam and eve; alphabetical letters for numbers / astrology. Extent and format of original material: European paper. Length and width of manuscript:9 x 5.5 cm. Length and width of text:7.5 x 4.5 cm.                                                          View images from this file (187)                                    ","EAP211/1/2/26","187 Tiff images","Manuscript","File","Arabic, Javanese","Arabic, Javanese","16th century","For research purposes only.","https://images.eap.bl.uk/EAP211/EAP211_1_2_26/1.jp2/full/!600,300/0/default.jpg"
"74","Sufism (Tashawuf) of Cirebon","        An explanation of the level of intentions, the sections of possibilities (mumkinat) (something in terms of Sufism), there are four kinds of this. Extent and format of original material: Daluwang paper. Length and width of manuscript:18.7 x 13.5 cm. Length and width of text:15.5 x 11.5 cm.                                                          View images from this file (52)                                    ","EAP211/1/2/27","52 Tiff images","Manuscript","File","Javanese","Javanese","16th century","For research purposes only.","https://images.eap.bl.uk/EAP211/EAP211_1_2_27/1.jp2/full/!600,300/0/default.jpg"
"75","Dalancang","        Dalancang is (a compilation of notes of the ancients parents) (functions as the rememberence of important events), like a diary. Extent and format of original material: Daluwang paper. Length and width of manuscript:17 x 12.8 cm. Length and width of text:14.5 x 10.3 cm.                                                          View images from this file (37)                                    ","EAP211/1/2/28","37 Tiff images","Manuscript","File","Javanese","Javanese","16th century","For research purposes only.","https://images.eap.bl.uk/EAP211/EAP211_1_2_28/1.jp2/full/!600,300/0/default.jpg"
"76","To gain the perfect knowledge (ngelmu Sampurna)","        This is the book of the perfect knowledge. Extent and format of original material: European paper. Length and width of manuscript:10.5 x 8.5 cm. Length and width of text:8.5 x 6.3 cm.                                                          View images from this file (49)                                    ","EAP211/1/2/29","49 Tiff images","Manuscript","File","Javanese","Javanese","16th century","For research purposes only.","https://images.eap.bl.uk/EAP211/EAP211_1_2_29/1.jp2/full/!600,300/0/default.jpg"
