"","Page Title","Description","Reference","Extent","Content Type","Level","Languages","Scripts","Creation date","Legal","ImgSrc"
"1","Hakku Patra of Patam Rama Swamy [c 1800]","        Contributor / Caste / Performance: Patamvaru. Medium of original material: copper sheet square and rectangle. Description of material: The edge of upper part of copper plate is cut into cusp arch design. It contains the motifs of sun and moon to denote perpetuity, in the centre of the upper portion of the plate a Shivalinga, Nandi and Snake are engraved. Dimensions: length 31 cm, width 20 cm. The plate is donated by a villager named Mungonda Bhadraiah of Ajjaram Village. His relation P. Ramaswamy is unknown.                                                          View images from this file (2)                                    ","EAP201/1/1/1","2 TIFF images","Manuscript","File","Telugu","Telugu","c 1800","Access is for research purposes only.","https://images.eap.bl.uk/EAP201/EAP201_1_1_1/1.jp2/full/!600,300/0/default.jpg"
"2","Hakku Patra of Baindla Laxmaiah","        Contributor / Caste / Performance: Pambala. Medium of original material: Inscription on instrument.                                                          View images from this file (1)                                    ","EAP201/1/2/1","1 TIFF image","Document","File","Telugu","Telugu","17th century-19th cenutry","Access is for research purposes only.","https://images.eap.bl.uk/EAP201/EAP201_1_2_1/1.jp2/full/!600,300/0/default.jpg"
"3","Hakku Patra of Kadem Komuraiah [17th Century ]","        Contributor / Caste / Performance: Katipapalu. Medium of original material: copper sheet square and rectangle. Description of material: The edge of the upper part of the copper plate is cut into a cusp arch design with 11 curves. It contains the motifs of Shivalingam (God Shiva) and Nandis on both sides of the copper plate seen. On the front side are engraved letters, on the rear side of the plate there are sun and moon symbols with engraved letters. Dimensions: length 25 cm, width 20 cm, both sides of the plate are engraved with letters. No single inch of space is unwritten. There are 27 lines on the front side and 32 lines on the rear side of the plate. Thin letters and free hand style of writing is prominent. The details of donation and issuing of Hakku Patra institution is not known at present.                                                          View images from this file (2)                                    ","EAP201/1/3/1","2 TIFF images","Manuscript","File","Telugu","Telugu","17th Century","Access is for research purposes only.","https://images.eap.bl.uk/EAP201/EAP201_1_3_1/1.jp2/full/!600,300/0/default.jpg"
"4","Hakku Patra of Siripati Pedda Poshalu [18th Century ]","        Contributor / Caste / Performance: Katipapalu. Medium of original material: copper sheet square and rectangle. Description of material: The upper part of the copper plate is cut into eleven cusp arch design. It contains motifs of Shivalinga (symbol of Shiva) and Nandis and Snake on both sides, on the front side letters are engraved. On the rear side of the plate are the sun and the moon. Dimensions: length 25 cm, width 20 cm, both side of the plate are engraved with letters. No single inch of space is unwritten. There are 27 lines on the front side and 32 lines on the rear side of the plate. Thin letters and free hand style of writing is prominent. The details of donation and issuing institution of Hakku Patra are not known at present.                                                          View images from this file (2)                                    ","EAP201/1/3/2","2 TIFF images","Manuscript","File","Telugu","Telugu","18th Century","Access is for research purposes only.","https://images.eap.bl.uk/EAP201/EAP201_1_3_2/1.jp2/full/!600,300/0/default.jpg"
"5","Hakku Patra of Kadem Narasimha [17th Century ]","        Contributor / Caste / Performance: Katipapalu. Medium of original material: copper sheet square and rectangle. Description of material: The copper plate inscription certifies the right (Hakku) of ‘Kaatipaapalu’ community, a sub-ordinate caste of Maala/Madiga, to depend on and seek alms from Maala/Madiga community. Great part of this inscriptional text is all praise for Kaashi Viswanath/ an incarnation of Lord Siva. Dwelling much on greatness of Lord Siva, this inscription narrates that consequent to setting ablaze Manmatha, the God of love, a tear from the third eye of Lord Siva dropped in the burning pyre, so the “Katipaapadu’ was born, Lord Siva ordered him to execute the duty of watch dog of the Grave yard, and gave him a protection that nobody shall despise him, and every body shall love him as a son. This certificate further describes that the Kaatipaapadu be given a number of gifts viz., cow and calf, silver anklets, plate and pitcher, ear-rings and some coins too. He is entitled to take some belongings of the corpse – new cloth, golden bead put in the mouth etc., There is also a threat in this inscription that violators of the above norms will be cursed, those who abide by them will be blessed. The edge of the upper part of the copper plate has benn cut into 11 cusp arches. On front side there is a bird, village Goddess and Shivalingam and one Nandi is seen. On the Back side Moon and Sun and one Pillar before temple called Dwaja Stambam are seen.                                                          View images from this file (2)                                    ","EAP201/1/3/3","2 TIFF images","Manuscript","File","Telugu","Telugu","17th Century","Access is for research purposes only.","https://images.eap.bl.uk/EAP201/EAP201_1_3_3/1.jp2/full/!600,300/0/default.jpg"
"6","Hakku Patra of Siripati Narasimha [17th Century ]","        Contributor / Caste / Performance: Katipapalu. Medium of original material: copper plate. Description of material: The edge of the upper part of the copper plate is cut into seven cusp arches. On front side are Sun and Moon, two Nandis, Shiva and serpent. Dimensions: height 28 cm, width 18 cm. It is mentioned in the Hakku Patra that women those help Katipapalu by providing the need has to give freely two coppers. Even a mother is not great than this convention. Mala caste must give one rupee and washer-man has to provide cloth. Begara is also has right to receive help from other communities. The family member of deceased should give one Varaha (coin) or a calf so that deceased person will get much punyam (heaven). No one should scold him, he is like our child.                                                          View images from this file (2)                                    ","EAP201/1/3/4","2 TIFF images","Manuscript","File","Telugu","Telugu","17th Century","Access is for research purposes only.","https://images.eap.bl.uk/EAP201/EAP201_1_3_4/1.jp2/full/!600,300/0/default.jpg"
"7","Hakku Patra of Karre Ramachandram","        Contributor / Caste / Performance: Katipapalu. Medium of original material: copper plate.                                                          View images from this file (1)                                    ","EAP201/1/3/5","1 TIFF image","Manuscript","File","Telugu","Telugu","17th century-19th cenutry","Access is for research purposes only.","https://images.eap.bl.uk/EAP201/EAP201_1_3_5/1.jp2/full/!600,300/0/default.jpg"
"8","Hakku Patra of Patri Papaiah","        Contributor / Caste / Performance: Katipapalu. Medium of original material: copper clate and paper document.                                                          View images from this file (2)                                    ","EAP201/1/3/6","2 TIFF images","Document","File","Telugu","Telugu","17th century-19th cenutry","Access is for research purposes only.","https://images.eap.bl.uk/EAP201/EAP201_1_3_6/1.jp2/full/!600,300/0/default.jpg"
"9","Hakku Patra of Pastham Veeraswamy","        Contributor / Caste / Performance: Katipapalu. Medium of original material: copper plate.                                                          View images from this file (1)                                    ","EAP201/1/3/7","1 TIFF image","Manuscript","File","Telugu","Telugu","17th century-19th cenutry","Access is for research purposes only.","https://images.eap.bl.uk/EAP201/EAP201_1_3_7/1.jp2/full/!600,300/0/default.jpg"
"10","Hakku Patra of Kadem Venkanna","        Contributor / Caste / Performance: Katipapalu. Medium of original material: copper plate.                                                          View images from this file (1)                                    ","EAP201/1/3/8","1 TIFF image","Manuscript","File","Telugu","Telugu","17th century-19th cenutry","Access is for research purposes only.","https://images.eap.bl.uk/EAP201/EAP201_1_3_8/1.jp2/full/!600,300/0/default.jpg"
"11","Hakku Patra of Kadem Biksham","        Contributor / Caste / Performance: Katipapalu. Medium of original material: copper plate and paper document.                                                          View images from this file (2)                                    ","EAP201/1/3/9","2 TIFF images","Manuscript","File","Telugu","Telugu","17th century-19th cenutry","Access is for research purposes only.","https://images.eap.bl.uk/EAP201/EAP201_1_3_9/1.jp2/full/!600,300/0/default.jpg"
"12","Hakku Patra of Kallem Gurishetti","        Contributor / Caste / Performance: Katipapalu. Medium of original material: copper plate.                                                          View images from this file (1)                                    ","EAP201/1/3/10","1 TIFF image","Manuscript","File","Telugu","Telugu","17th century-19th cenutry","Access is for research purposes only.","https://images.eap.bl.uk/EAP201/EAP201_1_3_10/1.jp2/full/!600,300/0/default.jpg"
"13","Hakku Patra of Kapatti Hanumantu","        Contributor / Caste / Performance: Katipapalu. Medium of original material: copper plate.                                                          View images from this file (1)                                    ","EAP201/1/3/11","1 TIFF image","Manuscript","File","Telugu","Telugu","17th century-19th cenutry","Access is for research purposes only.","https://images.eap.bl.uk/EAP201/EAP201_1_3_11/1.jp2/full/!600,300/0/default.jpg"
"14","Hakku Patra of Turpati Ilaiah","        Contributor / Caste / Performance: Katipapalu. Medium of original material: copper plate.                                                          View images from this file (1)                                    ","EAP201/1/3/12","1 TIFF image","Manuscript","File","Telugu","Telugu","17th century-19th cenutry","Access is for research purposes only.","https://images.eap.bl.uk/EAP201/EAP201_1_3_12/1.jp2/full/!600,300/0/default.jpg"
"15","Hakku Patra of Turpati Sammaiah","        Contributor / Caste / Performance: Katipapalu. Medium of original material: copper plate.                                                          View images from this file (1)                                    ","EAP201/1/3/13","1 TIFF image","Manuscript","File","Telugu","Telugu","17th century-19th cenutry","Access is for research purposes only.","https://images.eap.bl.uk/EAP201/EAP201_1_3_13/1.jp2/full/!600,300/0/default.jpg"
"16","Hakku Patra of Pastham Narasimha","        Contributor / Caste / Performance: Katipapalu. Medium of original material: copper plate.                                                          View images from this file (1)                                    ","EAP201/1/3/14","1 TIFF image","Manuscript","File","Telugu","Telugu","17th century-19th cenutry","Access is for research purposes only.","https://images.eap.bl.uk/EAP201/EAP201_1_3_14/1.jp2/full/!600,300/0/default.jpg"
"17","Hakku Patra of Pastham Anjaiah","        Contributor / Caste / Performance: Katipapalu. Medium of original material: copper plate.                                                          View images from this file (1)                                    ","EAP201/1/3/15","1 TIFF image","Manuscript","File","Telugu","Telugu","17th century-19th cenutry","Access is for research purposes only.","https://images.eap.bl.uk/EAP201/EAP201_1_3_15/1.jp2/full/!600,300/0/default.jpg"
"18","Hakku Patra of Pastham Venkanna","        Contributor / Caste / Performance: Katipapalu. Medium of original material: copper plate.                                                          View images from this file (1)                                    ","EAP201/1/3/16","1 TIFF image","Manuscript","File","Telugu","Telugu","17th century-19th cenutry","Access is for research purposes only.","https://images.eap.bl.uk/EAP201/EAP201_1_3_16/1.jp2/full/!600,300/0/default.jpg"
"19","Hakku Patra of Teru Venkanna","        Contributor / Caste / Performance: Katipapalu. Medium of original material: copper plate.                                                          View images from this file (1)                                    ","EAP201/1/3/17","1 TIFF image","Manuscript","File","Telugu","Telugu","17th century-19th cenutry","Access is for research purposes only.","https://images.eap.bl.uk/EAP201/EAP201_1_3_17/1.jp2/full/!600,300/0/default.jpg"
"20","Hakku Patra of Pastham Sankar","        Contributor / Caste / Performance: Katipapalu. Medium of original material: copper plate.                                                          View images from this file (1)                                    ","EAP201/1/3/18","1 TIFF image","Manuscript","File","Telugu","Telugu","17th century-19th cenutry","Access is for research purposes only.","https://images.eap.bl.uk/EAP201/EAP201_1_3_18/1.jp2/full/!600,300/0/default.jpg"
"21","Hakku Patra of Pastham Srinu","        Contributor / Caste / Performance: Katipapalu. Medium of original material: copper plate.                                                          View images from this file (1)                                    ","EAP201/1/3/19","1 TIFF image","Manuscript","File","Telugu","Telugu","17th century-19th cenutry","Access is for research purposes only.","https://images.eap.bl.uk/EAP201/EAP201_1_3_19/1.jp2/full/!600,300/0/default.jpg"
"22","Hakku Patra of Kadem Biksham","        Contributor / Caste / Performance: Katipapalu. Medium of original material: copper plate.                                                          View images from this file (1)                                    ","EAP201/1/3/20","1 TIFF image","Manuscript","File","Telugu","Telugu","17th century-19th cenutry","Access is for research purposes only.","https://images.eap.bl.uk/EAP201/EAP201_1_3_20/1.jp2/full/!600,300/0/default.jpg"
"23","Hakku Patra of Kadem Gopal","        Contributor / Caste / Performance: Katipapalu. Medium of original material: copper plate.                                                          View images from this file (1)                                    ","EAP201/1/3/21","1 TIFF image","Manuscript","File","Telugu","Telugu","17th century-19th cenutry","Access is for research purposes only.","https://images.eap.bl.uk/EAP201/EAP201_1_3_21/1.jp2/full/!600,300/0/default.jpg"
"24","Hakku Patra of Kadem Narayana","        Contributor / Caste / Performance: Katipapalu. Medium of original material: copper plate.                                                          View images from this file (1)                                    ","EAP201/1/3/22","1 TIFF image","Manuscript","File","Telugu","Telugu","17th century-19th cenutry","Access is for research purposes only.","https://images.eap.bl.uk/EAP201/EAP201_1_3_22/1.jp2/full/!600,300/0/default.jpg"
"25","Hakku Patra of Kadem Peda Rajaram","        Contributor / Caste / Performance: Katipapalu. Medium of original material: copper plate.                                                          View images from this file (1)                                    ","EAP201/1/3/23","1 TIFF image","Manuscript","File","Telugu","Telugu","17th century-19th cenutry","Access is for research purposes only.","https://images.eap.bl.uk/EAP201/EAP201_1_3_23/1.jp2/full/!600,300/0/default.jpg"
"26","Hakku Patra of Kadem Ramulu","        Contributor / Caste / Performance: Katipapalu. Medium of original material: copper plate.                                                          View images from this file (1)                                    ","EAP201/1/3/24","1 TIFF image","Manuscript","File","Telugu","Telugu","17th century-19th cenutry","Access is for research purposes only.","https://images.eap.bl.uk/EAP201/EAP201_1_3_24/1.jp2/full/!600,300/0/default.jpg"
"27","Hakku Patra of Kadem Saidulu","        Contributor / Caste / Performance: Katipapalu. Medium of original material: copper plate.                                                          View images from this file (1)                                    ","EAP201/1/3/25","1 TIFF image","Manuscript","File","Telugu","Telugu","17th century-19th cenutry","Access is for research purposes only.","https://images.eap.bl.uk/EAP201/EAP201_1_3_25/1.jp2/full/!600,300/0/default.jpg"
"28","Hakku Patra of Kadem Shankari","        Contributor / Caste / Performance: Katipapalu. Medium of original material: copper plate.                                                          View images from this file (1)                                    ","EAP201/1/3/26","1 TIFF image","Manuscript","File","Telugu","Telugu","17th century-19th cenutry","Access is for research purposes only.","https://images.eap.bl.uk/EAP201/EAP201_1_3_26/1.jp2/full/!600,300/0/default.jpg"
"29","Hakku Patra of Kadem Shankari","        Contributor / Caste / Performance: Katipapalu. Medium of original material: copper plate.                                                          View images from this file (1)                                    ","EAP201/1/3/27","1 TIFF image","Manuscript","File","Telugu","Telugu","17th century-19th cenutry","Access is for research purposes only.","https://images.eap.bl.uk/EAP201/EAP201_1_3_27/1.jp2/full/!600,300/0/default.jpg"
"30","Hakku Patra of Kadem Venkatesh","        Contributor / Caste / Performance: Katipapalu. Medium of original material: copper plate.                                                          View images from this file (1)                                    ","EAP201/1/3/28","1 TIFF image","Manuscript","File","Telugu","Telugu","17th century-19th cenutry","Access is for research purposes only.","https://images.eap.bl.uk/EAP201/EAP201_1_3_28/1.jp2/full/!600,300/0/default.jpg"
"31","Hakku Patra of Kadem Venkateshwarlu","        Contributor / Caste / Performance: Katipapalu. Medium of original material: copper plate.                                                          View images from this file (1)                                    ","EAP201/1/3/29","1 TIFF image","Manuscript","File","Telugu","Telugu","17th century-19th cenutry","Access is for research purposes only.","https://images.eap.bl.uk/EAP201/EAP201_1_3_29/1.jp2/full/!600,300/0/default.jpg"
"32","Hakku Patra of Siripati Pedaposhalu","        Contributor / Caste / Performance: Katipapalu. Medium of original material: copper plate.                                                          View images from this file (1)                                    ","EAP201/1/3/30","1 TIFF image","Manuscript","File","Telugu","Telugu","17th century-19th cenutry","Access is for research purposes only.","https://images.eap.bl.uk/EAP201/EAP201_1_3_30/1.jp2/full/!600,300/0/default.jpg"
"33","Hakku Patra of Kinnera Mallesh","        Contributor / Caste / Performance: Katipapalu. Medium of original material: copper plate.                                                          View images from this file (1)                                    ","EAP201/1/3/31","1 TIFF image","Manuscript","File","Telugu","Telugu","17th century-19th cenutry","Access is for research purposes only.","https://images.eap.bl.uk/EAP201/EAP201_1_3_31/1.jp2/full/!600,300/0/default.jpg"
"34","Hakku Patra of Pastham Shankari","        Contributor / Caste / Performance: Katipapalu. Medium of original material: copper plate.                                                          View images from this file (1)                                    ","EAP201/1/3/32","1 TIFF image","Manuscript","File","Telugu","Telugu","17th century-19th cenutry","Access is for research purposes only.","https://images.eap.bl.uk/EAP201/EAP201_1_3_32/1.jp2/full/!600,300/0/default.jpg"
"35","Hakku Patra of Pastham Veeraswamy","        Contributor / Caste / Performance: Katipapalu. Medium of original material: copper plate.                                                          View images from this file (1)                                    ","EAP201/1/3/33","1 TIFF image","Manuscript","File","Telugu","Telugu","17th century-19th cenutry","Access is for research purposes only.","https://images.eap.bl.uk/EAP201/EAP201_1_3_33/1.jp2/full/!600,300/0/default.jpg"
"36","Hakku Patra of Pastham Potharaju","        Contributor / Caste / Performance: Katipapalu. Medium of original material: copper plate.                                                          View images from this file (1)                                    ","EAP201/1/3/34","1 TIFF image","Manuscript","File","Telugu","Telugu","17th century-19th cenutry","Access is for research purposes only.","https://images.eap.bl.uk/EAP201/EAP201_1_3_34/1.jp2/full/!600,300/0/default.jpg"
"37","Hakku Patra of Pastham Rajalu","        Contributor / Caste / Performance: Katipapalu. Medium of original material: copper plate.                                                          View images from this file (1)                                    ","EAP201/1/3/35","1 TIFF image","Manuscript","File","Telugu","Telugu","17th century-19th cenutry","Access is for research purposes only.","https://images.eap.bl.uk/EAP201/EAP201_1_3_35/1.jp2/full/!600,300/0/default.jpg"
"38","Hakku Patra of Kadem Rajalu","        Contributor / Caste / Performance: Katipapalu. Medium of original material: copper plate.                                                          View images from this file (1)                                    ","EAP201/1/3/36","1 TIFF image","Manuscript","File","Telugu","Telugu","17th century-19th cenutry","Access is for research purposes only.","https://images.eap.bl.uk/EAP201/EAP201_1_3_36/1.jp2/full/!600,300/0/default.jpg"
"39","Hakku Patra of Nilam Pedda Pullaiah","        Contributor / Caste / Performance: Katipapalu. Medium of original material: copper plate.                                                          View images from this file (1)                                    ","EAP201/1/3/37","1 TIFF image","Manuscript","File","Telugu","Telugu","17th century-19th cenutry","Access is for research purposes only.","https://images.eap.bl.uk/EAP201/EAP201_1_3_37/1.jp2/full/!600,300/0/default.jpg"
"40","Hakku Patra of Nilam Raju Parvathalu","        Contributor / Caste / Performance: Katipapalu. Medium of original material: copper plate.                                                          View images from this file (1)                                    ","EAP201/1/3/38","1 TIFF image","Manuscript","File","Telugu","Telugu","17th century-19th cenutry","Access is for research purposes only.","https://images.eap.bl.uk/EAP201/EAP201_1_3_38/1.jp2/full/!600,300/0/default.jpg"
"41","Hakku Patra of Nilam Raju Parvathalu","        Contributor / Caste / Performance: Katipapalu. Medium of original material: leaf / wood bomma.                                                          View images from this file (1)                                    ","EAP201/1/3/39","1 TIFF image","Document","File","Telugu","Telugu","17th century-19th cenutry","Access is for research purposes only.","https://images.eap.bl.uk/EAP201/EAP201_1_3_39/1.jp2/full/!600,300/0/default.jpg"
"42","Hakku Patra of Panuganti Sambashivudu","        Contributor / Caste / Performance: Katipapalu. Medium of original material: copper plate.                                                          View images from this file (1)                                    ","EAP201/1/3/40","1 TIFF image","Manuscript","File","Telugu","Telugu","17th century-19th cenutry","Access is for research purposes only.","https://images.eap.bl.uk/EAP201/EAP201_1_3_40/1.jp2/full/!600,300/0/default.jpg"
"43","Hakku Patra of T. Rama Lingam","        Contributor / Caste / Performance: Katipapalu. Medium of original material: copper plate.                                                          View images from this file (1)                                    ","EAP201/1/3/41","1 TIFF image","Manuscript","File","Telugu","Telugu","17th century-19th cenutry","Access is for research purposes only.","https://images.eap.bl.uk/EAP201/EAP201_1_3_41/1.jp2/full/!600,300/0/default.jpg"
"44","Hakku Patra of Poneti Gurumurthy","        Contributor / Caste / Performance: Katipapalu. Medium of original material: copper plate.                                                          View images from this file (1)                                    ","EAP201/1/3/42","1 TIFF image","Manuscript","File","Telugu","Telugu","17th century-19th cenutry","Access is for research purposes only.","https://images.eap.bl.uk/EAP201/EAP201_1_3_42/1.jp2/full/!600,300/0/default.jpg"
"45","Hakku Patra of Tatikonda Kullayappa","        Contributor / Caste / Performance: Katipapalu. Medium of original material: copper plate.                                                          View images from this file (1)                                    ","EAP201/1/3/43","1 TIFF image","Manuscript","File","Telugu","Telugu","17th century-19th cenutry","Access is for research purposes only.","https://images.eap.bl.uk/EAP201/EAP201_1_3_43/1.jp2/full/!600,300/0/default.jpg"
