"","Page Title","Description","Reference","Extent","Content Type","Level","Languages","Scripts","Creation date","Legal","ImgSrc"
"84","Hakku Patra of Kadem Inakomulu [1543]","        Contributor / Caste / Performance: Mandahetchu. Medium of original material: copper plate. Description of material: The copper plate reveals the history of Mandahetchu community and its origin and the context of the origin. The period mentioned in the copper plate inscription is 1543 AD. The inscription describes about twenty five places. Many of them are historical. The wars fought by Katamaraju, Ayathamaraju and Kancharla are all historically significant. But the period of this kings is not mentioned clearly by the historians. The patron caste of Mandahetchu is Yadava/Golla (Shepherd) which lives in the plains. They go in search of pastoral fields. Thus they go to Nellore, which is nearly 500 km from Nalgonda. After his marriage with Ganga, Katamaraju ordered Manda Boyadu (Jaggayya) to feed ‘Balimudha’ (a ritual feed) to all the cattle. So he did feed. Then onwards the Boyadu was called ‘Mandahetchu’ and was conferred the privilege of being looked after by twelve sects of Yadava community. The copper plate inscription categorically mentioned that the owner of 10 cows should give one cow, the owner of 9 goats should give one lamb, the working persons should give one month income to the Mandahetchu. It also mentions that in the name of those who died, cows, gold rings, silver anklets etc., must be given to him. He shall enjoy this privilege forever. It seems long back this copper plate is given to one family. After some time, out of one copper plate, shares were given to two families with small modifications in the text. The two versions are available in one village with Kinnera Pedabhushaiah and Kadem Inakomulu.                                                          View images from this file (2)                                    ","EAP201/1/11/1","2 TIFF images","Manuscript","File","Telugu","Telugu","1543","Access is for research purposes only.","https://images.eap.bl.uk/EAP201/EAP201_1_11_1/1.jp2/full/!600,300/0/default.jpg"
"85","Hakku Patra of Kinnera Peda Bhushaiah [1543]","        Contributor / Caste / Performance: Mandahetchu. Medium of original material: copper plate square and rectangle. Description of material: The edge of the upper part of the copper plate is cut into 11 cusp arches. At the top, a Siva Lingam is flanked by two Nandies on either side. At the top of back side is a lamp stand, flanked by the Moon and the Sun. The copper plate reveals the history of Mandahetchu community and its origin and the context of the origin.The period mentioned in the copper plate inscription is 1543 AD. The inscription describes about twenty five places. Many of them are historical. The wars fought by Katamaraju, Ayathamaraju and Kancharla are all historically significant. But the period of these kings is not mentioned clearly by the historians. The copper plate inscription categorically mentioned that the owner of 10 cows should give one cow, the owner of 9 goats should give one lamb, the working persons should give one month income to the Mandahetchu. It also mentions that in the name of those who died, cows, gold rings, silver anklets etc., must be given to him. He shall enjoy this privilege forever. It seems that a long time ago this copper plate was given to one family. After some time, out of one copper plate, shares were given to two families with small modifications in the text. The two versions are available in one village with Kinnera Pedabhushaiah and Kadem Inakomulu.                                                          View images from this file (2)                                    ","EAP201/1/11/2","2 TIFF images","Manuscript","File","Telugu","Telugu","1543","Access is for research purposes only.","https://images.eap.bl.uk/EAP201/EAP201_1_11_2/1.jp2/full/!600,300/0/default.jpg"
"86","Hakku Patra of Kadem Gattumallu","        Contributor / Caste / Performance: Manda Hechulu. Medium of original material: paper document.                                                          View images from this file (1)                                    ","EAP201/1/11/3","1 TIFF image","Document","File","Telugu","Telugu","17th century-19th cenutry","Access is for research purposes only.","https://images.eap.bl.uk/EAP201/EAP201_1_11_3/1.jp2/full/!600,300/0/default.jpg"
"87","Hakku Patra of Kallem Sammaiah","        Contributor / Caste / Performance: Manda Hechulu. Medium of original material: paper document.                                                          View images from this file (1)                                    ","EAP201/1/11/4","1 TIFF image","Document","File","Telugu","Telugu","17th century-19th cenutry","Access is for research purposes only.","https://images.eap.bl.uk/EAP201/EAP201_1_11_4/1.jp2/full/!600,300/0/default.jpg"
"88","Hakku Patra of Kallem Saraiah","        Contributor / Caste / Performance: Manda Hechulu. Medium of original material: paper document.                                                          View images from this file (1)                                    ","EAP201/1/11/5","1 TIFF image","Document","File","Telugu","Telugu","17th century-19th cenutry","Access is for research purposes only.","https://images.eap.bl.uk/EAP201/EAP201_1_11_5/1.jp2/full/!600,300/0/default.jpg"
"89","Hakku Patra of Kinnera Ashok","        Contributor / Caste / Performance: Manda Hechulu. Medium of original material: copper plate.                                                          View images from this file (1)                                    ","EAP201/1/11/6","1 TIFF image","Manuscript","File","Telugu","Telugu","17th century-19th cenutry","Access is for research purposes only.","https://images.eap.bl.uk/EAP201/EAP201_1_11_6/1.jp2/full/!600,300/0/default.jpg"
"90","Hakku Patra of Kinnera Venkanna","        Contributor / Caste / Performance: Manda Hechulu. Medium of original material: copper plate.                                                          View images from this file (1)                                    ","EAP201/1/11/7","1 TIFF image","Manuscript","File","Telugu","Telugu","17th century-19th cenutry","Access is for research purposes only.","https://images.eap.bl.uk/EAP201/EAP201_1_11_7/1.jp2/full/!600,300/0/default.jpg"
"91","Hakku Patra of Kinnera Venkati","        Contributor / Caste / Performance: Manda Hechulu. Medium of original material: paper document.                                                          View images from this file (1)                                    ","EAP201/1/11/8","1 TIFF image","Document","File","Telugu","Telugu","17th century-19th cenutry","Access is for research purposes only.","https://images.eap.bl.uk/EAP201/EAP201_1_11_8/1.jp2/full/!600,300/0/default.jpg"
"92","Hakku Patra of Pastham Gopal","        Contributor / Caste / Performance: Manda Hechulu. Medium of original material: paper document.                                                          View images from this file (1)                                    ","EAP201/1/11/9","1 TIFF image","Document","File","Telugu","Telugu","17th century-19th cenutry","Access is for research purposes only.","https://images.eap.bl.uk/EAP201/EAP201_1_11_9/1.jp2/full/!600,300/0/default.jpg"
"93","Hakku Patra of Ura China Yakaiah","        Contributor / Caste / Performance: Manda Hechulu. Medium of original material: copper plate.                                                          View images from this file (1)                                    ","EAP201/1/11/10","1 TIFF image","Manuscript","File","Telugu","Telugu","17th century-19th cenutry","Access is for research purposes only.","https://images.eap.bl.uk/EAP201/EAP201_1_11_10/1.jp2/full/!600,300/0/default.jpg"
"94","Hakku Patra of Ura China Kommalu","        Contributor / Caste / Performance: Manda Hechulu. Medium of original material: copper plate.                                                          View images from this file (1)                                    ","EAP201/1/11/11","1 TIFF image","Manuscript","File","Telugu","Telugu","17th century-19th cenutry","Access is for research purposes only.","https://images.eap.bl.uk/EAP201/EAP201_1_11_11/1.jp2/full/!600,300/0/default.jpg"
"95","Hakku Patra of Ura Peda Yadagiri","        Contributor / Caste / Performance: Manda Hechulu. Medium of original material: paper document.                                                          View images from this file (1)                                    ","EAP201/1/11/12","1 TIFF image","Document","File","Telugu","Telugu","17th century-19th cenutry","Access is for research purposes only.","https://images.eap.bl.uk/EAP201/EAP201_1_11_12/1.jp2/full/!600,300/0/default.jpg"
"96","Hakku Patra of Ura Peda Yakaiah","        Contributor / Caste / Performance: Manda Hechulu. Medium of original material: paper document.                                                          View images from this file (1)                                    ","EAP201/1/11/13","1 TIFF image","Document","File","Telugu","Telugu","17th century-19th cenutry","Access is for research purposes only.","https://images.eap.bl.uk/EAP201/EAP201_1_11_13/1.jp2/full/!600,300/0/default.jpg"
"97","Hakku Patra of Ura Yadagiri","        Contributor / Caste / Performance: Manda Hechulu. Medium of original material: paper document.                                                          View images from this file (1)                                    ","EAP201/1/11/14","1 TIFF image","Document","File","Telugu","Telugu","17th century-19th cenutry","Access is for research purposes only.","https://images.eap.bl.uk/EAP201/EAP201_1_11_14/1.jp2/full/!600,300/0/default.jpg"
"98","Hakku Patra of Kadem Hanumanthu","        Contributor / Caste / Performance: Manda Hechulu. Medium of original material: copper plate.                                                          View images from this file (1)                                    ","EAP201/1/11/15","1 TIFF image","Manuscript","File","Telugu","Telugu","17th century-19th cenutry","Access is for research purposes only.","https://images.eap.bl.uk/EAP201/EAP201_1_11_15/1.jp2/full/!600,300/0/default.jpg"
"99","Hakku Patra of Kadem Hanumanthu","        Contributor / Caste / Performance: Manda Hechulu. Medium of original material: copper plate.                                                          View images from this file (1)                                    ","EAP201/1/11/16","1 TIFF image","Manuscript","File","Telugu","Telugu","17th century-19th cenutry","Access is for research purposes only.","https://images.eap.bl.uk/EAP201/EAP201_1_11_16/1.jp2/full/!600,300/0/default.jpg"
"100","Hakku Patra of Kadem Kattamallu","        Contributor / Caste / Performance: Manda Hechulu. Medium of original material: copper plate.                                                          View images from this file (1)                                    ","EAP201/1/11/17","1 TIFF image","Manuscript","File","Telugu","Telugu","17th century-19th cenutry","Access is for research purposes only.","https://images.eap.bl.uk/EAP201/EAP201_1_11_17/1.jp2/full/!600,300/0/default.jpg"
"101","Hakku Patra of Kadem Ramulu","        Contributor / Caste / Performance: Manda Hechulu. Medium of original material: copper plate.                                                          View images from this file (1)                                    ","EAP201/1/11/18","1 TIFF image","Manuscript","File","Telugu","Telugu","17th century-19th cenutry","Access is for research purposes only.","https://images.eap.bl.uk/EAP201/EAP201_1_11_18/1.jp2/full/!600,300/0/default.jpg"
"102","Hakku Patra of Kadem Komuraiah","        Contributor / Caste / Performance: Manda Hechulu. Medium of original material: copper plate.                                                          View images from this file (1)                                    ","EAP201/1/11/19","1 TIFF image","Manuscript","File","Telugu","Telugu","17th century-19th cenutry","Access is for research purposes only.","https://images.eap.bl.uk/EAP201/EAP201_1_11_19/1.jp2/full/!600,300/0/default.jpg"
"103","Hakku Patra of Kadem Sammaiah","        Contributor / Caste / Performance: Manda Hechulu. Medium of original material: copper plate.                                                          View images from this file (1)                                    ","EAP201/1/11/20","1 TIFF image","Manuscript","File","Telugu","Telugu","17th century-19th cenutry","Access is for research purposes only.","https://images.eap.bl.uk/EAP201/EAP201_1_11_20/1.jp2/full/!600,300/0/default.jpg"
"104","Hakku Patra of Kadem Srinu","        Contributor / Caste / Performance: Manda Hechulu. Medium of original material: copper plate.                                                          View images from this file (1)                                    ","EAP201/1/11/21","1 TIFF image","Manuscript","File","Telugu","Telugu","17th century-19th cenutry","Access is for research purposes only.","https://images.eap.bl.uk/EAP201/EAP201_1_11_21/1.jp2/full/!600,300/0/default.jpg"
"105","Hakku Patra of Kadem Venkat Narsu","        Contributor / Caste / Performance: Manda Hechulu. Medium of original material: copper plate.                                                          View images from this file (1)                                    ","EAP201/1/11/22","1 TIFF image","Manuscript","File","Telugu","Telugu","17th century-19th cenutry","Access is for research purposes only.","https://images.eap.bl.uk/EAP201/EAP201_1_11_22/1.jp2/full/!600,300/0/default.jpg"
"106","Hakku Patra of Kadem Yadagiri","        Contributor / Caste / Performance: Manda Hechulu. Medium of original material: copper plate.                                                          View images from this file (1)                                    ","EAP201/1/11/23","1 TIFF image","Manuscript","File","Telugu","Telugu","17th century-19th cenutry","Access is for research purposes only.","https://images.eap.bl.uk/EAP201/EAP201_1_11_23/1.jp2/full/!600,300/0/default.jpg"
"107","Hakku Patra of Kadem Yakaiah","        Contributor / Caste / Performance: Manda Hechulu. Medium of original material: copper plate.                                                          View images from this file (1)                                    ","EAP201/1/11/24","1 TIFF image","Manuscript","File","Telugu","Telugu","17th century-19th cenutry","Access is for research purposes only.","https://images.eap.bl.uk/EAP201/EAP201_1_11_24/1.jp2/full/!600,300/0/default.jpg"
"108","Hakku Patra of Kadem Yakaiah","        Contributor / Caste / Performance: Manda Hechulu. Medium of original material: copper plate.                                                          View images from this file (1)                                    ","EAP201/1/11/25","1 TIFF image","Manuscript","File","Telugu","Telugu","17th century-19th cenutry","Access is for research purposes only.","https://images.eap.bl.uk/EAP201/EAP201_1_11_25/1.jp2/full/!600,300/0/default.jpg"
"109","Hakku Patra of Kadem Yakaiah","        Contributor / Caste / Performance: Manda Hechulu. Medium of original material: copper plate.                                                          View images from this file (1)                                    ","EAP201/1/11/26","1 TIFF image","Manuscript","File","Telugu","Telugu","17th century-19th cenutry","Access is for research purposes only.","https://images.eap.bl.uk/EAP201/EAP201_1_11_26/1.jp2/full/!600,300/0/default.jpg"
"110","Hakku Patra of Kadem Veeramallu","        Contributor / Caste / Performance: Manda Hechulu. Medium of original material: copper plate.                                                          View images from this file (1)                                    ","EAP201/1/11/27","1 TIFF image","Manuscript","File","Telugu","Telugu","17th century-19th cenutry","Access is for research purposes only.","https://images.eap.bl.uk/EAP201/EAP201_1_11_27/1.jp2/full/!600,300/0/default.jpg"
"111","Hakku Patra of Kinnera Anandam","        Contributor / Caste / Performance: Manda Hechulu. Medium of original material: copper plate.                                                          View images from this file (1)                                    ","EAP201/1/11/28","1 TIFF image","Manuscript","File","Telugu","Telugu","17th century-19th cenutry","Access is for research purposes only.","https://images.eap.bl.uk/EAP201/EAP201_1_11_28/1.jp2/full/!600,300/0/default.jpg"
"112","Hakku Patra of Kinnera Biksham","        Contributor / Caste / Performance: Manda Hechulu. Medium of original material: copper plate.                                                          View images from this file (1)                                    ","EAP201/1/11/29","1 TIFF image","Manuscript","File","Telugu","Telugu","17th century-19th cenutry","Access is for research purposes only.","https://images.eap.bl.uk/EAP201/EAP201_1_11_29/1.jp2/full/!600,300/0/default.jpg"
"113","Hakku Patra of Kinnera Lalaiah","        Contributor / Caste / Performance: Manda Hechulu. Medium of original material: copper plate.                                                          View images from this file (1)                                    ","EAP201/1/11/30","1 TIFF image","Manuscript","File","Telugu","Telugu","17th century-19th cenutry","Access is for research purposes only.","https://images.eap.bl.uk/EAP201/EAP201_1_11_30/1.jp2/full/!600,300/0/default.jpg"
"114","Hakku Patra of Kinnera Srinu","        Contributor / Caste / Performance: Manda Hechulu. Medium of original material: copper plate.                                                          View images from this file (1)                                    ","EAP201/1/11/31","1 TIFF image","Manuscript","File","Telugu","Telugu","17th century-19th cenutry","Access is for research purposes only.","https://images.eap.bl.uk/EAP201/EAP201_1_11_31/1.jp2/full/!600,300/0/default.jpg"
"115","Hakku Patra of Kinnera Yakaiah","        Contributor / Caste / Performance: Manda Hechulu. Medium of original material: copper plate.                                                          View images from this file (1)                                    ","EAP201/1/11/32","1 TIFF image","Manuscript","File","Telugu","Telugu","17th century-19th cenutry","Access is for research purposes only.","https://images.eap.bl.uk/EAP201/EAP201_1_11_32/1.jp2/full/!600,300/0/default.jpg"
"116","Hakku Patra of Pastham Rajaram","        Contributor / Caste / Performance: Manda Hechulu. Medium of original material: copper plate.                                                          View images from this file (1)                                    ","EAP201/1/11/33","1 TIFF image","Manuscript","File","Telugu","Telugu","17th century-19th cenutry","Access is for research purposes only.","https://images.eap.bl.uk/EAP201/EAP201_1_11_33/1.jp2/full/!600,300/0/default.jpg"
"117","Hakku Patra of Ura Srisailam","        Contributor / Caste / Performance: Manda Hechulu. Medium of original material: copper plate.                                                          View images from this file (1)                                    ","EAP201/1/11/34","1 TIFF image","Manuscript","File","Telugu","Telugu","17th century-19th cenutry","Access is for research purposes only.","https://images.eap.bl.uk/EAP201/EAP201_1_11_34/1.jp2/full/!600,300/0/default.jpg"
"118","Hakku Patra of Kadem Yadagiri","        Contributor / Caste / Performance: Manda Hechulu. Medium of original material: copper plate.                                                          View images from this file (1)                                    ","EAP201/1/11/35","1 TIFF image","Manuscript","File","Telugu","Telugu","17th century-19th cenutry","Access is for research purposes only.","https://images.eap.bl.uk/EAP201/EAP201_1_11_35/1.jp2/full/!600,300/0/default.jpg"
"119","Hakku Patra of Kadem Sammaiah","        Contributor / Caste / Performance: Manda Hechulu. Medium of original material: copper plate.                                                          View images from this file (1)                                    ","EAP201/1/11/36","1 TIFF image","Manuscript","File","Telugu","Telugu","17th century-19th cenutry","Access is for research purposes only.","https://images.eap.bl.uk/EAP201/EAP201_1_11_36/1.jp2/full/!600,300/0/default.jpg"
"120","Hakku Patra of Turpati Peda Nagaiah","        Contributor / Caste / Performance: Manda Hechulu. Medium of original material: copper plate.                                                          View images from this file (1)                                    ","EAP201/1/11/37","1 TIFF image","Manuscript","File","Telugu","Telugu","17th century-19th cenutry","Access is for research purposes only.","https://images.eap.bl.uk/EAP201/EAP201_1_11_37/1.jp2/full/!600,300/0/default.jpg"
"121","Hakku Patra of Iala Mallu","        Contributor / Caste / Performance: Manda Hechulu. Medium of original material: copper plate.                                                          View images from this file (1)                                    ","EAP201/1/11/38","1 TIFF image","Manuscript","File","Telugu","Telugu","17th century-19th cenutry","Access is for research purposes only.","https://images.eap.bl.uk/EAP201/EAP201_1_11_38/1.jp2/full/!600,300/0/default.jpg"
"122","Hakku Patra of Butham Narsimha","        Contributor / Caste / Performance: Manda Hechulu. Medium of original material: copper plate.                                                          View images from this file (1)                                    ","EAP201/1/11/39","1 TIFF image","Manuscript","File","Telugu","Telugu","17th century-19th cenutry","Access is for research purposes only.","https://images.eap.bl.uk/EAP201/EAP201_1_11_39/1.jp2/full/!600,300/0/default.jpg"
"123","Hakku Patra of Avula Yelamanda","        Contributor / Caste / Performance: Manda Hechulu. Medium of original material: copper plate.                                                          View images from this file (1)                                    ","EAP201/1/11/40","1 TIFF image","Manuscript","File","Telugu","Telugu","17th century-19th cenutry","Access is for research purposes only.","https://images.eap.bl.uk/EAP201/EAP201_1_11_40/1.jp2/full/!600,300/0/default.jpg"
"124","Hakku Patra of Sindham Siddiramulu [1475]","        Contributor / Caste / Performance: Gotralavaru. Medium of original material: copper plate. Description of material: ‘Gothram’ indicates the details of the sects and surnames within the same caste or community. Further details of the Gothram could be observed. People sharing the same, identical Gothram are restricted to marry. It is a taboo. The ancestral history of the sects and details of their Gothram play vital role in caste hierarchy. Hence the duty of memorizing and maintaining these Gotharams are entrusted to this caste. They remember all names of Gothram of the relevant sects/castes and let other people also know their Gothram. It is their duty to go to the families in the villages which are assigned to them.                                                          View images from this file (2)                                    ","EAP201/1/12/1","2 TIFF images","Manuscript","File","Telugu","Telugu","1475","Access is for research purposes only.","https://images.eap.bl.uk/EAP201/EAP201_1_12_1/1.jp2/full/!600,300/0/default.jpg"
"125","Hakku Patra of Sindham Siddi Ramulu","        Contributor / Caste / Performance: Gotralavaru. Medium of original material: copper plate.                                                          View images from this file (1)                                    ","EAP201/1/12/2","1 TIFF image","Manuscript","File","Telugu","Telugu","17th century-19th cenutry","Access is for research purposes only.","https://images.eap.bl.uk/EAP201/EAP201_1_12_2/1.jp2/full/!600,300/0/default.jpg"
"126","Hakku Patra of Gade Venkata Narasu [1930]","        Contributor / Caste / Performance: Addapu Vaaru . Medium of original material: copper plate. Dimensions: height 15 cm, width 10 cm. It is scripted on the both sides. This plate is cut into three major parts on the top of the plate are two Nandis with a Shivalingam.                                                          View images from this file (1)                                    ","EAP201/1/13/1","1 TIFF image","Manuscript","File","Telugu","Telugu","1930","Access is for research purposes only.","https://images.eap.bl.uk/EAP201/EAP201_1_13_1/1.jp2/full/!600,300/0/default.jpg"
"127","Hakku Patra of Basireddy Guruvaiah","        Contributor / Caste / Performance: Addapuvaru. Medium of original material: copper plate.                                                          View images from this file (1)                                    ","EAP201/1/13/2","1 TIFF image","Manuscript","File","Telugu","Telugu","17th century-19th cenutry","Access is for research purposes only.","https://images.eap.bl.uk/EAP201/EAP201_1_13_2/1.jp2/full/!600,300/0/default.jpg"
"128","Hakku Patra of Kosuru Krishna","        Contributor / Caste / Performance: Addapuvaru. Medium of original material: copper plate.                                                          View images from this file (1)                                    ","EAP201/1/13/3","1 TIFF image","Manuscript","File","Telugu","Telugu","17th century-19th cenutry","Access is for research purposes only.","https://images.eap.bl.uk/EAP201/EAP201_1_13_3/1.jp2/full/!600,300/0/default.jpg"
