"","Page Title","Description","Reference","Extent","Content Type","Level","Languages","Scripts","Creation date","Legal","ImgSrc"
"46","Hakku Patra of Tatikonda Jammaiah","        Contributor / Caste / Performance: Katipapalu. Medium of original material: copper plate.                                                          View images from this file (1)                                    ","EAP201/1/3/44","1 TIFF image","Manuscript","File","Telugu","Telugu","17th century-19th cenutry","Access is for research purposes only.","https://images.eap.bl.uk/EAP201/EAP201_1_3_44/1.jp2/full/!600,300/0/default.jpg"
"47","Hakku Patra of Tatikonda Ramaiah","        Contributor / Caste / Performance: Katipapalu. Medium of original material: copper plate.                                                          View images from this file (1)                                    ","EAP201/1/3/45","1 TIFF image","Manuscript","File","Telugu","Telugu","17th century-19th cenutry","Access is for research purposes only.","https://images.eap.bl.uk/EAP201/EAP201_1_3_45/1.jp2/full/!600,300/0/default.jpg"
"48","Hakku Patra of Tatikonda Bhaskar","        Contributor / Caste / Performance: Katipapalu. Medium of original material: copper plate.                                                          View images from this file (1)                                    ","EAP201/1/3/46","1 TIFF image","Manuscript","File","Telugu","Telugu","17th century-19th cenutry","Access is for research purposes only.","https://images.eap.bl.uk/EAP201/EAP201_1_3_46/1.jp2/full/!600,300/0/default.jpg"
"49","Hakku Patra of Turpati Ramudu","        Contributor / Caste / Performance: Katipapalu. Medium of original material: copper plate.                                                          View images from this file (1)                                    ","EAP201/1/3/47","1 TIFF image","Manuscript","File","Telugu","Telugu","17th century-19th cenutry","Access is for research purposes only.","https://images.eap.bl.uk/EAP201/EAP201_1_3_47/1.jp2/full/!600,300/0/default.jpg"
"50","Hakku Patra of Panasa Nagabhushanam [1580]","        Contributor / Caste / Performance: Adi Panasalu . Medium of original material: copper plate. Description of material: Front side of the copper plate is divided into 5 registers. All the five registers contain 15 divine and semi divine figures. There are figures of Trimurthy (Trinity of Hindu pantheon), Vinayaka (Elephant God), Kalika (Dark Goddesses), Priest, Hanuman, Manubrahma and her daughter, Twastha Brahma, Shilpi Brahma, Viswa Brahma, Panasa Kumara and Panasa tree, Vahana Kapari, Mirror of Kalika, and the last register has Iravatam (elephant) and Aswa (Horse). Back side of the copper plate inscription refers to Ibrahim Quli Qutub-Shah (Malkibharam). He was one of the rulers from Golkonda dynasty in 1580 AD. Dimensions: height 24 cm, width 12 cm.                                                          View images from this file (2)                                    ","EAP201/1/4/1","2 TIFF images","Manuscript","File","Telugu","Telugu","1580","Access is for research purposes only.","https://images.eap.bl.uk/EAP201/EAP201_1_4_1/1.jp2/full/!600,300/0/default.jpg"
"51","Paper Hakku Patra of Salla Narahari [1931]","        Contributor / Caste / Performance: Budiga Jangalu. Medium of original material: paper documents. Description of material: These paper documents kept in a bamboo box covered with animal skin to protect them from rain and white ants. Here we are sending ten documents. These old paper documents that will reveal the right of the performer community over the villages and families.                                                          View images from this file (10)                                    ","EAP201/1/5/1","10 TIFF images","Document","File","Telugu","Telugu","1931","Access is for research purposes only.","https://images.eap.bl.uk/EAP201/EAP201_1_5_1/1.jp2/full/!600,300/0/default.jpg"
"52","Paper Hakku Patra of Salla Yadagiri [1841]","        Contributor / Caste / Performance: Budiga Jangalu. Medium of original material: paper document. Description of material: Front side of this paper document starts with Kasi Viswanatharpanamasthu sentence and given to Kashi Nilakanta Swamy and signed by four chefs with two official seals in Urdu languages. Dimensions: length 32 cm, width 21 cm. This paper document was written in the month of June, 1841 AD. On the request of disciple Ramachandra, on behalf of Kashi Neelakanta Swamiji, a new document was written in place of the old one as it was in deteriorated condition. The document says “As it was assigned, and your disciple Ramachandra brought the message in written obliging the content, the inhabitants of Adlur ………… every year take care to pay them off properly. A similar ordinance is also been written and been brought to Varushachala with blessings.” The document is signed by Akkinepalli Venkata Narsaiah Deshpande and Anantha Rao Deshpande of Adluru village, Nalgonda Dist.                                                          View images from this file (1)                                    ","EAP201/1/5/2","1 TIFF image","Document","File","Telugu","Telugu","1841","Access is for research purposes only.","https://images.eap.bl.uk/EAP201/EAP201_1_5_2/1.jp2/full/!600,300/0/default.jpg"
"53","Paper Hakku Patra of Salla Shanbulingam [1845]","        Contributor / Caste / Performance: Budiga Jangalu. Medium of original material: paper document. Description of material: This one page document is divided into two parts. The three signatures are accommodated in the middle of fourteen village names as mentioned on the left side. Hakku and other details were given on the right side portion. Dimensions: height 34 cm, width 21 cm. This paper document is written in the year shubha Krut, on thirteenth day of the month Ashweeyuja to Kaashi Neela Kantham Swamiji by Boddupalli Gundanna Narsaiah. Sheshanna Deshpande, resident of Vodichetu Sarkar, Nallagonda. It is referred to the year 1253, place Saluku Taluka, Vennavaram Village. As the document condition is in deteriorated stage. Hence this document was rewritten and submitted to different mutts. Every year in each village he should get donations and should perform all the rituals.                                                          View images from this file (1)                                    ","EAP201/1/5/3","1 TIFF image","Document","File","Telugu","Telugu","1845","Access is for research purposes only.","https://images.eap.bl.uk/EAP201/EAP201_1_5_3/1.jp2/full/!600,300/0/default.jpg"
"54","Paper Hakku Patra of Salla Veeraiah [1841]","        Contributor / Caste / Performance: Budiga Jangalu. Medium of original material: paper document. Description of material: This paper document is a deed of transfer of rights executed by Kodanda Ramaiah Venkatarangarao Deshmukh of Khmammam met in the year 1841 AD. The contents of the document reveal that Tallada and other villages of Saluma Taluq were given to Kashi Neelakanta Swamiji Mutt as religious donation. To that effect a new document was being written as the old one got deteriorated. Seeking blessings from swamiji and the obliging the ordinance brought by swamiji’s disciple Mahendurdu, the Deshmuk reiterates that contributions and donations from the villages would go to the Mutt regularly. The document has two signatures in Telugu and one see in Urdu. Dimensions: height 35 cm, width 15 cm.                                                          View images from this file (1)                                    ","EAP201/1/5/4","1 TIFF image","Document","File","Telugu","Telugu","1841","Access is for research purposes only.","https://images.eap.bl.uk/EAP201/EAP201_1_5_4/1.jp2/full/!600,300/0/default.jpg"
"55","Paper Hakku Patra of Salla Veeraiah [1841]","        Contributor / Caste / Performance: Budiga Jangalu. Medium of original material: One paper document. Description of material: This paper document is a deed of transfer of rights executed by Vutyalanthaiah Venkatramaiah Deshmukh in the year 1841 AD. The contents of the document reveal that 14 villages were given to Kashi Neelakanta swamiji Mutt as a religious donation. To that effect a new document was written as the old one got deteriorated. Seeking blessings from the Mutt, Obliging the ordinance brought by the Swamiji’s disciple Ramulaiah, the Deshmukh reiterates that donations would go to the Mutt regularly. Names of donated villages are listed in the document. It has two seals in Urdu, two signatures in Telugu language. Dimensions: height 35 cm, width 20 cm.                                                          View images from this file (1)                                    ","EAP201/1/5/5","1 TIFF image","Document","File","Telugu","Telugu","1841","Access is for research purposes only.","https://images.eap.bl.uk/EAP201/EAP201_1_5_5/1.jp2/full/!600,300/0/default.jpg"
"56","Hakku Patra of Eepthi Chinna Kasim","        Contributor / Caste / Performance: Budiga Jangalu (Arthigolla). Medium of original material: copper plate.                                                          View images from this file (1)                                    ","EAP201/1/5/6","1 TIFF image","Manuscript","File","Telugu","Telugu","17th century-19th cenutry","Access is for research purposes only.","https://images.eap.bl.uk/EAP201/EAP201_1_5_6/1.jp2/full/!600,300/0/default.jpg"
"57","Hakku Patra of Ebuthi Jammanna","        Contributor / Caste / Performance: Budiga Jangalu (Arthigolla). Medium of original material: copper plate.                                                          View images from this file (1)                                    ","EAP201/1/5/7","1 TIFF image","Manuscript","File","Telugu","Telugu","17th century-19th cenutry","Access is for research purposes only.","https://images.eap.bl.uk/EAP201/EAP201_1_5_7/1.jp2/full/!600,300/0/default.jpg"
"58","Hakku Patra of Turpati Shankaraiah","        Contributor / Caste / Performance: Budiga Jangalu (Arthigolla). Medium of original material: copper plate.                                                          View images from this file (1)                                    ","EAP201/1/5/8","1 TIFF image","Manuscript","File","Telugu","Telugu","17th century-19th cenutry","Access is for research purposes only.","https://images.eap.bl.uk/EAP201/EAP201_1_5_8/1.jp2/full/!600,300/0/default.jpg"
"59","Hakku Patra of Ebudi China Sunkanna","        Contributor / Caste / Performance: Budiga Jangalu (Taguru Jogulu). Medium of original material: copper plate.                                                          View images from this file (1)                                    ","EAP201/1/5/9","1 TIFF image","Manuscript","File","Telugu","Telugu","17th century-19th cenutry","Access is for research purposes only.","https://images.eap.bl.uk/EAP201/EAP201_1_5_9/1.jp2/full/!600,300/0/default.jpg"
"60","Hakku Patra of Ebudi peda Sunkanna","        Contributor / Caste / Performance: Budiga Jangalu (Taguru Jogulu). Medium of original material: copper plate.                                                          View images from this file (1)                                    ","EAP201/1/5/10","1 TIFF image","Manuscript","File","Telugu","Telugu","17th century-19th cenutry","Access is for research purposes only.","https://images.eap.bl.uk/EAP201/EAP201_1_5_10/1.jp2/full/!600,300/0/default.jpg"
"61","Hakku Patra of Ebudi Nadipi Balamaddi","        Contributor / Caste / Performance: Budiga Jangalu (Taguru Jogulu). Medium of original material: copper plate.                                                          View images from this file (1)                                    ","EAP201/1/5/11","1 TIFF image","Manuscript","File","Telugu","Telugu","17th century-19th cenutry","Access is for research purposes only.","https://images.eap.bl.uk/EAP201/EAP201_1_5_11/1.jp2/full/!600,300/0/default.jpg"
"62","Hakku Patra of Ebudi Peda Baamaddi","        Contributor / Caste / Performance: Budiga Jangalu (Taguru Jogulu). Medium of original material: copper plate.                                                          View images from this file (1)                                    ","EAP201/1/5/12","1 TIFF image","Manuscript","File","Telugu","Telugu","17th century-19th cenutry","Access is for research purposes only.","https://images.eap.bl.uk/EAP201/EAP201_1_5_12/1.jp2/full/!600,300/0/default.jpg"
"63","Hakku Patra of Ebudi Chettappa","        Contributor / Caste / Performance: Budiga Jangalu (Taguru Jogulu). Medium of original material: copper plate.                                                          View images from this file (1)                                    ","EAP201/1/5/13","1 TIFF image","Manuscript","File","Telugu","Telugu","17th century-19th cenutry","Access is for research purposes only.","https://images.eap.bl.uk/EAP201/EAP201_1_5_13/1.jp2/full/!600,300/0/default.jpg"
"64","Hakku Patra of Ebudi Chukkanna","        Contributor / Caste / Performance: Budiga Jangalu (Taguru Jogulu). Medium of original material: copper plate.                                                          View images from this file (1)                                    ","EAP201/1/5/14","1 TIFF image","Manuscript","File","Telugu","Telugu","17th century-19th cenutry","Access is for research purposes only.","https://images.eap.bl.uk/EAP201/EAP201_1_5_14/1.jp2/full/!600,300/0/default.jpg"
"65","Hakku Patra of Salla Ananthaiah","        Contributor / Caste / Performance: Budiga Jangalu (Taguru Jogulu). Medium of original material: paper document.                                                          View images from this file (1)                                    ","EAP201/1/5/15","1 TIFF image","Document","File","Telugu","Telugu","17th century-19th cenutry","Access is for research purposes only.","https://images.eap.bl.uk/EAP201/EAP201_1_5_15/1.jp2/full/!600,300/0/default.jpg"
"66","Hakku Patra of Salla Narahari","        Contributor / Caste / Performance: Budiga Jangalu (Taguru Jogulu). Medium of original material: copper plate.                                                          View images from this file (1)                                    ","EAP201/1/5/16","1 TIFF image","Manuscript","File","Telugu","Telugu","17th century-19th cenutry","Access is for research purposes only.","https://images.eap.bl.uk/EAP201/EAP201_1_5_16/1.jp2/full/!600,300/0/default.jpg"
"67","Hakku Patra of Miriyala Somaiah [17th Century ]","        Contributor / Caste / Performance: Madiga Jangalu . Medium of original material: copper sheet square and rectangle. Description of material: old copper plate contains the Hakku of Nulaka Chandaiahs. This copper plate of Nulaka Chandaiahs is the biggest in size, so far available. Dimensions: width 52 cm, height 92 cm. The edge of the copper plate is cut into cusp arch design. In the front side carving of new letters are found. This plate was prepared in the presence of heads of 10 communities. This plate was given 8 to 10 generations back.                                                          View images from this file (2)                                    ","EAP201/1/6/1","2 TIFF images","Manuscript","File","Telugu","Telugu","17th Century","Access is for research purposes only.","https://images.eap.bl.uk/EAP201/EAP201_1_6_1/1.jp2/full/!600,300/0/default.jpg"
"68","Hakku Patra of Shankaraiah [19th Century ]","        Contributor / Caste / Performance: Madiga Matam Guruvulu. Medium of original material: paper scroll manuscript. Description of material: This is an old paper manuscript. It is called Chutta means paper scroll. This is an important document belong to Madiga Mattam. The beginning of the scroll is damaged. Hence the exact date is not known.Dimensions: height 270 cm, width 21 cm.                                                          View images from this file (7)                                    ","EAP201/1/7/1","7 TIFF images","Manuscript","File","Telugu","Telugu","19th Century","Access is for research purposes only.","https://images.eap.bl.uk/EAP201/EAP201_1_7_1/1.jp2/full/!600,300/0/default.jpg"
"69","Hakku Patra of Tanda Amaraiah [01 Feb 1942]","        Contributor / Caste / Performance: Terachiralavaru. Medium of original material: Old Paper. Description of material: This paper document dated 1 February 1942 at Suryapet, Nalgonda District is a resolution of heads of Golla Community. The Chinna Rajalingam, Village Jayyaram, Taluq Manukota was given this acceptance document by the Jury of the heads. A dispute arises when pala cherlaiah has not given share in Lingamanthula Jatara. Hence giving Honorarium /donations was stopped. Now both sides agreed to accept and honor the old terms and conditions to get equal share.                                                          View images from this file (2)                                    ","EAP201/1/8/1","2 TIFF images","Document","File","Telugu","Telugu","01 Feb 1942","Access is for research purposes only.","https://images.eap.bl.uk/EAP201/EAP201_1_8_1/1.jp2/full/!600,300/0/default.jpg"
"70","Hakku Patra of Nilakanteshwar Rao","        Contributor / Caste / Performance: Terachiralavaru. Medium of original material: copper plate.                                                          View images from this file (1)                                    ","EAP201/1/8/2","1 TIFF image","Manuscript","File","Telugu","Telugu","17th century-19th cenutry","Access is for research purposes only.","https://images.eap.bl.uk/EAP201/EAP201_1_8_2/1.jp2/full/!600,300/0/default.jpg"
"71","Hakku Patra of Gurumurthy","        Contributor / Caste / Performance: Terachiralavaru. Medium of original material: copper plate.                                                          View images from this file (1)                                    ","EAP201/1/8/3","1 TIFF image","Manuscript","File","Telugu","Telugu","17th century-19th cenutry","Access is for research purposes only.","https://images.eap.bl.uk/EAP201/EAP201_1_8_3/1.jp2/full/!600,300/0/default.jpg"
"72","Hakku Patra of Kolli Gangaraju","        Contributor / Caste / Performance: Terachiralavaru. Medium of original material: copper plate.                                                          View images from this file (1)                                    ","EAP201/1/8/4","1 TIFF image","Manuscript","File","Telugu","Telugu","17th century-19th cenutry","Access is for research purposes only.","https://images.eap.bl.uk/EAP201/EAP201_1_8_4/1.jp2/full/!600,300/0/default.jpg"
"73","Hakku Patra of Kolli Ramana","        Contributor / Caste / Performance: Terachiralavaru. Medium of original material: copper plate.                                                          View images from this file (1)                                    ","EAP201/1/8/5","1 TIFF image","Manuscript","File","Telugu","Telugu","17th century-19th cenutry","Access is for research purposes only.","https://images.eap.bl.uk/EAP201/EAP201_1_8_5/1.jp2/full/!600,300/0/default.jpg"
"74","Hakku Patra of Bhonagiri Veeraswamy [17th Century ]","        Contributor / Caste / Performance: Patam Chakali . Medium of original material: copper sheet square and rectangle. Description of material: It is a rectangular copper plate cut into cusp form. A Shivalinga and two Nandi’s are engraved on both sides of the plate. Upper part of the plate have engraved floral designs lower part has a symbolic snake. Front side is better in appearance than rear side. It in more damaged.                                                          View images from this file (2)                                    ","EAP201/1/9/1","2 TIFF images","Manuscript","File","Telugu","Telugu","17th Century","Access is for research purposes only.","https://images.eap.bl.uk/EAP201/EAP201_1_9_1/1.jp2/full/!600,300/0/default.jpg"
"75","Hakku Patra of Patamkoti Sambaiah","        Contributor / Caste / Performance: Patam Chakali. Medium of original material: copper plate.                                                          View images from this file (1)                                    ","EAP201/1/9/2","1 TIFF image","Manuscript","File","Telugu","Telugu","17th century-19th cenutry","Access is for research purposes only.","https://images.eap.bl.uk/EAP201/EAP201_1_9_2/1.jp2/full/!600,300/0/default.jpg"
"76","Hakku Patra of Patamkoti Krishna","        Contributor / Caste / Performance: Patam Chakali. Medium of original material: copper plate.                                                          View images from this file (1)                                    ","EAP201/1/9/3","1 TIFF image","Manuscript","File","Telugu","Telugu","17th century-19th cenutry","Access is for research purposes only.","https://images.eap.bl.uk/EAP201/EAP201_1_9_3/1.jp2/full/!600,300/0/default.jpg"
"77","Hakku Patra of Chenchu Mandala Narasimha [18th Century ]","        Contributor / Caste / Performance: Chenchuvaru. Medium of original material: Copper sheets, one square and another rectangular. Description of material: The plate has seven cusp arch form. The plate is in rectangular shape. The plate is small in size. At the front of the plate one vaishnava religious symbol is painted. This copper plate was issued during a period of Krishan Prashad, who was a Prime Minister of VII Nizam (1870 – 1930 approximately). The Patti (area of the 40 villages) mentioned in the inscription which include Suryapet, Miriyalaguda, Nalgonda, Devarakonda, Khammam. The inscription orders that every house in this region should give Manaid (3 Kg.) grains and Rs. 50/-. Every Dalit family should give One Tavva (1¼ Kg.) of grain and Rs. 10/- to the performer community. All these villagers have to respect this order by not giving to the communities whose names are not mentioned in this copper plate.                                                          View images from this file (2)                                    ","EAP201/1/10/1","2 TIFF images","Manuscript","File","Telugu, Urdu","Telugu","18th Century","Access is for research purposes only.","https://images.eap.bl.uk/EAP201/EAP201_1_10_1/1.jp2/full/!600,300/0/default.jpg"
"78","Hakku Patra of Mandala Ramulu [18th Century ]","        Contributor / Caste / Performance: Chenchuvaru. Medium of original material: copper plate on both sides. Description of material: The upper part of this copper plate is cut into seven cusp arch pattern. The top of the plate is painted with white and red colours. This pattern of colour symbolically represent the vaishnava religion. The content of the copper plate described the origin of the Chenchu tribe. At the time of genesis of the world, this Shasanam (inscription) appeared. According to this inscription the villages of Juluru, Papkallu, Madira Taluq, Siri Puram, Balakonda, Kothagudem, Illendu and other Territories were given to Gunugujjulu Ramadiya son of Muthaylu. Kapu (cultivator’s community) and Karanam (revenue record keeper) have to support and recognized the matter described in the copper inscription.                                                          View images from this file (2)                                    ","EAP201/1/10/2","2 TIFF images","Manuscript","File","Telugu, Urdu","Telugu","18th Century","Access is for research purposes only.","https://images.eap.bl.uk/EAP201/EAP201_1_10_2/1.jp2/full/!600,300/0/default.jpg"
"79","Hakku Patra of Mandalam Peda Venkanna","        Contributor / Caste / Performance: Chenchuvaru. Medium of original material: copper plate.                                                          View images from this file (1)                                    ","EAP201/1/10/3","1 TIFF image","Manuscript","File","Telugu, Urdu","Telugu","17th century-19th cenutry","Access is for research purposes only.","https://images.eap.bl.uk/EAP201/EAP201_1_10_3/1.jp2/full/!600,300/0/default.jpg"
"80","Hakku Patra of Mandalam China Venkanna","        Contributor / Caste / Performance: Chenchuvaru. Medium of original material: copper plate.                                                          View images from this file (1)                                    ","EAP201/1/10/4","1 TIFF image","Manuscript","File","Telugu, Urdu","Telugu","17th century-19th cenutry","Access is for research purposes only.","https://images.eap.bl.uk/EAP201/EAP201_1_10_4/1.jp2/full/!600,300/0/default.jpg"
"81","Hakku Patra of Gujjala Srinu","        Contributor / Caste / Performance: Chenchuvaru. Medium of original material: copper plate.                                                          View images from this file (1)                                    ","EAP201/1/10/5","1 TIFF image","Manuscript","File","Telugu, Urdu","Telugu","17th century-19th cenutry","Access is for research purposes only.","https://images.eap.bl.uk/EAP201/EAP201_1_10_5/1.jp2/full/!600,300/0/default.jpg"
"82","Hakku Patra of Gujjala Ramesh","        Contributor / Caste / Performance: Chenchuvaru. Medium of original material: copper plate.                                                          View images from this file (1)                                    ","EAP201/1/10/6","1 TIFF image","Manuscript","File","Telugu","Telugu","17th century-19th cenutry","Access is for research purposes only.","https://images.eap.bl.uk/EAP201/EAP201_1_10_6/1.jp2/full/!600,300/0/default.jpg"
"83","Hakku Patra of Avula Jagannadham","        Contributor / Caste / Performance: Chenchuvaru (Bhagotham). Medium of original material: paper documents.                                                          View images from this file (1)                                    ","EAP201/1/10/7","1 TIFF image","Document","File","Telugu","Telugu","17th century-19th cenutry","Access is for research purposes only.","https://images.eap.bl.uk/EAP201/EAP201_1_10_7/1.jp2/full/!600,300/0/default.jpg"
